"Lebanese","Mediterranean",,,,,,,,,,,,,,,,,,,,,,,,,,,,,,,,,,,,,,,,,,,,,,,,,,,,,,,,,,"http://www.cedarsnairobi.com/",,"294207","Nairobi","Municipality",,"294206","Kenya","Country",,,,,,,,,,,,,,,,,"Nairobi","Kenya",,,"United Nations Avenue",,,,,,,,,,,,,,,,,,,,,,,,,,,,,,,,"Restaurants",,,,,,,,,,,,,,,,,,,,,,,,,,,,,,,,,,,,,,,,,,,,,,,,,,,,,,,,,,,,,,,"restaurant","832","392","Cedars",,"United Nations Avenue, Nairobi Kenya","https://www.tripadvisor.com/Restaurant_Review-g294207-d23521220-Reviews-Cedars-Nairobi.html","-1.283211","36.814068",,,"0","0","0","0","3",,"RESTAURANT",,"5",,"",,"Nairobi",,"#392 of 1,048 places to eat in Nairobi",,"0",,"3.0912537574768066",,"3","false","false","23521220"
,,,,,,,,,,,,,,,,,,,,,,,,,,,,,,,,,,,,,,,,,,,,,,,,,,,,,,,,,,,"http://www.fairmont.com",,"294207","Nairobi","Municipality",,"294206","Kenya","Country",,,,,,,,,,,,,,,,,"Nairobi","Kenya",,,"Harry Thuku Road","Fairmont The Norfolk",,,,,,,,,,,,,,,,,,,,,,,,,,,,,,,"Restaurants",,,,,,,,,,,,,,,,,,,,,,,,,,,,,,,,,,,,,,,,,,,,,,,,,,,,,,,,,,,,,,"Sit down","restaurant","832","377","Cin Cin Bar","KES 1,482 - KES 7,412","Harry Thuku Road Fairmont The Norfolk, Nairobi Kenya","https://www.tripadvisor.com/Restaurant_Review-g294207-d8708749-Reviews-Cin_Cin_Bar-Nairobi.html","-1.27794","36.81546","20484493","Nairobi Central Business District","0","0","1","3","3","+254 20 2265000","RESTAURANT","kenya.reservations@fairmont.com","4.5",,"",,"Nairobi",,"#377 of 1,048 places to eat in Nairobi","https://media-cdn.tripadvisor.com/media/photo-o/0e/a8/52/9e/20170308-202643-largejpg.jpg","11",,"3.097470283508301","$$ - $$$","7","false","false","8708749"
"American","International","African",,,,,,,,,,,,,,"Africa/Nairobi","1380","390",,,,,"1380","390",,,,,"1380","390",,,,,"1380","390",,,,,"1380","390",,,,,"1380","390",,,,,"1380","390",,,,,"http://www.bwexecutiveresidencynairobi.co.ke/restaurant-bar/",,"294207","Nairobi","Municipality",,"294206","Kenya","Country",,,,,"Breakfast","Lunch","Dinner","Drinks",,,"Breakfast","Lunch","Dinner","Drinks",,,"Nairobi","Kenya","00100",,"Corner of Riverside Drive and Riverside Grove",,"Delivery","Buffet","Seating","Accepts Credit Cards",,,,,,,,,,,,,,,,,,,,,,,,,,,"Restaurants",,,,,,,,,,,,,,,,,,,,,,,,,,,,,,,,,,,,,,,,,,,,,,,,,,,,,,,,,,,,,,"Sit down","restaurant","832","376","The Grove Restaurant","KES 222,354 - KES 444,708","Corner of Riverside Drive and Riverside Grove, Nairobi 00100 Kenya","https://www.tripadvisor.com/Restaurant_Review-g294207-d12453369-Reviews-The_Grove_Restaurant-Nairobi.html","-1.26841","36.78581",,,"1","0","2","2","5","+254 727 407167","RESTAURANT","reservations@bwexecutiveresidencynairobi.co.ke","4","https://www.bwexecutiveresidencynairobi.co.ke/restaurant.php","","The Grove Restaurant located at the Rooftop provides breath taking views as you unwind from the hustle and bustle of the city. There are plenty of options when it comes to enjoying bitings and beverages while taking in panoramic views of the surrounding areas.","Nairobi",,"#376 of 1,048 places to eat in Nairobi","https://media-cdn.tripadvisor.com/media/photo-m/1280/28/77/28/07/restaurant.jpg","107","Open Now","3.0980031490325928","$$ - $$$","10","false","false","12453369"
"African",,,,,,,,,,,,,,,,,,,,,,,,,,,,,,,,,,,,,,,,,,,,,,,,,,,,,,,,,,,,,"294207","Nairobi","Municipality",,"294206","Kenya","Country",,,,,,,,,,,,,,,,,"Nairobi","Kenya",,,"Chaka Road",,,,,,,,,,,,,,,,,,,,,,,,,,,,,,,,"Restaurants",,,,,,,,,,,,,,,,,,,,,,,,,,,,,,,,,,,,,,,,,,,,,,,,,,,,,,,,,,,,,,,"restaurant","832","383","Amalayi African Cuisine",,"Chaka Road, Nairobi Kenya","https://www.tripadvisor.com/Restaurant_Review-g294207-d12154668-Reviews-Amalayi_African_Cuisine-Nairobi.html","-1.29162","36.82149","20484493","Nairobi Central Business District","0","0","0","2","2","+254 796 309979","RESTAURANT",,"4.5",,"",,"Nairobi",,"#383 of 1,048 places to eat in Nairobi","https://media-cdn.tripadvisor.com/media/photo-o/11/5f/79/a9/caption.jpg","13",,"3.09643292427063",,"4","false","false","12154668"
"Bar","Pub",,,,,,,,,,,,,,,,,,,,,,,,,,,,,,,,,,,,,,,,,,,,,,,,,,,,,,,,,,,,"294207","Nairobi","Municipality",,"294206","Kenya","Country",,,,,"Breakfast",,,,,,"Breakfast",,,,,,"Nairobi","Kenya","",,"Ojijo Street, Parklands","","Outdoor Seating","Reservations","Buffet",,,,,,,,,,,,,,,,,,,,,,,,,,,,"Restaurants",,,,,,,,,,,,,,,,,,,,,,,,,,,,,,,,,,,,,,,,,,,,,,,,,,,,,,,,,,,,,,"Fast food","restaurant","832","394","Pitcher & Butch",,"Ojijo Street, Parklands, Nairobi Kenya","https://www.tripadvisor.com/Restaurant_Review-g294207-d1126608-Reviews-Pitcher_Butch-Nairobi.html","-1.26887","36.81223",,,"0","0","5","7","4","3742149 / 3751310","RESTAURANT",,"4",,"",,"Nairobi",,"#394 of 1,048 places to eat in Nairobi","https://media-cdn.tripadvisor.com/media/photo-o/0d/c7/4e/40/photo2jpg.jpg","3",,"3.090824842453003","$$ - $$$","16","false","false","1126608"
,,,,,,,,,,,,,,,,,,,,,,,,,,,,,,,,,,,,,,,,,,,,,,,,,,,,,,,,,,,,,"294207","Nairobi","Municipality",,"294206","Kenya","Country",,,,,,,,,,,,,,,,,"Nairobi","Kenya",,,"Krishna Center, 7th Floor, 12 Woodvale Grove, Westlands",,,,,,,,,,,,,,,,,,,,,,,,,,,,,,,,"Restaurants",,,,,,,,,,,,,,,,,,,,,,,,,,,,,,,,,,,,,,,,,,,,,,,,,,,,,,,,,,,,,,,"restaurant","832","381","Vista",,"Krishna Center, 7th Floor, 12 Woodvale Grove, Westlands, Nairobi Kenya","https://www.tripadvisor.com/Restaurant_Review-g294207-d5773487-Reviews-Vista-Nairobi.html","-1.264351","36.80369",,,"0","0","2","6","3","+254 729 418241","RESTAURANT",,"4",,"",,"Nairobi",,"#381 of 1,048 places to eat in Nairobi","https://media-cdn.tripadvisor.com/media/photo-o/11/d5/81/bf/caption.jpg","15",,"3.0969126224517822","$$ - $$$","11","false","false","5773487"
,,,,,,,,,,,,,,,,,,,,,,,,,,,,,,,,,,,,,,,,,,,,,,,,,,,,,,,,,,,"http://www.gizani.com",,"294207","Nairobi","Municipality",,"294206","Kenya","Country",,,,,,,,,,,,,,,,,"Nairobi","Kenya",,,"Tribe Hotel","Gigiri","Reservations",,,,,,,,,,,,,,,,,,,,,,,,,,,,,,"Restaurants",,,,,,,,,,,,,,,,,,,,,,,,,,,,,,,,,,,,,,,,,,,,,,,,,,,,,,,,,,,,,,"Fast food","restaurant","832","407","Gizani- Dinner in the Dark",,"Tribe Hotel Gigiri, Nairobi Kenya","https://www.tripadvisor.com/Restaurant_Review-g294207-d8052270-Reviews-Gizani_Dinner_in_the_Dark-Nairobi.html","-1.226425","36.805405","20484492","Highridge","0","1","1","2","6","+254 715 880550","RESTAURANT",,"4.5",,"",,"Nairobi",,"#407 of 1,048 places to eat in Nairobi","https://media-cdn.tripadvisor.com/media/photo-o/07/ec/00/01/gizani-dinner-in-the.jpg","1",,"3.0828895568847656","$$$$","10","false","false","8052270"
,,,,,,,,,,,,,,,,"Africa/Nairobi","1380","660",,,,,"1380","660",,,,,"1380","660",,,,,"1380","660",,,,,"1380","660",,,,,"1380","660",,,,,"1380","660",,,,,"http://igizalounge.com/",,"294207","Nairobi","Municipality",,"294206","Kenya","Country",,,,,"Late Night","Drinks","Lunch","Dinner",,,"Late Night","Drinks","Lunch","Dinner",,,"Nairobi","Kenya","00200",,"Harry Thuku Road","National Theater","Reservations",,,,,,,,,,,,,,,,,,,,,,,,,,,,,,"Restaurants",,,,,,,,,,,,,,,,,,,,,,,,,,,,,,,,,,,,,,,,,,,,,,,,,,,,,,,,,,,,,,,"restaurant","832","375","Igiza Lounge",,"Harry Thuku Road National Theater, Nairobi 00200 Kenya","https://www.tripadvisor.com/Restaurant_Review-g294207-d12031873-Reviews-Igiza_Lounge-Nairobi.html","-1.27793","36.81545","20484493","Nairobi Central Business District","0","0","1","1","5","+254 705 333939","RESTAURANT","info@igizalounge.com","4.5",,"","A creative restaurant and lounge located at the Kenya National Theatre. Historically, artist of many talents would enjoy their time between performances discussing creative ideas at the Kenya National Theatre. Igiza Lounge continues this history of sharing and exploring creativity by offering a relaxed space for theatre patrons and guests to enjoy beverages, food and music. Located inside the Kenya National Theatre, Igiza Lounge offers indoor and outdoor dining experiences, a full-service bar and comfortable sofa seating. The menu consists of a mix of Kenyan dishes, homemade pizza, vibrant cocktails, wine, spirits and local beers.","Nairobi",,"#375 of 1,048 places to eat in Nairobi","https://media-cdn.tripadvisor.com/media/photo-o/0f/8f/9f/49/meet-friends-enjoyed.jpg","13","Open Now","3.0982353687286377",,"7","false","false","12031873"
"Bar","Pub",,,,,,,,,,,,,,,,,,,,,,,,,,,,,,,,,,,,,,,,,,,,,,,,,,,,,,,,,,"https://sina-shaka-by-bateleur-brewery.business.site/?utm_source=gmb&utm_medium=referral",,"294207","Nairobi","Municipality",,"294206","Kenya","Country",,,,,,,,,,,,,,,,,"Nairobi","Kenya","15808",,"Limuru Road","Village Market",,,,,,,,,,,,,,,,,,,,,,,,,,,,,,,"Restaurants",,,,,,,,,,,,,,,,,,,,,,,,,,,,,,,,,,,,,,,,,,,,,,,,,,,,,,,,,,,,,,,"restaurant","832","370","Sina Shaka Bateleur Brewery",,"Limuru Road Village Market, Nairobi 15808 Kenya","https://www.tripadvisor.com/Restaurant_Review-g294207-d17782815-Reviews-Sina_Shaka_Bateleur_Brewery-Nairobi.html","-1.23505","36.80421","20484492","Highridge","0","0","0","3","2","+254 799 447252","RESTAURANT",,"4.5",,"",,"Nairobi",,"#370 of 1,048 places to eat in Nairobi","https://media-cdn.tripadvisor.com/media/photo-m/1280/1a/ba/3a/6b/photo0jpg.jpg","1",,"3.099881172180176",,"5","false","false","17782815"
"Cafe",,,,,,,,,,,,,,,,"Africa/Nairobi","1320","480",,,,,"1260","420",,,,,"1260","420",,,,,"1260","420",,,,,"1260","420",,,,,"1260","420",,,,,"1320","480",,,,,"https://www.facebook.com/Voguecafe.co.ke",,"294207","Nairobi","Municipality",,"294206","Kenya","Country",,,,,"Breakfast","Lunch","Dinner",,,,"Breakfast","Lunch","Dinner",,,,"Nairobi","Kenya",,,"Westlands Road","The National Museum of Kenya and Nivina Towers","Seating","Takeout","Wheelchair Accessible",,,,,,,,,,,,,,,,,,,,,,,,,,,,"Restaurants",,,,,,,,,,,,,,,,,,,,,,,,,,,,,,,,,,,,,,,,,,,,,,,,,,,,,,,,,,,,,,,"restaurant","832","405","Vogue Cafe",,"Westlands Road The National Museum of Kenya and Nivina Towers, Nairobi Kenya","https://www.tripadvisor.com/Restaurant_Review-g294207-d7742889-Reviews-Vogue_Cafe-Nairobi.html","-1.274376","36.814632","20484493","Nairobi Central Business District","2","4","6","10","7","+254 718 896395","RESTAURANT","voguecafe2011@gmail.com","3.5",,"",,"Nairobi",,"#405 of 1,048 places to eat in Nairobi","https://media-cdn.tripadvisor.com/media/photo-o/07/b7/97/ee/the-inside.jpg","17","Closed Now","3.0843505859375","$$ - $$$","29","false","false","7742889"
"Italian","Northern-Italian","Central-Italian","Southern-Italian",,,,,,,,,,,,,"Africa/Nairobi","1350","600",,,,,"1350","600",,,,,"1350","600",,,,,"1350","600",,,,,"1350","600",,,,,"1350","600",,,,,"1350","600",,,,,"http://lacasadinicoristorante.com",,"294207","Nairobi","Municipality",,"294206","Kenya","Country",,,,,"Breakfast","Lunch","Dinner","Late Night","Drinks",,"Breakfast","Lunch","Dinner","Late Night","Drinks",,"Nairobi","Kenya","00200",,"Village Market Mall Gigiri","East wing First floor","Delivery","Takeout","Reservations","Outdoor Seating","Private Dining","Seating","Parking Available","Validated Parking","Television","Highchairs Available","Wheelchair Accessible","Serves Alcohol","Full Bar","Wine and Beer","Digital Payments","Cash Only","Free Wifi","Accepts Credit Cards","Table Service","Live Music","Jazz Bar","Drive Thru","Family style","Sports bars","Gift Cards Available",,,,,,"Restaurants",,,,,,,,,,,,,,,,,,,,,,,,,,,,,,,,,,,,,,,,,,,,,,,,,,,,,,,,,,,,,,"Sit down","restaurant","832","367","La Casa Di Nico Ristorante","KES 2,224 - KES 44,471","Village Market Mall Gigiri East wing First floor, Nairobi 00200 Kenya","https://www.tripadvisor.com/Restaurant_Review-g294207-d23642043-Reviews-La_Casa_Di_Nico_Ristorante-Nairobi.html","-1.228776","36.805183","20484492","Highridge","0","2","0","1","5","+254 796 857990","RESTAURANT","lacasadinicorestorante@gmail.com","4","https://lacasadinicoristorante.com/menu/","","Lacasadinico Ristorante is a state of the art simply decorated restaurant. A local kenyan italian favorite for 5+ years. Featuring our famous Antipasto italiano with salami cheese and our well known wood oven pizza. Enjoy our homemade, delicious Italian dishes, featuring seafood, steaks, and pasta. We provide to you our Full menu offered all day and late night. Complemented with a bar of entertainment on weekends and Fridays. Cast parties and celebs with your loved ones here every single day. Conveniently located on Limuru road, Village Market ,left wing First floor.","Nairobi",,"#367 of 1,048 places to eat in Nairobi","https://media-cdn.tripadvisor.com/media/photo-o/1e/88/76/4f/cover-photo.jpg","70","Open Now","3.1019859313964844","$$$$","8","false","false","23642043"
"African","Bar","Grill","Pub","Vegetarian Friendly",,,,,,,,,,,,,,,,,,,,,,,,,,,,,,,,,,,,,,,,,,,,,,,,,,,,,,,"http://www.sanvalencia.com/valenciagardens/",,"294207","Nairobi","Municipality",,"294206","Kenya","Country",,,,,"Lunch","Dinner",,,,,"Lunch","Dinner",,,,,"Nairobi","Kenya","00100",,"Riara Road","Inside the Kenya Nairobi Museum","Seating","Reservations","Wheelchair Accessible","Table Service",,,,,,,,,,,,,,,,,,,,,,,,,,,"Restaurants","Bars & Pubs",,,,,,,,,,,,,,,,,,,,,,,,,,,,,,,,,,,,,,,,,,,,,,,,,,,,,,,,,,,,,"Sit down","restaurant","832","368","Valencia Gardens",,"Riara Road Inside the Kenya Nairobi Museum, Nairobi 00100 Kenya","https://www.tripadvisor.com/Restaurant_Review-g294207-d4101759-Reviews-Valencia_Gardens-Nairobi.html","-1.29801","36.76505",,,"0","2","6","8","4","+254 710 600925","RESTAURANT","info@sanvalencia.com","3.5",,"","Located in the leafy suburbs of Lavington on Riara Road of Kinga'ra Road, Valencia Gardens, the flagship of the Group is fronted by the Victorian style main restaurant building with two dinning areas large enough to hold private parties and an annexe for total privacy. Upstairs are two lounges which guarantee total privacy. They are tastily furnished and equipped with flat screen television sets. A waiter at hand provides tailor made services and trained to spoil one with choice. The boardroom with a balcony offers a bird-eye view of the expansive lush green garden surrounded by century-old trees and variety of well tended flower beds. Designed at two teir levels, the gardens is ideal for family dinning, social functions such as corporate parties and weddings. The picture is not complete without the welcoming terrace bar with an L shaped counter. It is stocked with every conceivable brands of alcoholic and non alcoholic beverages. The coffee shops offers mouth watering pastry and bitings. The menu varies between ala carte and buffet on order and nothing can beat the Choma Ranch.","Nairobi",,"#368 of 1,048 places to eat in Nairobi","https://media-cdn.tripadvisor.com/media/photo-o/07/14/0d/d7/valencia-garden.jpg","11",,"3.100576639175415","$$ - $$$","20","false","false","4101759"
,,,,,,,,,,,,,,,,"Africa/Nairobi","1380","540",,,,,"1380","540",,,,,"1380","540",,,,,"1380","540",,,,,"1380","540",,,,,"1380","540",,,,,"1380","540",,,,,"http://www.facebook.com/pages/AIN-guest-house-little-Korea-in-Nairobi/154421997954115",,"294207","Nairobi","Municipality",,"294206","Kenya","Country",,,,,"Breakfast","Lunch","Dinner",,,,"Breakfast","Lunch","Dinner",,,,"Nairobi","Kenya","00100",,"Argwings Kodhek Road","Between Java House and Barcalys Bank, Hurlingham",,,,,,,,,,,,,,,,,,,,,,,,,,,,,,,"Restaurants",,,,,,,,,,,,,,,,,,,,,,,,,,,,,,,,,,,,,,,,,,,,,,,,,,,,,,,,,,,,,,,"restaurant","832","371","Ain",,"Argwings Kodhek Road Between Java House and Barcalys Bank, Hurlingham, Nairobi 00100 Kenya","https://www.tripadvisor.com/Restaurant_Review-g294207-d12513292-Reviews-Ain-Nairobi.html","-1.296442","36.798737","20484494","Upper Hill Estate","2","0","0","3","7","+254 722 732722","RESTAURANT",,"4",,"",,"Nairobi",,"#371 of 1,048 places to eat in Nairobi","https://media-cdn.tripadvisor.com/media/photo-o/0f/84/31/1d/caption.jpg","14","Open Now","3.0997045040130615","$$ - $$$","12","false","false","12513292"
"Fast Food","American",,,,,,,,,,,,,,,,,,,,,,,,,,,,,,,,,,,,,,,,,,,,,,,,,,,,,,,,,,,,"294207","Nairobi","Municipality",,"294206","Kenya","Country",,,,,"Lunch","Dinner",,,,,"Lunch","Dinner",,,,,"Nairobi","Kenya",,,"Mpaka Road","Westlands","Takeout",,,,,,,,,,,,,,,,,,,,,,,,,,,,,,"Quick Bites",,,,,,,,,,,,,,,,,,,,,,,,,,,,,,,,,,,,,,,"Fish",,,,,,,,,,,,,,,,,,,,,,,"Sit down","restaurant","832","503","McFrys",,"Mpaka Road Westlands, Nairobi Kenya","https://www.tripadvisor.com/Restaurant_Review-g294207-d3800102-Reviews-McFrys-Nairobi.html","-1.26472","36.80488",,,"7","3","13","9","11",,"RESTAURANT",,"3.5",,"",,"Nairobi",,"#503 of 1,048 places to eat in Nairobi","https://media-cdn.tripadvisor.com/media/photo-o/0f/b4/86/9d/caption.jpg","9",,"3.0559964179992676","$","43","false","false","3800102"
"French","Mediterranean",,,,,,,,,,,,,,,,,,,,,,,,,,,,,,,,,,,,,,,,,,,,,,,,,,,,,,,,,,"http://www.lmrhotel.com/rendezvous-restaurant/",,"294207","Nairobi","Municipality",,"294206","Kenya","Country",,,,,,,,,,,,,,,,,"Nairobi","Kenya",,,"Mogotio Road 09","In Hotel Mason Royale",,,,,,,,,,,,,,,,,,,,,,,,,,,,,,,"Restaurants",,,,,,,,,,,,,,,,,,,,,,,,,,,,,,,,,,,,,,,,,,,,,,,,,,,,,,,,,,,,,,,"restaurant","832","642","Restaurant Rendevous",,"Mogotio Road 09 In Hotel Mason Royale, Nairobi Kenya","https://www.tripadvisor.com/Restaurant_Review-g294207-d13480200-Reviews-Restaurant_Rendevous-Nairobi.html","-1.26389","36.80801",,,"0","0","2","0","1",,"RESTAURANT",,"3.5",,"",,"Nairobi",,"#642 of 1,048 places to eat in Nairobi",,"0",,"3.0264697074890137",,"3","false","false","13480200"
"African","Moroccan","Mediterranean",,,,,,,,,,,,,,"Africa/Nairobi","1200","420",,,,,"1260","390",,,,,"1260","390",,,,,"1260","390",,,,,"1260","390",,,,,"1260","390",,,,,"1200","420",,,,,"http://www.facebook.com/Aromahtherestaurant/",,"294207","Nairobi","Municipality",,"294206","Kenya","Country",,,,,"Breakfast","Lunch","Dinner",,,,"Breakfast","Lunch","Dinner",,,,"Nairobi","Kenya","00515",,"Koinange Street","Consolidated Bank Building",,,,,,,,,,,,,,,,,,,,,,,,,,,,,,,"Restaurants",,,,,,,,,,,,,,,,,,,,,,,,,,,,,,,,,,,,,,,,,,,,,,,,,,,,,,,,,,,,,,"Sit down","restaurant","832","406","Aromah The Restaurant","KES 29,647 - KES 118,589","Koinange Street Consolidated Bank Building, Nairobi 00515 Kenya","https://www.tripadvisor.com/Restaurant_Review-g294207-d13423075-Reviews-Aromah_The_Restaurant-Nairobi.html","-1.282934","36.817818","20484493","Nairobi Central Business District","0","0","0","1","3","+254 715 981921","RESTAURANT","africanaromah@gmail.com","5",,"","Our African restaurant is situated in the uptown part of the central business center.The ambience is cool and attractive, our pieces of art calm will calm your spirits and out tastey foods will keep you coming back for more! We have awesome customer service, outside catering facilities, office deliveries, accommodate graduation parties & baby showers. Welcome & karibu sana!","Nairobi",,"#406 of 1,048 places to eat in Nairobi","https://media-cdn.tripadvisor.com/media/photo-o/11/fc/e2/c5/fish-is-too-amazing.jpg","6","Closed Now","3.0841259956359863","$","4","false","false","13423075"
"European","Cafe","Vegetarian Friendly",,,,,,,,,,,,,,,,,,,,,,,,,,,,,,,,,,,,,,,,,,,,,,,,,,,,,,,,,"http://www.artcaffe.co.ke/",,"294207","Nairobi","Municipality",,"294206","Kenya","Country",,,,,"Breakfast","Lunch","Dinner",,,,"Breakfast","Lunch","Dinner",,,,"Nairobi","Kenya",,,"Oval Branch",,"Outdoor Seating","Seating","Serves Alcohol","Free Wifi","Takeout","Reservations","Parking Available","Wheelchair Accessible",,,,,,,,,,,,,,,,,,,,,,,"Restaurants",,,,,,,,,,,,,,,,,,,,,,,,,,,,,,,,,,,,,,,"Pasta","Burger","Salad","Pesto",,,,,,,,,,,,,,,,,,,,"Café","restaurant","832","374","Artcaffe Coffee & Bakery",,"Oval Branch, Nairobi Kenya","https://www.tripadvisor.com/Restaurant_Review-g294207-d7930429-Reviews-Artcaffe_Coffee_Bakery-Nairobi.html","-1.258734","36.805504",,,"12","7","9","31","20","+254 717 193895","RESTAURANT",,"3.5","http://www.artcaffe.co.ke/menu/","",,"Nairobi",,"#374 of 1,048 places to eat in Nairobi","https://media-cdn.tripadvisor.com/media/photo-o/09/73/35/f8/photo1jpg.jpg","45",,"3.098269462585449","$$ - $$$","79","false","false","7930429"
"Asian","Thai",,,,,,,,,,,,,,,,,,,,,,,,,,,,,,,,,,,,,,,,,,,,,,,,,,,,,,,,,,"http://www.sankara.com",,"294207","Nairobi","Municipality",,"294206","Kenya","Country",,,,,"Dinner",,,,,,"Dinner",,,,,,"Nairobi","Kenya",,,"Sankara Hotel, Woodvale Grove,","Westlands,","Reservations","Seating","Table Service",,,,,,,,,,,,,,,,,,,,,,,,,,,,"Restaurants",,,,,,,,,,,,,,,,,,,,,,,,,,,,,,,,,,,,,,,,,,,,,,,,,,,,,,,,,,,,,,"Sit down","restaurant","832","675","Muhibbah",,"Sankara Hotel, Woodvale Grove, Westlands,, Nairobi Kenya","https://www.tripadvisor.com/Restaurant_Review-g294207-d3845511-Reviews-Muhibbah-Nairobi.html","-1.26303","36.80328",,,"2","1","3","7","1",,"RESTAURANT",,"3.5",,"",,"Nairobi",,"#675 of 1,048 places to eat in Nairobi",,"0",,"3.0201470851898193",,"14","false","false","3845511"
"Indian","Cafe","Fast Food","Arabic",,,,,,,,,,,,,"Africa/Nairobi","1425","540",,,,,"1425","540",,,,,"1425","540",,,,,"1425","540",,,,,"1425","540",,,,,"1425","540",,,,,"1425","540",,,,,,,"294207","Nairobi","Municipality",,"294206","Kenya","Country",,,,,"Breakfast","Lunch","Dinner","Brunch","Drinks",,"Breakfast","Lunch","Dinner","Brunch","Drinks",,"Nairobi","Kenya","12344",,"Pangani Shopping Centre","+254 724977175","Delivery","Reservations","Outdoor Seating","Free Wifi","Drive Thru","Non-smoking restaurants",,,,,,,,,,,,,,,,,,,,,,,,,"Restaurants",,,,,,,,,,,,,,,,,,,,,,,,,,,,,,,,,,,,,,,,,,,,,,,,,,,,,,,,,,,,,,,"restaurant","832","452","Arabyz Restaurant",,"Pangani Shopping Centre +254 724977175, Nairobi 12344 Kenya","https://www.tripadvisor.com/Restaurant_Review-g294207-d24023239-Reviews-Arabyz_Restaurant-Nairobi.html","-1.26747","36.837585",,,"0","0","0","0","2","+254 724 977175","RESTAURANT","arabiz002000@gmail.com","5",,"",,"Nairobi",,"#452 of 1,048 places to eat in Nairobi","https://media-cdn.tripadvisor.com/media/photo-w/23/49/0a/24/caption.jpg","3","Open Now","3.0718162059783936",,"2","false","false","24023239"
,,,,,,,,,,,,,,,,"Africa/Nairobi","1320","600",,,,,"1320","600",,,,,"1320","600",,,,,"1320","600",,,,,"1320","600",,,,,"1320","600",,,,,"1320","600",,,,,"https://www.facebook.com/Jia-Yuan-Shi-Fu-Chinese-Restaurant-1375281999359136/?ref=page_internal",,"294207","Nairobi","Municipality",,"294206","Kenya","Country",,,,,"Lunch","Dinner",,,,,"Lunch","Dinner",,,,,"Nairobi","Kenya",,,"Loita Street","Pension House Mezz1",,,,,,,,,,,,,,,,,,,,,,,,,,,,,,,"Restaurants",,,,,,,,,,,,,,,,,,,,,,,,,,,,,,,,,,,,,,,,,,,,,,,,,,,,,,,,,,,,,,,"restaurant","832","402","Jia Yuan Shi Fu Restaurant",,"Loita Street Pension House Mezz1, Nairobi Kenya","https://www.tripadvisor.com/Restaurant_Review-g294207-d15188480-Reviews-Jia_Yuan_Shi_Fu_Restaurant-Nairobi.html","-1.28381","36.81769","20484493","Nairobi Central Business District","0","0","0","2","2","+254 726 703309","RESTAURANT","jachochi@yahoo.com","4.5",,"",,"Nairobi",,"#402 of 1,048 places to eat in Nairobi","https://media-cdn.tripadvisor.com/media/photo-w/15/3d/bb/bc/jia-yuan-shi-fu-restaurant.jpg","2","Open Now","3.086395740509033",,"4","false","false","15188480"
"French",,,,,,,,,,,,,,,,,,,,,,,,,,,,,,,,,,,,,,,,,,,,,,,,,,,,,,,,,,,"https://www.facebook.com/frenchlabelleepoquerestau/",,"294207","Nairobi","Municipality",,"294206","Kenya","Country",,,,,,,,,,,,,,,,,"Nairobi","Kenya","14883",,"Monrovia/Loita Street","Alliance Française de Nairobi",,,,,,,,,,,,,,,,,,,,,,,,,,,,,,,"Restaurants",,,,,,,,,,,,,,,,,,,,,,,,,,,,,,,,,,,,,,,,,,,,,,,,,,,,,,,,,,,,,,,"restaurant","832","373","La Belle Epoque",,"Monrovia/Loita Street Alliance Française de Nairobi, Nairobi 14883 Kenya","https://www.tripadvisor.com/Restaurant_Review-g294207-d13455567-Reviews-La_Belle_Epoque-Nairobi.html","-1.28277","36.8164","20484493","Nairobi Central Business District","0","0","1","0","5","+254 746 440550","RESTAURANT",,"4.5",,"",,"Nairobi",,"#373 of 1,048 places to eat in Nairobi","https://media-cdn.tripadvisor.com/media/photo-m/1280/13/aa/b3/b0/beautiful-cozy-franch.jpg","8",,"3.098513603210449","$$ - $$$","6","false","false","13455567"
"Chinese","Indian",,,,,,,,,,,,,,,"Africa/Nairobi","900","630","1350","1080",,,,,,,,,"900","630","1350","1080",,,"900","630","1350","1080",,,"900","630","1350","1080",,,"900","630","1350","1080",,,"900","630","1350","1080",,,,,"294207","Nairobi","Municipality",,"294206","Kenya","Country",,,,,"Lunch","Dinner",,,,,"Lunch","Dinner",,,,,"Nairobi","Kenya",,,"Muthithi Road","Apic Centre",,,,,,,,,,,,,,,,,,,,,,,,,,,,,,,"Restaurants",,,,,,,,,,,,,,,,,,,,,,,,,,,,,,,,,,,,,,,,,,,,,,,,,,,,,,,,,,,,,,,"restaurant","832","583","Darwar",,"Muthithi Road Apic Centre, Nairobi Kenya","https://www.tripadvisor.com/Restaurant_Review-g294207-d11665965-Reviews-Darwar-Nairobi.html","-1.263542","36.805363",,,"0","0","0","2","1","+254 700 118999","RESTAURANT",,"4.5",,"",,"Nairobi",,"#583 of 1,048 places to eat in Nairobi","https://media-cdn.tripadvisor.com/media/photo-o/0e/d3/da/3c/entren.jpg","1","Open Now","3.040465831756592","$$ - $$$","3","false","false","11665965"
