"Sushi","Vegetarian Friendly","Vegan Options",,,,,,,,,,,,,,"Africa/Nairobi","1320","690",,,,,,,,,,,"1320","690",,,,,"1320","690",,,,,"1320","690",,,,,"1320","690",,,,,"1320","690",,,,,"http://www.asiangardens.co.ke/?utm_source=Tripadvisor&utm_medium=Link-Profile&utm_campaign=Social-Media",,"294207","Nairobi","Municipality",,"294206","Kenya","Country",,,,,"Brunch","Lunch","Dinner","Drinks",,,"Brunch","Lunch","Dinner","Drinks",,,"Nairobi","Kenya",,,"UN Avenue","Warwick Center, Gigiri. Right Next to U.S. Embassy","Reservations","Outdoor Seating","Seating","Parking Available","Street Parking","Wheelchair Accessible","Full Bar","Accepts Mastercard","Accepts Visa","Delivery","Takeout","Highchairs Available","Serves Alcohol",,,,,,,,,,,,,,,,,,"Restaurants",,,,,,,,,,,,,,,,,,,,,,,,,,,,,,,,,,,,,,,,,,,,,,,,,,,,,,,,,,,,,,,"restaurant","832","152","Asian Gardens",,"UN Avenue Warwick Center, Gigiri. Right Next to U.S. Embassy, Nairobi Kenya","https://www.tripadvisor.com/Restaurant_Review-g294207-d10674891-Reviews-Asian_Gardens-Nairobi.html","-1.232266","36.81227","20484492","Highridge","3","2","9","18","28","+254 712 848770","RESTAURANT","Info@asianbykhazanah.com","4","http://www.asiangardens.co.ke/menu/index?utm_source=Tripadvisor&utm_medium=Link-Menu&utm_campaign=Social-Media","",,"Nairobi",,"#152 of 1,048 places to eat in Nairobi","https://media-cdn.tripadvisor.com/media/photo-o/0c/77/1c/37/20160807-210105-largejpg.jpg","82","Open Now","3.3062241077423096","$$ - $$$","60","false","false","10674891"
"Pizza","Seafood","Barbecue","Grill","Vegetarian Friendly","Vegan Options",,,,,,,,,,,"Africa/Nairobi","1320","660",,,,,"1320","660",,,,,"1320","660",,,,,"1320","660",,,,,"1320","660",,,,,"1320","660",,,,,"1320","660",,,,,"http://www.pizzacorner.co.ke",,"294207","Nairobi","Municipality",,"294206","Kenya","Country",,,,,"Dinner","Lunch","Late Night",,,,"Dinner","Lunch","Late Night",,,,"Nairobi","Kenya","00606",,"Limuru Road","1st, Floor,Regal Plaza","Delivery","Takeout","Wheelchair Accessible","Reservations","Seating","Parking Available","Validated Parking","Highchairs Available","Accepts Mastercard","Accepts Visa","Free Wifi","Accepts Credit Cards","Family style","Non-smoking restaurants",,,,,,,,,,,,,,,,,"Restaurants",,,,,,,,,,,,,,,,,,,,,,,,,,,,,,,,,,,,,,,"Fish",,,,,,,,,,,,,,,,,,,,,,,,"restaurant","832","184","Pizza Corner Cafe & Grill",,"Limuru Road 1st, Floor,Regal Plaza, Nairobi 00606 Kenya","https://www.tripadvisor.com/Restaurant_Review-g294207-d10464691-Reviews-Pizza_Corner_Cafe_Grill-Nairobi.html","-1.257322","36.827026",,,"1","1","1","5","18","+254 710 506222","RESTAURANT","orders@pizzacorner.co.ke","4.5","http://www.pizzacorner.co.ke/","",,"Nairobi",,"#184 of 1,048 places to eat in Nairobi","https://media-cdn.tripadvisor.com/media/photo-o/12/b4/b2/6e/poussin-chicken-and-chips.jpg","23","Open Now","3.2485692501068115","$$ - $$$","26","false","false","10464691"
"Indian",,,,,,,,,,,,,,,,,,,,,,,,,,,,,,,,,,,,,,,,,,,,,,,,,,,,,,,,,,,,,"294207","Nairobi","Municipality",,"294206","Kenya","Country",,,,,,,,,,,,,,,,,"Nairobi","Kenya",,,"Parklands are, Victoria Plaza, 9th Floor",,"Reservations",,,,,,,,,,,,,,,,,,,,,,,,,,,,,,"Restaurants",,,,,,,,,,,,,,,,,,,,,,,,,,,,,,,,,,,,,,,,,,,,,,,,,,,,,,,,,,,,,,"Sit down","restaurant","832","353","Venom Terrace","KES 222,354 - KES 518,826","Parklands are, Victoria Plaza, 9th Floor, Nairobi Kenya","https://www.tripadvisor.com/Restaurant_Review-g294207-d10459065-Reviews-Venom_Terrace-Nairobi.html","-1.18263","36.90089",,,"1","0","0","2","7","+254 733 678153","RESTAURANT","sipuarora09@ail.com","4.5",,"","You have to experience it to believe! Molecular Gastronomy at its BEST. Warm, spacious, well lit and a rooftop open terrace restaurant specializing in an outstanding culinary of molecular gastronomy and fusion Indian cuisine with a twist. First of its kind in kenya. The food philosophy is all about taste. Indian food presented in a contemporary style. Also known for our world class Cocktails!","Nairobi",,"#353 of 1,048 places to eat in Nairobi","https://media-cdn.tripadvisor.com/media/photo-o/0d/bc/2e/d1/awesome.jpg","28",,"3.108159303665161","$$ - $$$","10","false","false","10459065"
,,,,,,,,,,,,,,,,,,,,,,,,,,,,,,,,,,,,,,,,,,,,,,,,,,,,,,,,,,,,,"294207","Nairobi","Municipality",,"294206","Kenya","Country",,,,,,,,,,,,,,,,,"Nairobi","Kenya",,,"Limuru Road","Village Market",,,,,,,,,,,,,,,,,,,,,,,,,,,,,,,"Restaurants",,,,,,,,,,,,,,,,,,,,,,,,,,,,,,,,,,,,,,,,,,,,,,,,,,,,,,,,,,,,,,,"restaurant","833","599","Sofra",,"Limuru Road Village Market, Nairobi Kenya","https://www.tripadvisor.com/Restaurant_Review-g294207-d10674931-Reviews-Sofra-Nairobi.html","-1.23505","36.80421","20484492","Highridge","0","1","1","2","1",,"RESTAURANT",,"3.5",,"",,"Nairobi",,"#599 of 1,048 places to eat in Nairobi","https://media-cdn.tripadvisor.com/media/photo-o/12/ef/26/ba/20180513-104527-largejpg.jpg","1",,"3.0364673137664795",,"5","false","false","10674931"
"Fast Food",,,,,,,,,,,,,,,,,,,,,,,,,,,,,,,,,,,,,,,,,,,,,,,,,,,,,,,,,,,,,"294207","Nairobi","Municipality",,"294206","Kenya","Country",,,,,,,,,,,,,,,,,"Nairobi","Kenya",,,"The Nextgen Mall",,,,,,,,,,,,,,,,,,,,,,,,,,,,,,,,"Restaurants",,,,,,,,,,,,,,,,,,,,,,,,,,,,,,,,,,,,,,,,,,,,,,,,,,,,,,,,,,,,,,,"restaurant","832","813","Burger King",,"The Nextgen Mall, Nairobi Kenya","https://www.tripadvisor.com/Restaurant_Review-g294207-d17339648-Reviews-Burger_King-Nairobi.html","-1.21076","36.79487",,,"1","0","0","0","0","+254 792 451253","RESTAURANT",,"1",,"",,"Nairobi",,"#813 of 1,048 places to eat in Nairobi",,"0",,"2.676260232925415",,"1","false","false","17339648"
"Cafe",,,,,,,,,,,,,,,,"Africa/Nairobi","1110","540",,,,,"1110","540",,,,,"1110","540",,,,,"1110","540",,,,,"1110","540",,,,,"1260","540",,,,,"1260","540",,,,,"https://www.facebook.com/KaruraCoffee/",,"294207","Nairobi","Municipality",,"294206","Kenya","Country",,,,,"Breakfast","Lunch","Dinner",,,,"Breakfast","Lunch","Dinner",,,,"Nairobi","Kenya",,,"Thigiri Ridge","A few minutes drive from Westlands just off Peponi Road",,,,,,,,,,,,,,,,,,,,,,,,,,,,,,,"Restaurants",,,,,,,,,,,,,,,,,,,,,,,,,,,,,,,,,,,,,,,,,,,,,,,,,,,,,,,,,,,,,,,"restaurant","832","501","Karura Coffee House",,"Thigiri Ridge A few minutes drive from Westlands just off Peponi Road, Nairobi Kenya","https://www.tripadvisor.com/Restaurant_Review-g294207-d13206285-Reviews-Karura_Coffee_House-Nairobi.html","-1.23743","36.78807",,,"0","0","2","3","1","+254 711 633478","RESTAURANT",,"4",,"",,"Nairobi",,"#501 of 1,048 places to eat in Nairobi","https://media-cdn.tripadvisor.com/media/photo-o/12/b4/08/9b/20180421-100133-largejpg.jpg","3","Closed Now","3.0566494464874268",,"6","false","false","13206285"
"Bar",,,,,,,,,,,,,,,,,,,,,,,,,,,,,,,,,,,,,,,,,,,,,,,,,,,,,,,,,,,"http://www.mercurylounge.co.ke/",,"294207","Nairobi","Municipality",,"294206","Kenya","Country",,,,,"Dinner","Late Night","Drinks",,,,"Dinner","Late Night","Drinks",,,,"Nairobi","Kenya","",,"ABC Plaza","Lavington","Seating","Full Bar","Reservations","Outdoor Seating","Serves Alcohol","Table Service",,,,,,,,,,,,,,,,,,,,,,,,,"Restaurants",,,,,,,,,,,,,,,,,,,,,,,,,,,,,,,,,,,,,,,"Wings",,,,,,,,,,,,,,,,,,,,,,,"Sit down","restaurant","832","378","Mercury Lounge",,"ABC Plaza Lavington, Nairobi Kenya","https://www.tripadvisor.com/Restaurant_Review-g294207-d1226686-Reviews-Mercury_Lounge-Nairobi.html","-1.18263","36.90089",,,"10","5","13","21","17","+254 20 4451875","RESTAURANT",,"3.5",,"",,"Nairobi",,"#378 of 1,048 places to eat in Nairobi","https://media-cdn.tripadvisor.com/media/photo-o/0b/44/14/7d/img-20160513-184435-largejpg.jpg","8",,"3.097243070602417","$$ - $$$","66","false","false","1226686"
,,,,,,,,,,,,,,,,"Africa/Nairobi","1620","600",,,,,,,,,,,"1620","600",,,,,"1620","600",,,,,"1740","600",,,,,"1740","600",,,,,"1740","600",,,,,"http://www.facebook.com/PersiaLoungeTRM/",,"294207","Nairobi","Municipality",,"294206","Kenya","Country",,,,,"Lunch","Dinner",,,,,"Lunch","Dinner",,,,,"Nairobi","Kenya",,,,"Thika Road Mall, Exit 8, Off Thika Superhighway, Ground Floor, TRM, rear parking","Seating","Reservations",,,,,,,,,,,,,,,,,,,,,,,,,,,,,"Restaurants",,,,,,,,,,,,,,,,,,,,,,,,,,,,,,,,,,,,,,,,,,,,,,,,,,,,,,,,,,,,,,"Sit down","restaurant","832","338","Persia Resto Pub & Sheesha Lounge","KES 74,118 - KES 222,354","Thika Road Mall, Exit 8, Off Thika Superhighway, Ground Floor, TRM, rear parking, Nairobi Kenya","https://www.tripadvisor.com/Restaurant_Review-g294207-d10021908-Reviews-Persia_Resto_Pub_Sheesha_Lounge-Nairobi.html","-1.219298","36.88793",,,"0","0","2","4","5","+254 787 788888","RESTAURANT","info@persia.co.ke","4.5",,"","Persia Resto Pub and Sheesha Lounge is your best choice for Signature Cocktails, Mediterranean Menus and flavoured Sheesha. Located on Ground Floor, Thika Road Mall, from Rear Parking, Persia provides a spacious and tranquil environment for you to relax and enjoy.","Nairobi",,"#338 of 1,048 places to eat in Nairobi","https://media-cdn.tripadvisor.com/media/photo-o/0c/4c/16/17/persia-resto-pub-and.jpg","12","Open Now","3.114502429962158","$$ - $$$","11","false","false","10021908"
"Asian","Malaysian",,,,,,,,,,,,,,,"Africa/Nairobi","1200","600",,,,,"1200","600",,,,,"1200","600",,,,,"1200","600",,,,,"1200","600",,,,,"1200","600",,,,,"1200","600",,,,,"https://www.facebook.com/gigiripark/",,"294207","Nairobi","Municipality",,"294206","Kenya","Country",,,,,"Lunch","Dinner",,,,,"Lunch","Dinner",,,,,"Nairobi","Kenya","00800",,"UN Avenue , Gigiri Box Park","100m From United Nations Hq",,,,,,,,,,,,,,,,,,,,,,,,,,,,,,,"Restaurants",,,,,,,,,,,,,,,,,,,,,,,,,,,,,,,,,,,,,,,,,,,,,,,,,,,,,,,,,,,,,,,"restaurant","832","594","Hq Cafe",,"UN Avenue , Gigiri Box Park 100m From United Nations Hq, Nairobi 00800 Kenya","https://www.tripadvisor.com/Restaurant_Review-g294207-d23844589-Reviews-Hq_Cafe-Nairobi.html","-1.237481","36.810764",,,"0","0","0","0","1","+254 793 472233","RESTAURANT","hqcatering2021@gmail.com","5",,"","Malaysian Cuisine","Nairobi",,"#594 of 1,048 places to eat in Nairobi","https://media-cdn.tripadvisor.com/media/photo-m/1280/22/e4/5a/7f/hq-cafe-at-night.jpg","7","Closed Now","3.037836790084839",,"1","false","false","23844589"
"Bar","European","Wine Bar","Pub",,,,,,,,,,,,,"Africa/Nairobi","1380","540",,,,,,,,,,,"1380","540",,,,,"1380","540",,,,,"1380","540",,,,,"1380","540",,,,,"1380","540",,,,,"http://www.facebook.com/ChezSoniaWine",,"294207","Nairobi","Municipality",,"294206","Kenya","Country",,,,,"Breakfast","Lunch","Dinner","Brunch","Late Night","Drinks","Breakfast","Lunch","Dinner","Brunch","Late Night","Drinks","Nairobi","Kenya","01100",,"68 Peponi Road",,"Reservations","Seating","Serves Alcohol","Table Service","Digital Payments","Free Wifi","Accepts Credit Cards",,,,,,,,,,,,,,,,,,,,,,,,"Restaurants",,,,,,,,,,,,,,,,,,,,,,,,,,,,,,,,,,,,,,,,,,,,,,,,,,,,,,,,,,,,,,"Sit down","restaurant","832","197","Chez Sonia","KES 44,471 - KES 237,178","68 Peponi Road, Nairobi 01100 Kenya","https://www.tripadvisor.com/Restaurant_Review-g294207-d17480269-Reviews-Chez_Sonia-Nairobi.html","-1.246745","36.7954",,,"7","4","2","11","26","+254 702 363666","RESTAURANT","info@chezsoniavinos.com","4",,"","Enjoy the widest selection of wine per the glass in Nairobi & the best French-Italian style tapas. We have amazing quality cheese & charcuterie platters, pate , rillettes , homemade burratta just to name a few & delicious patisserie Our menu changes according to the seasons… the mood.. And chefs who decide to stop for a night and visit us Here you will always find a warm welcome! Cheers","Nairobi",,"#197 of 1,048 places to eat in Nairobi","https://media-cdn.tripadvisor.com/media/photo-o/17/af/93/6f/our-dessert-platter.jpg","75","Open Now","3.232386350631714","$$ - $$$","50","false","false","17480269"
"American","African","European","Asian",,,,,,,,,,,,,"Africa/Nairobi","1380","390",,,,,"1380","390",,,,,"1380","390",,,,,"1380","390",,,,,"1380","390",,,,,"1380","390",,,,,"1380","390",,,,,"http://www3.hilton.com/en/hotels/kenya/hilton-nairobi-NBOHITW/dining/index.html",,"294207","Nairobi","Municipality",,"294206","Kenya","Country",,,,,"Lunch","Dinner","Breakfast","Brunch",,,"Lunch","Dinner","Breakfast","Brunch",,,"Nairobi","Kenya","00100",,"Mama Ngina Street","Hilton Hotel","Buffet","Seating","Parking Available","Valet Parking","Wheelchair Accessible","Serves Alcohol","Full Bar","Accepts Mastercard","Accepts Visa","Cash Only","Free Wifi","Reservations","Accepts Credit Cards",,,,,,,,,,,,,,,,,,"Restaurants",,,,,,,,,,,,,,,,,,,,,,,,,,,,,,,,,,,,,,,,,,,,,,,,,,,,,,,,,,,,,,"Sit down","restaurant","832","230","Traveller's Restaurant","KES 2,965 - KES 8,894","Mama Ngina Street Hilton Hotel, Nairobi 00100 Kenya","https://www.tripadvisor.com/Restaurant_Review-g294207-d8431217-Reviews-Traveller_s_Restaurant-Nairobi.html","-1.285339","36.82464","20484493","Nairobi Central Business District","0","3","9","12","10","2542542790000","RESTAURANT","nairobi_info@hilton.com","4","http://www3.hilton.com/resources/media/hi/NBOHITW/en_US/pdf/en_NBOHITW_Cafe_American_Menu_Jan_2018.pdf","","The Traveller's Restaurant features an extensive buffet, themed at night, and an à la carte menu with wine list. Inspired by a bygone era of travel, this Nairobi restaurant is decorated like an old-fashioned train, with leather suitcases and other traveling paraphernalia.","Nairobi",,"#230 of 1,048 places to eat in Nairobi","https://media-cdn.tripadvisor.com/media/photo-o/08/6d/3e/09/traveller-s-restaurant.jpg","8","Open Now","3.1929032802581787","$$ - $$$","34","false","false","8431217"
"Italian","Pizza",,,,,,,,,,,,,,,"Africa/Nairobi","1380","540",,,,,"1380","540",,,,,"1380","540",,,,,"1380","540",,,,,"1380","540",,,,,"1380","540",,,,,"1380","540",,,,,"http://www.ilgiocoliere.com",,"294207","Nairobi","Municipality",,"294206","Kenya","Country",,,,,"Breakfast","Lunch","Dinner",,,,"Breakfast","Lunch","Dinner",,,,"Nairobi","Kenya","00200",,"Block B, Warwick Plaza, ICRAF Rd","gigiri UN Avenue","Reservations",,,,,,,,,,,,,,,,,,,,,,,,,,,,,,"Restaurants",,,,,,,,,,,,,,,,,,,,,,,,,,,,,,,,,,,,,,,,,,,,,,,,,,,,,,,,,,,,,,,"restaurant","833","231","Il Giocoliere",,"Block B, Warwick Plaza, ICRAF Rd gigiri UN Avenue, Nairobi 00200 Kenya","https://www.tripadvisor.com/Restaurant_Review-g294207-d17189045-Reviews-Il_Giocoliere-Nairobi.html","-1.29743","36.77431",,,"0","0","3","2","8",,"RESTAURANT",,"4.5",,"",,"Nairobi",,"#231 of 1,048 places to eat in Nairobi","https://media-cdn.tripadvisor.com/media/photo-m/1280/19/a8/cf/5f/italian-cuisine-along.jpg","20","Open Now","3.1925652027130127","$$ - $$$","13","false","false","17189045"
"International","Fusion","Healthy",,,,,,,,,,,,,,,,,,,,,,,,,,,,,,,,,,,,,,,,,,,,,,,,,,,,,,,,,,,"294207","Nairobi","Municipality",,"294206","Kenya","Country",,,,,,,,,,,,,,,,,"Nairobi","Kenya","",,"Thigiri Ridge","Thigiri Ridge Shopping Centre",,,,,,,,,,,,,,,,,,,,,,,,,,,,,,,"Restaurants",,,,,,,,,,,,,,,,,,,,,,,,,,,,,,,,,,,,,,,,,,,,,,,,,,,,,,,,,,,,,,,"restaurant","832","727","Pallet Cafe - Thigiri",,"Thigiri Ridge Thigiri Ridge Shopping Centre, Nairobi Kenya","https://www.tripadvisor.com/Restaurant_Review-g294207-d21166219-Reviews-Pallet_Cafe_Thigiri-Nairobi.html","-1.235173","36.793438",,,"2","0","0","0","2",,"RESTAURANT",,"3",,"",,"Nairobi",,"#727 of 1,048 places to eat in Nairobi",,"0",,"3.0069921016693115","$$ - $$$","4","false","false","21166219"
"International","Vegetarian Friendly",,,,,,,,,,,,,,,,,,,,,,,,,,,,,,,,,,,,,,,,,,,,,,,,,,,,,,,,,,"http://www.sarovahotels.com/panafric/dining",,"294207","Nairobi","Municipality",,"294206","Kenya","Country",,,,,"Breakfast","Lunch","Dinner",,,,"Breakfast","Lunch","Dinner",,,,"Nairobi","Kenya","00100",,"Kenyatta Avenue",,"Reservations","Outdoor Seating","Seating","Wheelchair Accessible",,,,,,,,,,,,,,,,,,,,,,,,,,,"Restaurants",,,,,,,,,,,,,,,,,,,,,,,,,,,,,,,,,,,,,,,,,,,,,,,,,,,,,,,,,,,,,,"Sit down","restaurant","832","220","Pool Garden Restaurant",,"Kenyatta Avenue, Nairobi 00100 Kenya","https://www.tripadvisor.com/Restaurant_Review-g294207-d3264762-Reviews-Pool_Garden_Restaurant-Nairobi.html","-1.2898","36.81052","20484494","Upper Hill Estate","0","1","1","6","17","+254 20 2767000","RESTAURANT","makandi.laiboni@sarovahotels.com","4.5",,"","This poolside restaurant offers a lunch buffet as well an a la carte menu of light meals and snacks. The restaurant is a popular Sunday brunch venue for city residents who come to enjoy the barbecue in the garden setting. The restaurant opens from 9:00 a.M. To 11:00 p.M.","Nairobi",,"#220 of 1,048 places to eat in Nairobi","https://media-cdn.tripadvisor.com/media/photo-o/08/21/de/4c/pool-garden-restuarant.jpg","7",,"3.202740430831909","$$ - $$$","25","false","false","3264762"
"African","Vegetarian Friendly",,,,,,,,,,,,,,,"Africa/Nairobi","1260","540",,,,,"1260","540",,,,,"1260","540",,,,,"1260","540",,,,,"1260","540",,,,,"1260","540",,,,,"1260","540",,,,,"http://www.amaica.co.ke",,"294207","Nairobi","Municipality",,"294206","Kenya","Country",,,,,"Breakfast","Drinks","Lunch","Dinner","Brunch",,"Breakfast","Drinks","Lunch","Dinner","Brunch",,"Nairobi","Kenya","00100",,"Getathuru Garden","Off Peponi road","Delivery","Parking Available","Highchairs Available","Serves Alcohol","Full Bar","Accepts Mastercard","Accepts Visa","Reservations","Seating","Accepts Credit Cards","Outdoor Seating","Buffet",,,,,,,,,,,,,,,,,,,"Restaurants",,,,,,,,,,,,,,,,,,,,,,,,,,,,,,,,,,,,,,,"Beef","Fish",,,,,,,,,,,,,,,,,,,,,,"Sit down","restaurant","832","158","Amaica The Restaurant",,"Getathuru Garden Off Peponi road, Nairobi 00100 Kenya","https://www.tripadvisor.com/Restaurant_Review-g294207-d3581892-Reviews-Amaica_The_Restaurant-Nairobi.html","-1.248346","36.80007",,,"13","9","8","40","36","+254 716 687248","RESTAURANT","info@amaica.co.ke","3.5","https://www.amaica.co.ke/menu/","","Amaica is an indigenous Kenyan five star restaurant chain that provides an engaging cultural experience for customers. We are renowned for our authentic African food, service excellence based on African hospitality standards, set in an African environment to enhance your experience. Providing healthy, balanced and unique African dishes from around the country. Amaica offers the perfect environment for dining out as well as celebrating special occasions. Amaica Peponi is located in Nairobi's Westlands area. Located in the green leafy suburbs and set against the backdrop of Karura Forest, Amaica Peponi is the ideal getaway for friends, colleagues and family. Amaica JKIA is found within the Jomo Kenyatta International Airport. Located in the international departures terminal 1A Level 2 at the food court.Overlooking the Airport parking apron, runway and hangars, Amaica JKIA guests are treated to a scenic view that has customers enthralled by planes taking off and landing as well beautiful sunrise and sunset moments.","Nairobi",,"#158 of 1,048 places to eat in Nairobi","https://media-cdn.tripadvisor.com/media/photo-o/1b/46/89/b2/amaica-restaurant.jpg","73","Closes in 6 min","3.290742874145508","$$ - $$$","106","false","false","3581892"
"African",,,,,,,,,,,,,,,,,,,,,,,,,,,,,,,,,,,,,,,,,,,,,,,,,,,,,,,,,,,,,"294207","Nairobi","Municipality",,"294206","Kenya","Country",,,,,,,,,,,,,,,,,"Nairobi","Kenya",,,"Moi Ave",,,,,,,,,,,,,,,,,,,,,,,,,,,,,,,,"Restaurants",,,,,,,,,,,,,,,,,,,,,,,,,,,,,,,,,,,,,,,,,,,,,,,,,,,,,,,,,,,,,,,"restaurant","832","816","Medallion Steak House & Restaurant",,"Moi Ave, Nairobi Kenya","https://www.tripadvisor.com/Restaurant_Review-g294207-d17561161-Reviews-Medallion_Steak_House_Restaurant-Nairobi.html","-1.21076","36.79487",,,"1","2","0","0","0","+254 796 758894","RESTAURANT",,"1.5",,"",,"Nairobi",,"#816 of 1,048 places to eat in Nairobi","https://media-cdn.tripadvisor.com/media/photo-o/17/d0/dd/0f/img-20190601-200048-largejpg.jpg","2",,"2.6580147743225098",,"3","false","false","17561161"
"Italian","Pizza","European","Vegetarian Friendly","Vegan Options","Gluten Free Options",,,,,,,,,,,"Africa/Nairobi","1380","720",,,,,"1380","720",,,,,"1380","720",,,,,"1380","720",,,,,"1380","720",,,,,"1380","720",,,,,"1380","720",,,,,"http://www.mediterraneorestaurant.co.ke/",,"294207","Nairobi","Municipality",,"294206","Kenya","Country",,,,,"Lunch","Dinner","Drinks","Late Night",,,"Lunch","Dinner","Drinks","Late Night",,,"Nairobi","Kenya","",,"United Nations Avenue","Gigiri","Outdoor Seating","Serves Alcohol","Accepts American Express","Accepts Mastercard","Accepts Visa","Free Wifi","Accepts Discover","Takeout","Reservations","Seating","Parking Available","Wheelchair Accessible","Full Bar","Table Service","Delivery","Highchairs Available","Accepts Credit Cards",,,,,,,,,,,,,,"Restaurants",,,,,,,,,,,,,,,,,,,,,,,,,,,,,,,,,,,,,,,"Pasta","Salad","Risotto","Lamb","Pesto",,,,,,,,,,,,,,,,,,,"Sit down","restaurant","832","215","Mediterraneo Ristorante",,"United Nations Avenue Gigiri, Nairobi Kenya","https://www.tripadvisor.com/Restaurant_Review-g294207-d2407723-Reviews-Mediterraneo_Ristorante-Nairobi.html","-1.236551","36.810936","20484492","Highridge","12","13","20","48","33","+254 789 269841","RESTAURANT","info@mediterraneorestuarant.co.ke","3.5","http://www.mediterraneorestaurant.co.ke","","Mediterraneo Ristorante in Gigiri is a charming, Italian-villa style venue with beautiful outdoor seating and expansive gardens that make any meal memorable, whether a special occasion or an everyday affair. We are dedicated to recreating an authentic Italian dining experience in Nairobi, importing everything from prosciutto and pasta to our kitchen equipment straight from the old country, and making everything else from scratch.","Nairobi",,"#215 of 1,048 places to eat in Nairobi","https://media-cdn.tripadvisor.com/media/photo-o/08/7e/de/cd/mediterraneo-gigiri.jpg","23","Open Now","3.2102086544036865","$$ - $$$","126","false","false","2407723"
"Indian","Halal","Vegetarian Friendly",,,,,,,,,,,,,,,,,,,,,,,,,,,,,,,,,,,,,,,,,,,,,,,,,,,,,,,,,,,"294207","Nairobi","Municipality",,"294206","Kenya","Country",,,,,"Dinner","Lunch",,,,,"Dinner","Lunch",,,,,"Nairobi","Kenya",,,"School Lane","Westlands","Delivery","Takeout","Seating","Reservations","Wheelchair Accessible","Table Service",,,,,,,,,,,,,,,,,,,,,,,,,"Restaurants",,,,,,,,,,,,,,,,,,,,,,,,,,,,,,,,,,,,,,,"Juice & Smoothies","Fish",,,,,,,,,,,,,,,,,,,,,,"Sit down","restaurant","832","222","Nargis Restaurant",,"School Lane Westlands, Nairobi Kenya","https://www.tripadvisor.com/Restaurant_Review-g294207-d3685476-Reviews-Nargis_Restaurant-Nairobi.html","-1.259753","36.796696",,,"9","1","16","29","21","+254 722 793054","RESTAURANT",,"3.5","http://www.facebook.com/NargisKE/menu","","For authentic barbecue experience in Nairobi, from delicious chicken tikka, fish tikka, paneer tikka to chicken chooza","Nairobi",,"#222 of 1,048 places to eat in Nairobi","https://media-cdn.tripadvisor.com/media/photo-o/0d/51/be/96/photo3jpg.jpg","19",,"3.199075937271118","$$ - $$$","76","false","false","3685476"
"Indian","Asian","Vegetarian Friendly","Vegan Options","Halal",,,,,,,,,,,,"Africa/Nairobi","1350","420",,,,,"1350","420",,,,,"1350","420",,,,,"1350","420",,,,,"1350","420",,,,,"1350","420",,,,,"1350","420",,,,,"http://www.facebook.com/GrandCafeKE/",,"294207","Nairobi","Municipality",,"294206","Kenya","Country",,,,,"Lunch","Dinner","Late Night","Breakfast","Brunch",,"Lunch","Dinner","Late Night","Breakfast","Brunch",,"Nairobi","Kenya","00100",,"Lenana Road","Lenana Towers 843, Mezzanine Floor","Delivery","Takeout","Reservations","Buffet","Seating","Parking Available","Street Parking","Free off-street parking","Wheelchair Accessible","Accepts Mastercard","Accepts Visa","Digital Payments","Cash Only","Free Wifi","Table Service","Highchairs Available",,,,,,,,,,,,,,,"Restaurants",,,,,,,,,,,,,,,,,,,,,,,,,,,,,,,,,,,,,,,,,,,,,,,,,,,,,,,,,,,,,,"Sit down","restaurant","832","233","Grand Cafe And Indian Cuisine","KES 1,482 - KES 2,965","Lenana Road Lenana Towers 843, Mezzanine Floor, Nairobi 00100 Kenya","https://www.tripadvisor.com/Restaurant_Review-g294207-d11613624-Reviews-Grand_Cafe_And_Indian_Cuisine-Nairobi.html","-1.288695","36.79219",,,"2","2","2","13","18","+254 792 746713","RESTAURANT","info@grandcafe.co.ke","4","https://www.grandcafe.co.ke","","Your home of Indian & Continental Cuisine, prepared by our professional Indian and Kenyan Chefs, with emphasis on flavor and service. #Welcome #GrandCafeKE","Nairobi",,"#233 of 1,048 places to eat in Nairobi","https://media-cdn.tripadvisor.com/media/photo-m/1280/16/fa/67/ae/indian-cuisine.jpg","66","Open Now","3.189901351928711","$$ - $$$","37","false","false","11613624"
"Steakhouse","Contemporary","Bar","Pub",,,,,,,,,,,,,,,,,,,,,,,,,,,,,,,,,,,,,,,,,,,,,,,,,,,,,,,,"http://www.sierrapremium.com/brasserie",,"294207","Nairobi","Municipality",,"294206","Kenya","Country",,,,,"Lunch","Dinner",,,,,"Lunch","Dinner",,,,,"Nairobi","Kenya","00506",,,"Muguga Green,Rivaan Centre","Reservations","Outdoor Seating","Seating","Wheelchair Accessible","Serves Alcohol","Takeout",,,,,,,,,,,,,,,,,,,,,,,,,"Restaurants",,,,,,,,,,,,,,,,,,,,,,,,,,,,,,,,,,,,,,,"Burger",,,,,,,,,,,,,,,,,,,,,,,"Sit down","restaurant","832","221","Sierra Burger+Wine","KES 88,942 - KES 311,296","Muguga Green,Rivaan Centre, Nairobi 00506 Kenya","https://www.tripadvisor.com/Restaurant_Review-g294207-d12585663-Reviews-Sierra_Burger_Wine-Nairobi.html","-1.25989","36.791695",,,"4","0","3","12","15",,"RESTAURANT",,"4",,"","Our restaurant main focus is beef. We only use dry aged Angus and Boran beef for our steaks and burgers that we locally source from Nanyuki. We do not add unnecessary condiments to our burgers,just those that are designed to accentuate the flavor of the beef. Our beef burgers are ground fresh every morning at our own butchery.","Nairobi",,"#221 of 1,048 places to eat in Nairobi","https://media-cdn.tripadvisor.com/media/photo-o/0f/e8/83/e7/photo0jpg.jpg","15",,"3.2002313137054443","$$ - $$$","34","false","false","12585663"
