,,,,,,,,,,,,,,,,,,,"Nairobi","Kenya",,,"Ngong Road","Upper Ground Floor, Marsabit Plaza","Café",,"Africa/Nairobi","1335","420",,,"1320","420","1320","420","1350","420","1350","420","1350","420","1350","420",,,"Italian","Mexican","American","Steakhouse","African",,,,"0","0","0","1","2",,,,,,,,,,,,,,,,,,,,,,,,,,,,,,,,,,,"294207","Nairobi","Municipality",,"294206","Kenya","Country",,,,,"493","","Breakfast","Lunch","Dinner",,,,,,,,,,,,,,,,,,,,,,,,,,"Closed Now","#493 of 1,048 places to eat in Nairobi","Breakfast","Lunch","Dinner",,,,"KES 59,294 - KES 222,354","13976697","3","Ngong Road Upper Ground Floor, Marsabit Plaza, Nairobi Kenya","Mugz & Brewz",,"https://www.tripadvisor.com/Restaurant_Review-g294207-d13976697-Reviews-Mugz_Brewz-Nairobi.html","MUGZ& BREWZ Restaurant is located along ngong road at Marsabit plaza directly opposite ligi ndogo upper ground floor.Our ambiance is great ;an open kitchen which allows you to watch as your food is being prepared from the comfort of your seat , our terrace is nature inspired with wall and potted plants and the sky this will make you forget your in Nairobi city.We have pocket friendly prices!!! Our food finger licking .We have board games to keep you and your friends entertained not forgeting the children we have a kiddi menu and a trampoline to keep the children entertained.Happy hour every day from 2pm-8 pm.","3.058518886566162","-1.30822","restaurant","http://www.facebook.com/mugzandbrewzke","RESTAURANT","https://media-cdn.tripadvisor.com/media/photo-o/15/d3/46/b2/dsc-0002-1-largejpg.jpg","833",,"+254 795 630909","false","false","Restaurants",,"3","mugzmananger@gmail.com","36.73304","Nairobi","$","4.5"
,,,,,,,,,,,,,,,,,,,"Karen","Kenya","00254",,"Marula Lane","Karengata Park",,,"Africa/Nairobi","1260","480",,,"1260","480","1260","480","1260","480","1260","480","1260","480","1260","480",,,"Indian","African","Cafe","Diner","Middle Eastern",,,,"0","0","0","1","3",,,,,,,,,,,,,,,,,,,,,,,,,,,,,,,,,,,"12559418","Karen","City",,"294207","Nairobi","Municipality",,"294206","Kenya","Country","11","","Breakfast","Lunch","Dinner",,,,"Outdoor Seating","Seating","Free off-street parking","Television","Wine and Beer","Accepts Credit Cards",,,,,,,,,,,,,,,,,"Closed Now","#11 of 29 places to eat in Karen","Breakfast","Lunch","Dinner",,,,,"14156923","10","Marula Lane Karengata Park, Karen, Nairobi 00254 Kenya","Trymid Bar & Restaurant",,"https://www.tripadvisor.com/Restaurant_Review-g12559418-d14156923-Reviews-Trymid_Bar_Restaurant-Karen_Nairobi.html","Welcome (Karibu) to TRYMID. TRYMID is situated in the heart of Karen boarding Ngong forest along Marula Lane. TRYMID offers an exceptional gourmet of Continental, Indian, Swahili and Sea Food, served in the warm atmosphere of the leafy suburbs of Karen. We emphasis on Comfort, Taste, Relaxation and above all Great service. Hunters Brunch Sandwich,Trymid Biryani are a few of our special dishes you will ﬁnd on our enticing menu. Cap off your main course with our famous Maasai Coffee or indulge in a speciality Watamu caffe latte! At TRYMID we turn the ordinary into extraordinary everyday. So, stop in for a energizing breakfast, relaxing lunch or romantic dinner. “Make everyday a little more special at TRYMID.”","3.0742557048797607","-1.33812","restaurant","https://trymid-bar-restaurant.business.site/","RESTAURANT","https://media-cdn.tripadvisor.com/media/photo-m/1280/13/de/6e/f4/trymid-bar-restaurant.jpg","22",,"+254 733 222253","false","false","Restaurants",,"4","trymidkenya@gmail.com","36.706093","Karen, Nairobi","$$ - $$$","5"
,,,,,,,,,,,,,,,,,,,"Nairobi","Kenya",,,"Silanga Rd","Hotel Rudi, Karen, Langata Rd","Sit down",,"Africa/Nairobi","2040","660",,,,,"2040","660","2040","660","2040","660","2040","660","2040","660",,,"Swiss","European",,,,,,,"2","1","0","4","6",,,,,,,,,,,,,,,,,,,,,,,,,,,,,,,,,,,"294207","Nairobi","Municipality",,"294206","Kenya","Country",,,,,"462","","Dinner","Lunch",,,,,"Reservations","Seating","Table Service",,,,,,,,,,,,,,,,,,,,"Open Now","#462 of 1,048 places to eat in Nairobi","Dinner","Lunch",,,,,,"4263016","36","Silanga Rd Hotel Rudi, Karen, Langata Rd, Nairobi Kenya","Rudis Al-fresco",,"https://www.tripadvisor.com/Restaurant_Review-g294207-d4263016-Reviews-Rudis_Al_fresco-Nairobi.html",,"3.068815231323242","-1.34751","restaurant","http://www.hotelrudi.com/rudis-dining/","RESTAURANT","https://media-cdn.tripadvisor.com/media/photo-o/06/da/57/5a/020jpg.jpg","833",,"+254 20 2610903","false","false","Restaurants",,"13","info@hotelrudi.com","36.7445","Nairobi","$$$$","4"
,,,,,,,,,,,,,,,,,,,"Nairobi","Kenya","00208",,"Fair Acres Rd",,,,,,,,,,,,,,,,,,,,,,,,,,,,,,,"0","0","0","0","3",,,,,,,,,,,,,,,,,,,,,,,,,,,,,,,,,,,"294207","Nairobi","Municipality",,"294206","Kenya","Country",,,,,"443","",,,,,,,,,,,,,,,,,,,,,,,,,,,,,,"#443 of 1,048 places to eat in Nairobi",,,,,,,,"24859932","0","Fair Acres Rd, Nairobi 00208 Kenya","Restaurant at Fair Acres Boutique Hotel",,"https://www.tripadvisor.com/Restaurant_Review-g294207-d24859932-Reviews-Restaurant_at_Fair_Acres_Boutique_Hotel-Nairobi.html",,"3.0740861892700195","-1.340738","restaurant","https://www.fairacres-nairobi.co.ke/dining/","RESTAURANT",,"833",,"+254 727 729202","false","false","Restaurants",,"3","reservations@fairacres-nairobi.co.ke","36.737133","Nairobi",,"5"
"Burger","Salad",,,,,,,,,,,,,,,,,,"Karen","Kenya",,,"Dagoretti Road","The Hub Shopping Mall",,,,,,,,,,,,,,,,,,,,,,"Cafe","Vegetarian Friendly","Vegan Options",,,,,,"3","1","13","45","35",,,,,,,,,,,,,,,,,,,,,,,,,,,,,,,,,,,"12559418","Karen","City",,"294207","Nairobi","Municipality",,"294206","Kenya","Country","4","","Breakfast","Lunch","Brunch","Dinner",,,"Takeout","Reservations","Seating","Serves Alcohol","Table Service",,,,,,,,,,,,,,,,,,,"#4 of 29 places to eat in Karen","Breakfast","Lunch","Brunch","Dinner",,,,"13784633","41","Dagoretti Road The Hub Shopping Mall, Karen, Nairobi Kenya","Artcaffe","https://www.artcaffe.co.ke/menu/","https://www.tripadvisor.com/Restaurant_Review-g12559418-d13784633-Reviews-Artcaffe-Karen_Nairobi.html",,"3.5947744846343994","-1.319581","restaurant","https://www.artcaffe.co.ke/the-hub/","RESTAURANT","https://media-cdn.tripadvisor.com/media/photo-m/1280/13/58/22/02/garlic-bread.jpg","22",,"+254 790 124892","false","false","Restaurants",,"97",,"36.70429","Karen, Nairobi","$$ - $$$","4"
"Cheesecake","Burger","Salad","Tacos","Laksa","Tostones","Hummus",,,,,,,,,,,,,"Nairobi","Kenya",,,"60 Ndovu Road",,"Sit down",,"Africa/Nairobi","1020","510",,,,,"1020","510","1020","510","1020","510","1020","510","1020","510",,,"Healthy","International","Contemporary","Fusion","Vegetarian Friendly","Vegan Options","Gluten Free Options",,"10","8","7","30","62",,,,,,,,,,,,,,,,,,,,,,,,,,,,,,,,,,,"294207","Nairobi","Municipality",,"294206","Kenya","Country",,,,,"101","","Breakfast","Lunch","Dinner","Brunch","Drinks",,"Reservations","Outdoor Seating","Seating","Serves Alcohol","Full Bar",,,,,,,,,,,,,,,,,,"Closed Now","#101 of 1,048 places to eat in Nairobi","Breakfast","Lunch","Dinner","Brunch","Drinks",,"KES 37,059 - KES 296,472","12597664","130","60 Ndovu Road, Nairobi Kenya","Boho Eatery",,"https://www.tripadvisor.com/Restaurant_Review-g294207-d12597664-Reviews-Boho_Eatery-Nairobi.html",,"3.488462448120117","-1.369858","restaurant","https://www.facebook.com/bohoeaterynairobi/","RESTAURANT","https://media-cdn.tripadvisor.com/media/photo-o/0f/f7/a6/13/asian-noodles-with-pomegranate.jpg","833",,"+254 727 502416","false","false","Restaurants",,"117","info@boho.co.ke","36.75024","Nairobi","$$ - $$$","4"
,,,,,,,,,,,,,,,,,,,"Ngong","Kenya","",,"400 Meters Before The Main Gate To Ngong Hills Forest Reserve","",,,,,,,,,,,,,,,,,,,,,,"French",,,,,,,,"0","0","0","0","3",,,,,,,,,,,,,,,,,,,,,,,,,,,,,,,,,,,"1137923","Ngong","City",,"2697619","Rift Valley Province","Province",,"294206","Kenya","Country","1","",,,,,,,,,,,,,,,,,,,,,,,,,,,,,,"#1 of 2 places to eat in Ngong",,,,,,,,"22932618","8","400 Meters Before The Main Gate To Ngong Hills Forest Reserve, Ngong Kenya","E-trails Kenya",,"https://www.tripadvisor.com/Restaurant_Review-g1137923-d22932618-Reviews-E_trails_Kenya-Ngong_Rift_Valley_Province.html",,"3.088494062423706","-1.370808","restaurant","http://web.facebook.com/ebikeskenya","RESTAURANT","https://media-cdn.tripadvisor.com/media/photo-o/1c/6e/97/1a/e-trails-kenya.jpg","1",,"+254 735 069075","false","false","Restaurants",,"3",,"36.6462","Ngong, Rift Valley Province","$$ - $$$","5"
,,,,,,,,,,,,,,,,,,,"Nairobi","Kenya",,,"Langata Road","Shell Service Station opposite Crossroads","Café",,,,,,,,,,,,,,,,,,,,,"Diner",,,,,,,,"0","0","1","4","2",,,,,,,,,,,,,,,,,,,,,,,,,,,,,,,,,,,"294207","Nairobi","Municipality",,"294206","Kenya","Country",,,,,"398","",,,,,,,,,,,,,,,,,,,,,,,,,,,,,,"#398 of 1,048 places to eat in Nairobi",,,,,,,"KES 22,235 - KES 222,354","14039816","0","Langata Road Shell Service Station opposite Crossroads, Nairobi Kenya","Java House","https://www.javahouseafrica.com/our-menu/","https://www.tripadvisor.com/Restaurant_Review-g294207-d14039816-Reviews-Java_House-Nairobi.html",,"3.088559627532959","-1.322653","restaurant","https://www.javahouseafrica.com/our-locations/","RESTAURANT",,"833",,"+254 700 718811","false","false","Restaurants",,"7",,"36.707962","Nairobi","$","4"
"Fish",,,,,,,,,,,,,,,,,,,"Nairobi","Kenya",,,"Ngong Racecourse","Off Ngong Road","Sit down",,"Africa/Nairobi","120","0",,,,,"120","0","120","0","120","0","120","0","120","0",,,"Bar","Pub","Gastropub","European",,,,,"2","2","6","7","7",,,,,,,,,,,,,,,,,,,,,,,,,,,,,,,,,,,"294207","Nairobi","Municipality",,"294206","Kenya","Country",,,,,"386","","Lunch","Dinner",,,,,"Accepts Visa","Reservations","Buffet","Seating","Parking Available","Free off-street parking","Television","Serves Alcohol","Full Bar","Accepts American Express","Accepts Mastercard","Digital Payments","Free Wifi","Accepts Discover","Takeout","Outdoor Seating","Accepts Credit Cards","Table Service",,,,,"Closed Now","#386 of 1,048 places to eat in Nairobi","Lunch","Dinner",,,,,"KES 741 - KES 2,965","8532965","10","Ngong Racecourse Off Ngong Road, Nairobi Kenya","The Curragh Irish Pub and Bistro",,"https://www.tripadvisor.com/Restaurant_Review-g294207-d8532965-Reviews-The_Curragh_Irish_Pub_and_Bistro-Nairobi.html","We are Nairobi's only Irish pub, tucked away from all the hustle and bustle of city life, in the beautiful green and leafy surrounds of Ngong Racecourse. We have a multitude of different spaces available to relax in, from our authentic Irish pub, our scenic and quiet outdoor space surrounded by ancient old trees, and we have recently opened out Moët & Chandon champagne terrace, with gorgeous views of Ngong forest and the golf club. We can be hired out for parties such as weddings, birthdays and corporate events.","3.094963312149048","-1.311139","restaurant","http://thecurraghnairobi.com/","RESTAURANT","https://media-cdn.tripadvisor.com/media/photo-o/09/69/d8/39/the-curragh-irish-pub.jpg","833",,"+254 724 902068","false","false","Restaurants",,"24","info@thecurraghnairobi.com","36.742153","Nairobi","$$ - $$$","3.5"
"Ribs",,,,,,,,,,,,,,,,,,,"Nairobi","Kenya","00600",,"Shop B1, 13 Dagoretti Road, Karen Hub","The Hub Karen",,,"Africa/Nairobi","1260","540",,,"1260","540","1260","540","1260","540","1260","540","1260","540","1260","540",,,"Steakhouse",,,,,,,,"1","1","4","3","6",,,,,,,,,,,,,,,,,,,,,,,,,,,,,,,,,,,"294207","Nairobi","Municipality",,"294206","Kenya","Country",,,,,"370","","Lunch","Dinner","Breakfast",,,,"Reservations","Seating","Wheelchair Accessible","Table Service",,,,,,,,,,,,,,,,,,,"Closed Now","#370 of 1,048 places to eat in Nairobi","Lunch","Dinner","Breakfast",,,,,"10804717","52","Shop B1, 13 Dagoretti Road, Karen Hub The Hub Karen, Nairobi 00600 Kenya","Eagle Peak Spur","https://www.spursteakranches.com/ke/article/menu?utm_source=Tripadvisor&utm_medium=menu_link&utm_campaign=SP&utm_content=SP","https://www.tripadvisor.com/Restaurant_Review-g294207-d10804717-Reviews-Eagle_Peak_Spur-Nairobi.html","Spur serves its famous flame-grilled burgers and steaks, fresh salads and decadent desserts to families from all over the world. As a distinctly family-orientated band, we offer an environment where the whole “tribe” can come relax and enjoy themselves. This is the way it has always been at Spur and the reason why we have found a special place in the hearts of our customer over several generations!","3.1002607345581055","-1.320317","restaurant","http://www.spursteakranches.com/ke?utm_source=Tripadvisor&utm_medium=website_link&utm_campaign=SP&utm_content=SP","RESTAURANT","https://media-cdn.tripadvisor.com/media/photo-w/17/83/d1/fa/logo.jpg","833",,"0702555000","false","false","Restaurants",,"15","Spur@optiven.co.ke","36.70385","Nairobi","$$ - $$$","4"
,,,,,,,,,,,,,,,,,,,"Nairobi","Kenya",,,"Forest Edge Rd","Off Langata road. Karen - Nairobi","Sit down",,"Africa/Nairobi","1350","540",,,"1350","540","1350","540","1350","540","1350","540","1350","540","1350","540",,,"African","Bar","Wine Bar","Indian","Barbecue",,,,"0","0","0","0","2",,,,,,,,,,,,,,,,,,,,,,,,,,,,,,,,,,,"294207","Nairobi","Municipality",,"294206","Kenya","Country",,,,,"414","","Lunch","Dinner","Drinks","Breakfast","Brunch","Late Night","Delivery","Takeout","Reservations","Outdoor Seating","Buffet","Private Dining","Parking Available","Highchairs Available","Serves Alcohol","Full Bar","Wine and Beer","Digital Payments","Free Wifi","Accepts Credit Cards","Table Service","Family style","Non-smoking restaurants",,,,,,"Closed Now","#414 of 1,048 places to eat in Nairobi","Lunch","Dinner","Drinks","Breakfast","Brunch","Late Night","KES 222,354 - KES 592,944","26430781","41","Forest Edge Rd Off Langata road. Karen - Nairobi, Nairobi Kenya","Qmins Bar & Kitchen",,"https://www.tripadvisor.com/Restaurant_Review-g294207-d26430781-Reviews-Qmins_Bar_Kitchen-Nairobi.html","Nestled in the serene embrace of Karen, just off the enchanting Forest Edge Road, Qmins Bar and Kitchen is a captivating oasis where nature's beauty meets culinary mastery. Our meticulously curated garden provides an idyllic backdrop to your dining experience, while our bar and kitchen offer a blend of sophistication and comfort. With a menu celebrating Indian, African, and international cuisines, each plate is a masterpiece that transcends borders. Beyond our delectable offerings, we also provide Events and Conferencing services, seamlessly fusing culinary excellence with event planning expertise. Qmins Bar and Kitchen stands as a testament to the harmonious blend of nature's beauty, global flavours, and the art of hospitality – a destination where every visit is an escape into a world of taste and elegance.","3.082098960876465","-1.340014","restaurant",,"RESTAURANT","https://media-cdn.tripadvisor.com/media/photo-o/29/e3/41/1a/discover-a-hidden-gem.jpg","833",,"+254 758 864729","false","false","Restaurants",,"2","kenyaqmins22@gmail.com","36.76606","Nairobi","$$ - $$$","5"
,,,,,,,,,,,,,,,,,,,"Nairobi","Kenya",,,"Ngong Road.","200 Meters from Karen Shopping Center",,,"Africa/Nairobi","720","420",,,"720","420","720","420","720","420","720","420","720","420","720","420",,,,,,,,,,,"0","1","0","6","3",,,,,,,,,,,,,,,,,,,,,,,,,,,,,,,,,,,"294207","Nairobi","Municipality",,"294206","Kenya","Country",,,,,"363","","Breakfast","Lunch",,,,,"Reservations",,,,,,,,,,,,,,,,,,,,,,"Closed Now","#363 of 1,048 places to eat in Nairobi","Breakfast","Lunch",,,,,,"10723821","1","Ngong Road. 200 Meters from Karen Shopping Center, Nairobi Kenya","Legend Karen",,"https://www.tripadvisor.com/Restaurant_Review-g294207-d10723821-Reviews-Legend_Karen-Nairobi.html",,"3.10429310798645","-1.32416","restaurant","https://www.facebook.com/clublegendkaren/","RESTAURANT","https://media-cdn.tripadvisor.com/media/photo-o/11/d7/3e/9e/these-silly-guys-attract.jpg","832",,"+254 718 774447","false","false","Restaurants",,"10",,"36.70858","Nairobi",,"4"
"Burger",,,,,,,,,,,,,,,,,,,"Karen","Kenya",,,"Dagoretti Road","The Hub Mall","Sit down",,,,,,,,,,,,,,,,,,,,,"Fast Food",,,,,,,,"1","0","2","7","3",,,,,,,,,,,,,,,,,,,,,,,,,,,,,,,,,,,"12559418","Karen","City",,"294207","Nairobi","Municipality",,"294206","Kenya","Country","10","","Dinner","Lunch",,,,,"Seating","Wheelchair Accessible",,,,,,,,,,,,,,,,,,,,,,"#10 of 29 places to eat in Karen","Dinner","Lunch",,,,,,"15028401","2","Dagoretti Road The Hub Mall, Karen, Nairobi Kenya","Burger King",,"https://www.tripadvisor.com/Restaurant_Review-g12559418-d15028401-Reviews-Burger_King-Karen_Nairobi.html",,"3.10351824760437","-1.32429","restaurant",,"RESTAURANT","https://media-cdn.tripadvisor.com/media/photo-o/15/ae/f6/b7/20181204-170106-largejpg.jpg","22",,"+254 712 345678","false","false","Restaurants","Quick Bites","13",,"36.70857","Karen, Nairobi","$$ - $$$","4"
"Pork",,,,,,,,,,,,,,,,,,,"Nairobi","Kenya",,,"Ndemi Road Off Ngong Road",,"Sit down",,,,,,,,,,,,,,,,,,,,,"Asian","Korean","Vegetarian Friendly",,,,,,"1","0","1","8","14",,,,,,,,,,,,,,,,,,,,,,,,,,,,,,,,,,,"294207","Nairobi","Municipality",,"294206","Kenya","Country",,,,,"200","","Dinner","Lunch",,,,,"Seating","Takeout","Reservations","Table Service",,,,,,,,,,,,,,,,,,,,"#200 of 1,048 places to eat in Nairobi","Dinner","Lunch",,,,,,"5988078","21","Ndemi Road Off Ngong Road, Nairobi Kenya","Dae Jang Geum",,"https://www.tripadvisor.com/Restaurant_Review-g294207-d5988078-Reviews-Dae_Jang_Geum-Nairobi.html",,"3.229800224304199","-1.30822","restaurant",,"RESTAURANT","https://media-cdn.tripadvisor.com/media/photo-o/0b/1a/b7/42/october-2015-a-serving.jpg","833",,"+254 707 369355","false","false","Restaurants",,"24",,"36.73304","Nairobi","$$ - $$$","4.5"
,,,,,,,,,,,,,,,,,,,"Nairobi","Kenya",,,"Dagoretti Road","The Hub Karen mall",,,,,,,,,,,,,,,,,,,,,,"Indian","Asian","Vegan Options","Vegetarian Friendly",,,,,"2","3","3","8","7",,,,,,,,,,,,,,,,,,,,,,,,,,,,,,,,,,,"294207","Nairobi","Municipality",,"294206","Kenya","Country",,,,,"349","","Dinner","Lunch",,,,,"Reservations","Seating","Table Service","Takeout","Outdoor Seating","Wheelchair Accessible",,,,,,,,,,,,,,,,,,"#349 of 1,048 places to eat in Nairobi","Dinner","Lunch",,,,,,"13427905","4","Dagoretti Road The Hub Karen mall, Nairobi Kenya","Mayura","http://www.themayura.com/menu.php","https://www.tripadvisor.com/Restaurant_Review-g294207-d13427905-Reviews-Mayura-Nairobi.html",,"3.109950542449951","-1.298233","restaurant","http://www.themayura.com/","RESTAURANT","https://media-cdn.tripadvisor.com/media/photo-o/13/77/b3/8f/entrance-sign.jpg","833",,"+254 737 224422","false","false","Restaurants",,"23","info@themayura.com","36.682102","Nairobi","$$ - $$$","3.5"
,,,,,,,,,,,,,,,,,,,"Nairobi","Kenya",,,"Parklands Road","Sarit Centre",,,"Africa/Nairobi","1320","600",,,"1320","600","1320","600","1320","600","1320","600","1320","600","1320","600",,,,,,,,,,,"0","0","0","1","2",,,,,,,,,,,,,,,,,,,,,,,,,,,,,,,,,,,"294207","Nairobi","Municipality",,"294206","Kenya","Country",,,,,"510","","Lunch","Dinner",,,,,,,,,,,,,,,,,,,,,,,,,,,"Closed Now","#510 of 1,048 places to eat in Nairobi","Lunch","Dinner",,,,,,"13662110","0","Parklands Road Sarit Centre, Nairobi Kenya","Planet Yogurt Sarit Centre",,"https://www.tripadvisor.com/Restaurant_Review-g294207-d13662110-Reviews-Planet_Yogurt_Sarit_Centre-Nairobi.html",,"3.054206609725952","-1.29827","restaurant","http://www.planetyogurt.co.ke","RESTAURANT",,"832",,"+254 702 278254","false","false","Restaurants",,"3","sarit@planetyogurt.co.ke","36.76275","Nairobi",,"4.5"
,,,,,,,,,,,,,,,,,,,"Karen","Kenya",,,"Langata Road","Galleria Mall","Sit down",,"Africa/Nairobi","1020","540",,,"1020","540","1020","540","1020","540","1020","540","1020","540","1020","540",,,"African","Barbecue",,,,,,,"1","1","0","2","7",,,,,,,,,,,,,,,,,,,,,,,,,,,,,,,,,,,"12559418","Karen","City",,"294207","Nairobi","Municipality",,"294206","Kenya","Country","8","","Breakfast","Lunch","Dinner","Brunch","Drinks",,"Reservations",,,,,,,,,,,,,,,,,,,,,,"Closed Now","#8 of 29 places to eat in Karen","Breakfast","Lunch","Dinner","Brunch","Drinks",,"KES 29,647 - KES 296,472","19866300","20","Langata Road Galleria Mall, Karen, Nairobi Kenya","Mbuzi Munch Galleria",,"https://www.tripadvisor.com/Restaurant_Review-g12559418-d19866300-Reviews-Mbuzi_Munch_Galleria-Karen_Nairobi.html","Mbuzi Munch is a goat ""Nyama Choma"" restaurant. Nyama Choma is Swahili for grilled meat and the National Dish of Kenya. Our goat is organically raised and grass fed goat, well hung and bespoke marinated in our secret sauce before being slowly barbequed on our smoke and dust free lava grill. A range of non-goat burgers, wraps, quesadillas etc. also available. Don't leave Kenya without having tried us!","3.1198832988739014","-1.342628","restaurant","https://www.facebook.com/mbuzimunch/?ref=bookmarks","RESTAURANT","https://media-cdn.tripadvisor.com/media/photo-m/1280/1a/9b/28/a0/mbuzi-munch-is-a-goat.jpg","22",,"+254 794 587187","false","false","Restaurants",,"11","galleria@mbuzimunch.com","36.767204","Karen, Nairobi","$$ - $$$","4"
,,,,,,,,,,,,,,,,,,,"Nairobi","Kenya","00100",,"Southern Bypass, Just Before Ole Sereni Hotel.",,,,,,,,,,,,,,,,,,,,,,,"International","Barbecue","Asian","Grill","Healthy",,,,"0","0","1","5","1",,,,,,,,,,,,,,,,,,,,,,,,,,,,,,,,,,,"294207","Nairobi","Municipality",,"294206","Kenya","Country",,,,,"346","",,,,,,,,,,,,,,,,,,,,,,,,,,,,,,"#346 of 1,048 places to eat in Nairobi",,,,,,,,"21226367","13","Southern Bypass, Just Before Ole Sereni Hotel., Nairobi 00100 Kenya","Emara Ole Sereni Pool Bar",,"https://www.tripadvisor.com/Restaurant_Review-g294207-d21226367-Reviews-Emara_Ole_Sereni_Pool_Bar-Nairobi.html",,"3.111691474914551","-1.309135","restaurant",,"RESTAURANT","https://media-cdn.tripadvisor.com/media/photo-m/1280/1d/12/8e/6f/view-on-the-nairobi-national.jpg","833",,,"false","false","Restaurants",,"7",,"36.729378","Nairobi","$$ - $$$","4"
,,,,,,,,,,,,,,,,,,,"Nairobi","Kenya","00509",,"Ngong Rd","Karen Landmark Outlet, Karen Shopping Centre, Opposite Karen Provision Store","Café",,,,,,,,,,,,,,,,,,,,,"African","Dutch",,,,,,,"1","0","0","5","7",,,,,,,,,,,,,,,,,,,,,,,,,,,,,,,,,,,"294207","Nairobi","Municipality",,"294206","Kenya","Country",,,,,"321","","Brunch",,,,,,"Wheelchair Accessible",,,,,,,,,,,,,,,,,,,,,,,"#321 of 1,048 places to eat in Nairobi","Brunch",,,,,,"KES 148 - KES 2,224","12475098","0","Ngong Rd Karen Landmark Outlet, Karen Shopping Centre, Opposite Karen Provision Store, Nairobi 00509 Kenya","BBROOD",,"https://www.tripadvisor.com/Restaurant_Review-g294207-d12475098-Reviews-BBROOD-Nairobi.html","BBROOD is a high-quality bakery chain, originally from the Netherlands, with a strong focus on high-quality, artisan sourdough bread. All our sourdough breads are handcrafted, traditionally prepared without use of additional sugars, preservatives or additives; and finally baked in a stone floor oven to produce the crusty, tasty authentic product we are proud of;Bread in its purest form, 100% natur","3.1220362186431885","-1.322956","restaurant","http://www.bbrood.co.ke/pagina32/Karen+Landmark+Outlet.html","RESTAURANT",,"833",,"+254 799 871821","false","false","Restaurants",,"13","office-ke@bbrood.com","36.70683","Nairobi","$","4.5"
"Sandwiches","Burger","Ribs","Salad","Beef","Pork",,,,,,,,,,,,,,"Nairobi","Kenya","00200",,"Dagoretti Road","The Hub Mall","Sit down",,"Africa/Nairobi","1200","540",,,"1200","540","1200","540","1200","540","1200","540","1200","540","1200","540",,,"Steakhouse","Cafe","Barbecue","Grill",,,,,"5","6","11","21","14",,,,,,,,,,,,,,,,,,,,,,,,,,,,,,,,,,,"294207","Nairobi","Municipality",,"294206","Kenya","Country",,,,,"308","","Lunch","Breakfast","Drinks",,,,"Takeout","Reservations","Outdoor Seating","Seating","Parking Available","Highchairs Available","Wheelchair Accessible","Serves Alcohol","Full Bar","Accepts Mastercard","Accepts Visa","Digital Payments","Free Wifi","Table Service",,,,,,,,,"Closed Now","#308 of 1,048 places to eat in Nairobi","Lunch","Breakfast","Drinks",,,,"KES 1,482 - KES 5,633","10215035","32","Dagoretti Road The Hub Mall, Nairobi 00200 Kenya","Roast by Carnivore",,"https://www.tripadvisor.com/Restaurant_Review-g294207-d10215035-Reviews-Roast_by_Carnivore-Nairobi.html","The Roast by Carnivore is a casual eatery that lays great emphasis on offering deliciously-inspiring meat platters, fresh crunchy salads, filling ‘Nyama Choma’ sandwiches, mouthwatering selections of both pork & beef spare ribs, refreshing cocktails, a fully stocked bar Roast located in the Hub shopping mall, has a delicious ‘Signature’ Menu and also offers office & home deliveries.","3.130448579788208","-1.320172","restaurant","http://www.facebook.com/RoastbyCarnivore/","RESTAURANT","https://media-cdn.tripadvisor.com/media/photo-o/0b/43/2d/96/photo0jpg.jpg","833",,"+254 701 715373","false","false","Restaurants",,"57","roast@tamarind.co.ke","36.703735","Nairobi","$$ - $$$","3.5"
