"0","0","0","3","3","https://www.javahouseafrica.com/our-menu/","https://www.tripadvisor.com/Restaurant_Review-g294207-d14005041-Reviews-Java_House_Prestige_Plaza-Nairobi.html",,,"Africa/Nairobi","1260","390",,,,,"1260","390",,,,,"1260","390",,,,,"1260","390",,,,,"1260","390",,,,,"1260","390",,,,,"1260","390",,,,,"3.1090221405029297","-1.301184","Delivery","Takeout","Outdoor Seating","Seating","Parking Available","Highchairs Available","Free Wifi","Accepts Credit Cards",,,,,,,,,,,,,,"294207","Nairobi","Municipality",,"294206","Kenya","Country",,,,,"Breakfast","Lunch","Dinner","Brunch",,,"African","Cafe","Diner","Mexican","Healthy",,,,,,,,,,,,,,,,,,,,,,,,,,,,,,,,,,,,,,,,,,,,,,,,,,,,,,,,,,,,,,,,,,,,,,"restaurant","Nairobi","Kenya","00505",,"Ngong Road","Prestige Plaza","http://www.javahouseafrica.com/","Breakfast","Lunch","Dinner","Brunch",,,"RESTAURANT","https://media-cdn.tripadvisor.com/media/photo-m/1280/1a/9d/fd/fe/photo0jpg.jpg","833",,"+254 721 555831","false","352","#352 of 1,048 places to eat in Nairobi","KES 296 - KES 1,779","13","Ngong Road Prestige Plaza, Nairobi 00505 Kenya","Java House Prestige Plaza","false","Restaurants",,,"6","guest.relations@javahouseafrica.com","36.780365",,,"Nairobi","$","Fast food","4.5","","Closed Now","14005041"
"5","6","11","21","14",,"https://www.tripadvisor.com/Restaurant_Review-g294207-d10215035-Reviews-Roast_by_Carnivore-Nairobi.html","The Roast by Carnivore is a casual eatery that lays great emphasis on offering deliciously-inspiring meat platters, fresh crunchy salads, filling ‘Nyama Choma’ sandwiches, mouthwatering selections of both pork & beef spare ribs, refreshing cocktails, a fully stocked bar Roast located in the Hub shopping mall, has a delicious ‘Signature’ Menu and also offers office & home deliveries.",,"Africa/Nairobi","1200","540",,,,,"1200","540",,,,,"1200","540",,,,,"1200","540",,,,,"1200","540",,,,,"1200","540",,,,,"1200","540",,,,,"3.130448579788208","-1.320172","Takeout","Reservations","Outdoor Seating","Seating","Parking Available","Highchairs Available","Wheelchair Accessible","Serves Alcohol","Full Bar","Accepts Mastercard","Accepts Visa","Digital Payments","Free Wifi","Table Service",,,,,,,,"294207","Nairobi","Municipality",,"294206","Kenya","Country",,,,,"Lunch","Breakfast","Drinks",,,,"Steakhouse","Cafe","Barbecue","Grill",,,,,,,,,,,,"Sandwiches","Burger","Ribs","Salad","Beef","Pork",,,,,,,,,,,,,,,,,,,,,,,,,,,,,,,,,,,,,,,,,,,,,,,,,,,,,,"restaurant","Nairobi","Kenya","00200",,"Dagoretti Road","The Hub Mall","http://www.facebook.com/RoastbyCarnivore/","Lunch","Breakfast","Drinks",,,,"RESTAURANT","https://media-cdn.tripadvisor.com/media/photo-o/0b/43/2d/96/photo0jpg.jpg","833",,"+254 701 715373","false","308","#308 of 1,048 places to eat in Nairobi","KES 1,482 - KES 5,633","32","Dagoretti Road The Hub Mall, Nairobi 00200 Kenya","Roast by Carnivore","false","Restaurants",,,"57","roast@tamarind.co.ke","36.703735",,,"Nairobi","$$ - $$$","Sit down","3.5","","Closed Now","10215035"
"3","1","11","10","10","https://www.kizalounge.co.ke/kiza-restaurant/#menu","https://www.tripadvisor.com/Restaurant_Review-g294207-d10643288-Reviews-Kiza_Restaurant_and_Lounge_Nairobi-Nairobi.html","KIZA Restaurant & Lounge is a fine dining contemporary take on the African experience like no other, offering excellently presented, authentic, culinary tastes from the continent - and a multi-sensory ambience that reflects the richness, vibrancy and unique influence of African Culture.",,"Africa/Nairobi",,,,,,,"1439","300",,,,,,,,,,,,,,,,,,,,,,,,,,,,,,,,,,,"3.1229844093322754","-1.290779","Reservations","Seating","Wheelchair Accessible","Serves Alcohol",,,,,,,,,,,,,,,,,,"294207","Nairobi","Municipality",,"294206","Kenya","Country",,,,,"Breakfast","Lunch","Dinner","Late Night","Drinks",,"Brew Pub","African","Moroccan","Barbecue","Mediterranean","Pub","Vegetarian Friendly",,,,,,,,,,,,,,,,,,,,,,,,,,,,,,,,,,,,,,,,,,,,,,,,,,,,,,,,,,,,,,,,,,,,"restaurant","Nairobi","Kenya","00600",,"Galana Road","8th & 9th Floor, Galana Plaza","http://www.kizalounge.co.ke","Breakfast","Lunch","Dinner","Late Night","Drinks",,"RESTAURANT","https://media-cdn.tripadvisor.com/media/photo-o/0c/90/fc/5d/before-the-crowds-get.jpg","833",,"+(254)13804636","false","316","#316 of 1,048 places to eat in Nairobi",,"16","Galana Road 8th & 9th Floor, Galana Plaza, Nairobi 00600 Kenya","Kiza Restaurant and Lounge Nairobi","false","Restaurants",,,"35","kizanairobi@gmail.com","36.7828",,,"Nairobi","$$$$",,"3.5","","Closed today","10643288"
"1","0","0","5","7",,"https://www.tripadvisor.com/Restaurant_Review-g294207-d12475098-Reviews-BBROOD-Nairobi.html","BBROOD is a high-quality bakery chain, originally from the Netherlands, with a strong focus on high-quality, artisan sourdough bread. All our sourdough breads are handcrafted, traditionally prepared without use of additional sugars, preservatives or additives; and finally baked in a stone floor oven to produce the crusty, tasty authentic product we are proud of;Bread in its purest form, 100% natur",,,,,,,,,,,,,,,,,,,,,,,,,,,,,,,,,,,,,,,,,,,,,"3.1220362186431885","-1.322956","Wheelchair Accessible",,,,,,,,,,,,,,,,,,,,,"294207","Nairobi","Municipality",,"294206","Kenya","Country",,,,,"Brunch",,,,,,"African","Dutch",,,,,,,,,,,,,,,,,,,,,,,,,,,,,,,,,,,,,,,,,,,,,,,,,,,,,,,,,,,,,,,,,,,,,,,,,"restaurant","Nairobi","Kenya","00509",,"Ngong Rd","Karen Landmark Outlet, Karen Shopping Centre, Opposite Karen Provision Store","http://www.bbrood.co.ke/pagina32/Karen+Landmark+Outlet.html","Brunch",,,,,,"RESTAURANT",,"833",,"+254 799 871821","false","321","#321 of 1,048 places to eat in Nairobi","KES 148 - KES 2,224","0","Ngong Rd Karen Landmark Outlet, Karen Shopping Centre, Opposite Karen Provision Store, Nairobi 00509 Kenya","BBROOD","false","Restaurants",,,"13","office-ke@bbrood.com","36.70683",,,"Nairobi","$","Café","4.5","",,"12475098"
"0","0","0","6","3","https://www.javahouseafrica.com/our-menu/","https://www.tripadvisor.com/Restaurant_Review-g294207-d12936826-Reviews-Java_House_Orbit-Nairobi.html",,,"Africa/Nairobi","1080","480",,,,,"1260","390",,,,,"1260","390",,,,,"1260","390",,,,,"1260","390",,,,,"1260","390",,,,,"1260","390",,,,,"3.125922679901123","-1.25968","Delivery","Reservations","Outdoor Seating","Seating","Street Parking","Free Wifi",,,,,,,,,,,,,,,,"294207","Nairobi","Municipality",,"294206","Kenya","Country",,,,,"Breakfast","Lunch","Dinner","Brunch",,,"African","Mexican","Cafe","Diner","Healthy",,,,,,,,,,,,,,,,,,,,,,,,,,,,,,,,,,,,,,,,,,,,,,,,,,,,,,,,,,,,,,,,,,,,,,"restaurant","Nairobi","Kenya",,,"Westlands Road",,"http://www.javahouseafrica.com/","Breakfast","Lunch","Dinner","Brunch",,,"RESTAURANT","https://media-cdn.tripadvisor.com/media/photo-m/1280/15/1a/6e/60/photo2jpg.jpg","833",,"+254 715 532071","false","314","#314 of 1,048 places to eat in Nairobi",,"5","Westlands Road, Nairobi Kenya","Java House Orbit","false","Restaurants",,,"9","guest.relations@javahouseafrica.com","36.77761",,,"Nairobi","$$ - $$$",,"4.5","","Closed Now","12936826"
"0","0","0","2","7",,"https://www.tripadvisor.com/Restaurant_Review-g294207-d13448848-Reviews-Ally_s_Kitchen_at_The_Seraph-Nairobi.html","Best restaurant in Nairobi if you are looking for good food, exclusivity and privacy.",,,,,,,,,,,,,,,,,,,,,,,,,,,,,,,,,,,,,,,,,,,,,"3.1405954360961914","-1.28661","Reservations",,,,,,,,,,,,,,,,,,,,,"294207","Nairobi","Municipality",,"294206","Kenya","Country",,,,,"Breakfast","Brunch",,,,,"Indian","Fusion","Vegetarian Friendly","Vegan Options",,,,,,,,,,,,,,,,,,,,,,,,,,,,,,,,,,,,,,,,,,,,,,,,,,,,,,,,,,,,,,,,,,,,,,,"restaurant","Nairobi","Kenya","76164",,"Dennis Pritt Road","opposite Dennis Pritt Lounges",,"Breakfast","Brunch",,,,,"RESTAURANT",,"833",,"+254 726 789543","false","289","#289 of 1,048 places to eat in Nairobi","KES 88,942 - KES 400,237","0","Dennis Pritt Road opposite Dennis Pritt Lounges, Nairobi 76164 Kenya","Ally's Kitchen at The Seraph","false","Restaurants",,,"9","jeromealudo007@gmail.com","36.784058",,,"Nairobi","$$ - $$$","Sit down","5","",,"13448848"
"4","2","8","19","8",,"https://www.tripadvisor.com/Restaurant_Review-g294207-d7620244-Reviews-The_Juniper_Kitchen-Nairobi.html",,,,,,,,,,,,,,,,,,,,,,,,,,,,,,,,,,,,,,,,,,,,,,"3.1148574352264404","-1.26778","Outdoor Seating","Seating","Serves Alcohol","Full Bar","Reservations","Table Service",,,,,,,,,,,,,,,,"294207","Nairobi","Municipality",,"294206","Kenya","Country",,,,,"Lunch","Dinner","Drinks",,,,"Bar","Vegetarian Friendly",,,,,,,,,,,,,,,,,,,,,,,,,,,,,,,,,,,,,,,,,,,,,,,,,,,,,,,,,,,,,,,,,,,,,,,,,"restaurant","Nairobi","Kenya",,,"Kabarsiran Avenue",,"https://www.facebook.com/thejuniperkitchen","Lunch","Dinner","Drinks",,,,"RESTAURANT","https://media-cdn.tripadvisor.com/media/photo-o/09/92/6e/bd/the-juniper-kitchen.jpg","833",,"+254 707 612585","false","337","#337 of 1,048 places to eat in Nairobi",,"6","Kabarsiran Avenue, Nairobi Kenya","The Juniper Kitchen","false","Restaurants",,,"41",,"36.76969",,,"Nairobi","$$ - $$$","Café","3.5","",,"7620244"
"0","0","1","3","5",,"https://www.tripadvisor.com/Restaurant_Review-g294207-d17397877-Reviews-Kengele_s-Nairobi.html",,,,,,,,,,,,,,,,,,,,,,,,,,,,,,,,,,,,,,,,,,,,,,"3.1436781883239746","-1.33704",,,,,,,,,,,,,,,,,,,,,,"294207","Nairobi","Municipality",,"294206","Kenya","Country",,,,,,,,,,,"Mexican","European",,,,,,,,,,,,,,,,,,,,,,,,,,,,,,,,,,,,,,,,,,,,,,,,,,,,,,,,,,,,,,,,,,,,,,,,,"restaurant","Nairobi","Kenya",,,"Marula Lane",,"https://www.facebook.com/Kengeles-Marula-307167193333654/",,,,,,,"RESTAURANT","https://media-cdn.tripadvisor.com/media/photo-o/18/08/d8/d6/20190623-132104-largejpg.jpg","833",,"+254 702 029361","false","283","#283 of 1,048 places to eat in Nairobi",,"12","Marula Lane, Nairobi Kenya","Kengele's","false","Restaurants",,,"9",,"36.70846",,,"Nairobi","$$ - $$$",,"4.5","",,"17397877"
"1","4","1","13","12",,"https://www.tripadvisor.com/Restaurant_Review-g294207-d3806675-Reviews-Pete_s_Cafe_Burrito_Haven-Nairobi.html",,,"Africa/Nairobi",,,,,,,"1110","450",,,,,"1110","450",,,,,"1110","450",,,,,"1110","450",,,,,"1110","450",,,,,"1110","450",,,,,"3.157140016555786","-1.298605","Takeout","Seating","Delivery",,,,,,,,,,,,,,,,,,,"294207","Nairobi","Municipality",,"294206","Kenya","Country",,,,,"Breakfast","Lunch","Dinner",,,,"Mexican","Vegetarian Friendly","Vegan Options",,,,,,,,,,,,,"Burrito","Tortillas",,,,,,,,,,,,,,,,,,,,,,,,,,,,,,,,,,,,,,,,,,,,,,,,,,,,,,,,,,"restaurant","Nairobi","Kenya","00300",,"George Padmore Lane, Ground Flr Bishop Magua Center","Ngong Road","https://www.facebook.com/pages/Petes-Cafe-Burrito-Haven/115760191921231","Breakfast","Lunch","Dinner",,,,"RESTAURANT","https://media-cdn.tripadvisor.com/media/photo-o/03/b0/fe/c6/an-actual-burrito-from.jpg","833",,"+254 722 374781","false","270","#270 of 1,048 places to eat in Nairobi",,"15","George Padmore Lane, Ground Flr Bishop Magua Center Ngong Road, Nairobi 00300 Kenya","Pete's Cafe & Burrito Haven","false","Restaurants",,,"31",,"36.790813","20484494","Upper Hill Estate","Nairobi","$","Sit down","4","","Closed Now","3806675"
"0","1","1","10","7",,"https://www.tripadvisor.com/Restaurant_Review-g294207-d2640931-Reviews-The_Smart_Village-Nairobi.html",,,"Africa/Nairobi",,,,,,,"1380","540",,,,,"1380","540",,,,,"1380","540",,,,,"1380","540",,,,,"1380","540",,,,,,,,,,,"3.1371469497680664","-1.29608","Seating","Reservations","Outdoor Seating","Table Service",,,,,,,,,,,,,,,,,,"294207","Nairobi","Municipality",,"294206","Kenya","Country",,,,,"Dinner","Breakfast","Lunch",,,,"African","Ethiopian",,,,,,,,,,,,,,,,,,,,,,,,,,,,,,,,,,,,,,,,,,,,,,,,,,,,,,,,,,,,,,,,,,,,,,,,,"restaurant","Nairobi","Kenya","",,"Elgeyo Marakwet Road","Kilimani",,"Dinner","Breakfast","Lunch",,,,"RESTAURANT","https://media-cdn.tripadvisor.com/media/photo-o/0c/46/f8/d9/new-smart-village-located.jpg","833",,"+254 20 3862440","false","294","#294 of 1,048 places to eat in Nairobi",,"7","Elgeyo Marakwet Road Kilimani, Nairobi Kenya","The Smart Village","false","Restaurants",,,"19",,"36.77926",,,"Nairobi","$$ - $$$",,"4","","Closed Now","2640931"
"0","0","2","0","6",,"https://www.tripadvisor.com/Restaurant_Review-g294207-d17370658-Reviews-Bush_Garden_Restaurant-Nairobi.html","Bush Garden Restaurant is located on 66, Koitobos Road, on the way to the Giraffe Centre. Bush Garden boasts of its spacious evergreen gardens which can be complimented with its unique lit up small gardens. The place is ideal for hosting events like wedding, end of year parties, corporate events, birthday parites etc. We serve all types of cuisine and we are very known for the quality of food and the taste. We make and deliver mouth watering pizzas from our clay oven pizzeria. Bush Garden also has a curio shop with a variety of Wood Carvings, Stones, Masai Beads Jewellery, Masai Shuka, T-shirts, Silver, Bronze arts, Paintings, Flip Flops and many more.",,"Africa/Nairobi","1260","480",,,,,"1260","480",,,,,"1260","480",,,,,"1260","480",,,,,"1260","480",,,,,"1260","480",,,,,"1260","480",,,,,"3.130481719970703","-1.27947","Delivery","Reservations","Outdoor Seating","Private Dining","Seating","Parking Available","Television","Serves Alcohol","Full Bar","Wine and Beer","Cash Only","Free Wifi","Table Service","Playgrounds","Family style","Sports bars",,,,,,"294207","Nairobi","Municipality",,"294206","Kenya","Country",,,,,"Breakfast","Lunch","Dinner","Brunch","Drinks",,"African","Indian","Bar","International","Barbecue","Pub",,,,,,,,,,,,,,,,,,,,,,,,,,,,,,,,,,,,,,,,,,,,,,,,,,,,,,,,,,,,,,,,,,,,,"restaurant","Nairobi","Kenya","00100",,"66 Koitobos Road, Near Giraffe Center",,"https://www.facebook.com/bushgardenrestaurant/","Breakfast","Lunch","Dinner","Brunch","Drinks",,"RESTAURANT","https://media-cdn.tripadvisor.com/media/photo-o/1a/07/01/42/views-from-the-restaurant.jpg","833",,"+254 789 782457","false","307","#307 of 1,048 places to eat in Nairobi","KES 74,118 - KES 370,590","15","66 Koitobos Road, Near Giraffe Center, Nairobi 00100 Kenya","Bush Garden Restaurant","false","Restaurants",,,"8","bushgardensrestaurant@gmail.com","36.78328",,,"Nairobi","$$ - $$$","Sit down","4.5","","Closed Now","17370658"
"0","2","6","8","4",,"https://www.tripadvisor.com/Restaurant_Review-g294207-d4101759-Reviews-Valencia_Gardens-Nairobi.html","Located in the leafy suburbs of Lavington on Riara Road of Kinga'ra Road, Valencia Gardens, the flagship of the Group is fronted by the Victorian style main restaurant building with two dinning areas large enough to hold private parties and an annexe for total privacy. Upstairs are two lounges which guarantee total privacy. They are tastily furnished and equipped with flat screen television sets. A waiter at hand provides tailor made services and trained to spoil one with choice. The boardroom with a balcony offers a bird-eye view of the expansive lush green garden surrounded by century-old trees and variety of well tended flower beds. Designed at two teir levels, the gardens is ideal for family dinning, social functions such as corporate parties and weddings. The picture is not complete without the welcoming terrace bar with an L shaped counter. It is stocked with every conceivable brands of alcoholic and non alcoholic beverages. The coffee shops offers mouth watering pastry and bitings. The menu varies between ala carte and buffet on order and nothing can beat the Choma Ranch.",,,,,,,,,,,,,,,,,,,,,,,,,,,,,,,,,,,,,,,,,,,,,"3.1005468368530273","-1.29801","Seating","Reservations","Wheelchair Accessible","Table Service",,,,,,,,,,,,,,,,,,"294207","Nairobi","Municipality",,"294206","Kenya","Country",,,,,"Lunch","Dinner",,,,,"African","Bar","Grill","Pub","Vegetarian Friendly",,,,,,,,,,,,,,,,,,,,,,,,,,,,,,,,,,,,,,,,,,,,,,,,,,,,,,,,,,,,,,,,,,,,,,"restaurant","Nairobi","Kenya","00100",,"Riara Road","Inside the Kenya Nairobi Museum","http://www.sanvalencia.com/valenciagardens/","Lunch","Dinner",,,,,"RESTAURANT","https://media-cdn.tripadvisor.com/media/photo-o/07/14/0d/d7/valencia-garden.jpg","833",,"+254 710 600925","false","369","#369 of 1,048 places to eat in Nairobi",,"11","Riara Road Inside the Kenya Nairobi Museum, Nairobi 00100 Kenya","Valencia Gardens","false","Restaurants","Bars & Pubs",,"20","info@sanvalencia.com","36.76505",,,"Nairobi","$$ - $$$","Sit down","3.5","",,"4101759"
"2","1","1","12","90",,"https://www.tripadvisor.com/Restaurant_Review-g294207-d7789848-Reviews-Sikia_Fine_Dining_Restaurant-Nairobi.html","Fine Dining Cuisine offering a unique mix of exclusivity, comfort, sophistication and design. The a la carte menu is a tantalizing play of local and international cuisine, meticulously fused to offer the finest dining experience in Nairobi. Sikia is open for Lunch from 12 noon to 3:00p.m. and Dinner from 6.30pm to 10.00pm. Open six days a week Monday to Saturday. Closed on public holidays.",,"Africa/Nairobi",,,,,,,"900","720","1320","1110",,,"900","720","1320","1110",,,"900","720","1320","1110",,,"900","720","1320","1110",,,"900","720","1320","1110",,,"1320","1110",,,,,"3.987501621246338","-1.300669","Reservations","Seating","Parking Available","Serves Alcohol","Digital Payments","Free Wifi","Full Bar",,,,,,,,,,,,,,,"294207","Nairobi","Municipality",,"294206","Kenya","Country",,,,,"Dinner","Lunch",,,,,"International","European","Vegetarian Friendly","Vegan Options","Gluten Free Options",,,,,,,,,,,"Salad","Calamari","Salmon",,,,,,,,,,,,,,,,,,,,,,,,,,,,,,,,,,,,,,,,,,,,,,,,,,,,,,,,,"restaurant","Nairobi","Kenya","00100",,"Kenya Road, UpperHill","Crowne Plaza","http://www.ihg.com/crowneplaza/hotels/us/en/nairobi/nbocp/hoteldetail/dining#","Dinner","Lunch",,,,,"RESTAURANT","https://media-cdn.tripadvisor.com/media/photo-m/1280/1d/00/78/ac/sikia-fine-dining-restaurant.jpg","833",,"+254 20 2746061","false","39","#39 of 1,048 places to eat in Nairobi",,"61","Kenya Road, UpperHill Crowne Plaza, Nairobi 00100 Kenya","Sikia Fine Dining Restaurant","false","Restaurants",,,"106","reservations@cpnairobi.com","36.81499",,,"Nairobi","$$$$",,"5","","Closed Now","7789848"
"0","0","0","5","2",,"https://www.tripadvisor.com/Restaurant_Review-g15517142-d23769505-Reviews-Wama_Africa-Lavington_Nairobi.html","WAMA Africa is a social enterprise restaurant and beer garden that trains young adults living with special needs; be it deaf, mute, blind, physical impairments, certain mental health conditions, or those with albinism.",,"Africa/Nairobi","1380","480",,,,,"1380","480",,,,,"1380","480",,,,,"1380","480",,,,,"1380","480",,,,,"1380","480",,,,,"1380","480",,,,,"3.1534976959228516","-1.279066",,,,,,,,,,,,,,,,,,,,,,"15517142","Lavington","City",,"294207","Nairobi","Municipality",,"294206","Kenya","Country","Breakfast","Lunch","Dinner",,,,"International","Contemporary","Fusion","Australian","Beer restaurants",,,,,,,,,,,,,,,,,,,,,,,,,,,,,,,,,,,,,,,,,,,,,,,,,,,,,,,,,,,,,,,,,,,,,,"restaurant","Lavington","Kenya",,,"Muthangari Road","Just Inside The Blue Gates Of Braeside Gardens Estate","http://www.wamaafrica.org","Breakfast","Lunch","Dinner",,,,"RESTAURANT","https://media-cdn.tripadvisor.com/media/photo-o/25/c4/2c/12/caption.jpg","6",,"+254 748 745010","false","2","#2 of 8 places to eat in Lavington",,"10","Muthangari Road Just Inside The Blue Gates Of Braeside Gardens Estate, Lavington, Nairobi Kenya","Wama Africa","false","Restaurants",,,"7","info@wamaafrica.org","36.7777",,,"Lavington, Nairobi",,,"4.5","","Closed Now","23769505"
"0","0","1","0","0","https://www.javahouseafrica.com/our-menu/","https://www.tripadvisor.com/Restaurant_Review-g294207-d14006359-Reviews-Java_House-Nairobi.html",,,"Africa/Nairobi","1260","390",,,,,"1260","390",,,,,"1260","390",,,,,"1260","390",,,,,"1260","390",,,,,"1260","390",,,,,"1260","390",,,,,"3","-1.298326",,,,,,,,,,,,,,,,,,,,,,"294207","Nairobi","Municipality",,"294206","Kenya","Country",,,,,"Breakfast","Lunch","Dinner",,,,"Caribbean","African","Cafe","Fast Food","Diner",,,,,,,,,,,,,,,,,,,,,,,,,,,,,,,,,,,,,,,,,,,,,,,,,,,,,,,,,,,,,,,,,,,,,,"restaurant","Nairobi","Kenya",,,"Ngong Rd","Adams Arcade Building","https://www.javahouseafrica.com/our-locations/","Breakfast","Lunch","Dinner",,,,"RESTAURANT",,"832",,"+254 721 555831","false","750","#750 of 1,048 places to eat in Nairobi","KES 22,235 - KES 177,883","0","Ngong Rd Adams Arcade Building, Nairobi Kenya","Java House","false","Restaurants",,,"1",,"36.7622",,,"Nairobi","$","Café","3","","Closed Now","14006359"
"0","0","1","3","4",,"https://www.tripadvisor.com/Restaurant_Review-g294207-d23849827-Reviews-Unseen_Nairobi-Nairobi.html","A place for film, food and a view.",,"Africa/Nairobi","1380","660",,,,,,,,,,,"1380","660",,,,,"1380","660",,,,,"1380","660",,,,,"1380","660",,,,,"1380","660",,,,,"3.1509621143341064","-1.292577",,,,,,,,,,,,,,,,,,,,,,"294207","Nairobi","Municipality",,"294206","Kenya","Country",,,,,"Lunch","Dinner",,,,,"Bar","Cafe","Pub","Gastropub","Street Food","Dining bars",,,,,,,,,,,,,,,,,,,,,,,,,,,,,,,,,,,,,,,,,,,,,,,,,,,,,,,,,,,,,,,,,,,,,"restaurant","Nairobi","Kenya",,,"Wood Avenue Plaza, 12th Floor","Opposite Ola Petrol Station","http://www.unseen-nairobi.com","Lunch","Dinner",,,,,"RESTAURANT","https://media-cdn.tripadvisor.com/media/photo-o/21/eb/64/e5/nairobi-city-view.jpg","833",,"+254 115 080360","false","276","#276 of 1,048 places to eat in Nairobi",,"11","Wood Avenue Plaza, 12th Floor Opposite Ola Petrol Station, Nairobi Kenya","Unseen Nairobi","false","Bars & Pubs","Restaurants",,"8","info@unseen-nairobi.com","36.786087",,,"Nairobi",,,"4.5","","Closed Now","23849827"
"2","0","0","0","2",,"https://www.tripadvisor.com/Restaurant_Review-g294207-d17409187-Reviews-Whitefield_Restaurant_Ltd-Nairobi.html",,,,,,,,,,,,,,,,,,,,,,,,,,,,,,,,,,,,,,,,,,,,,,"2.99722957611084","-1.29421",,,,,,,,,,,,,,,,,,,,,,"294207","Nairobi","Municipality",,"294206","Kenya","Country",,,,,,,,,,,"Indian",,,,,,,,,,,,,,,,,,,,,,,,,,,,,,,,,,,,,,,,,,,,,,,,,,,,,,,,,,,,,,,,,,,,,,,,,,"restaurant","Nairobi","Kenya",,,"Kingara close",,,,,,,,,"RESTAURANT","https://media-cdn.tripadvisor.com/media/photo-s/1a/23/89/f7/sizzling-chicken.jpg","832",,"+254 742 894700","false","763","#763 of 1,048 places to eat in Nairobi",,"48","Kingara close, Nairobi Kenya","Whitefield Restaurant Ltd","false","Restaurants",,,"4",,"36.76146",,,"Nairobi",,,"3","",,"17409187"
"20","29","88","268","314",,"https://www.tripadvisor.com/Restaurant_Review-g294207-d802603-Reviews-Haandi_Restaurant-Nairobi.html","Haandi specialises in North Indian Frontier cuisine and true to the spirit of the original concept, the masalas are freshly-prepared daily, all the dishes are cooked to order and absolutely everything you eat is created on the premises. Our trademark glass fronted kitchens add an element of drama to each restaurant, allowing you, the diner, to watch the chefs as they create their own brand of magic. We have always insisted on the freshest, finest ingredients available and this policy has rewarded us with a reputation where quality is paramount and the satisfaction of you, the customer, always comes first. and of course the service is exemplary.",,"Africa/Nairobi","930","750","1350","1110",,,"930","750","1350","1110",,,"930","750","1350","1110",,,"930","750","1350","1110",,,"930","750","1350","1110",,,"930","750","1350","1110",,,"930","750","1350","1110",,,"4.031545162200928","-1.264386","Outdoor Seating","Private Dining","Takeout","Reservations","Seating","Parking Available","Highchairs Available","Serves Alcohol","Full Bar","Wine and Beer","Accepts American Express","Accepts Mastercard","Accepts Visa","Free Wifi","Accepts Credit Cards","Table Service",,,,,,"294207","Nairobi","Municipality",,"294206","Kenya","Country",,,,,"Lunch","Dinner","Late Night",,,,"Indian","Asian","Vegetarian Friendly","Vegan Options","Halal","Gluten Free Options",,,,,,,,,,"Juice & Smoothies","Chili","Curry","Prawns","Lamb","Fish",,,,,,,,,,,,,,,,,,,,,,,,,,,,,,,,,,,,,,,,,,,,,,,,,,,,,,"restaurant","Nairobi","Kenya","00800",,"The Mall Shopping Centre","Ring Rd Westlands, Westlands","http://haandi-kenya.com/","Lunch","Dinner","Late Night",,,,"RESTAURANT","https://media-cdn.tripadvisor.com/media/photo-o/10/2c/7e/41/table-set-up.jpg","833",,"+254 733 648294","false","35","#35 of 1,048 places to eat in Nairobi",,"96","The Mall Shopping Centre Ring Rd Westlands, Westlands, Nairobi 00800 Kenya","Haandi Restaurant","false","Restaurants",,,"719","haandi@haandi-kenya.com","36.802425",,,"Nairobi","$$ - $$$","Sit down","4","","Closes in 3 min","802603"
"3","0","2","1","3","https://www.javahouseafrica.com/our-menu/","https://www.tripadvisor.com/Restaurant_Review-g294207-d14109896-Reviews-Java_House-Nairobi.html",,,,,,,,,,,,,,,,,,,,,,,,,,,,,,,,,,,,,,,,,,,,,,"2.9346699714660645","-1.298387",,,,,,,,,,,,,,,,,,,,,,"294207","Nairobi","Municipality",,"294206","Kenya","Country",,,,,,,,,,,"Diner",,,,,,,,,,,,,,,,,,,,,,,,,,,,,,,,,,,,,,,,,,,,,,,,,,,,,,,,,,,,,,,,,,,,,,,,,,"restaurant","Nairobi","Kenya",,,"Ngong Road","Junction Mall","http://www.javahouseafrica.com",,,,,,,"RESTAURANT","https://media-cdn.tripadvisor.com/media/photo-o/17/2c/0d/fa/java-house.jpg","833",,"+254 725 783402","false","780","#780 of 1,048 places to eat in Nairobi","KES 22,235 - KES 222,354","3","Ngong Road Junction Mall, Nairobi Kenya","Java House","false","Restaurants",,,"9",,"36.76185",,,"Nairobi","$","Café","3","",,"14109896"
