"#329 of 1,048 places to eat in Nairobi","Pizza","Mediterranean","Dining bars",,,,,,,,,,,,,"https://media-cdn.tripadvisor.com/media/photo-m/1280/27/a3/7e/69/live-house.jpg","39",,"294207","Nairobi","Municipality",,"294206","Kenya","Country",,,,,,"Closes in 28 min","http://www.facebook.com/GecoCafe","5","0","4","4","11","Nairobi","Kenya",,,"Mbaazi Avenue",,,,"","3.119189739227295","Restaurants",,"$","+254 792 489449","RESTAURANT","24","false","Café","Great place, very rustic and relaxing ambiance. Good coffee, good wine and good library. Live music spot 3 times a week.","Nairobi","false",,"restaurant","12938339","foodandbeyondkenya@outlook.com","329","832","Geco Cafe","3.5",,,,,,,,,,,,,,,,,,,,,,,,,,,,,,,,,,,,,"KES 22,235 - KES 518,826",,"Africa/Nairobi","1380","480",,,,,"1380","480",,,,,"1380","480",,,,,"1380","480",,,,,"1380","480",,,,,"1380","480",,,,,"1380","480",,,,,"Mbaazi Avenue, Nairobi Kenya","https://www.tripadvisor.com/Restaurant_Review-g294207-d12938339-Reviews-Geco_Cafe-Nairobi.html","-1.292895","36.761875","Breakfast","Lunch","Dinner","Brunch","Drinks",,"Breakfast","Lunch","Dinner","Brunch","Drinks",,"Seating","Table Service","Delivery","Reservations","Outdoor Seating","Parking Available","Digital Payments","Free Wifi","Accepts Credit Cards","Live Music","Jazz Bar",,,,,,,,,,,,,,,,,,,,,,,,,,,,,,,,,,,,,,,,,,
"#326 of 1,048 places to eat in Nairobi","Japanese","Asian","Thai","Indonesian","Malaysian",,,,,,,,,,,"https://media-cdn.tripadvisor.com/media/photo-o/19/08/ce/a3/logo.jpg","36",,"294207","Nairobi","Municipality",,"294206","Kenya","Country",,,,,,"Open Now","http://www.serenahotels.com/serenanairobi/dining/h-s-pan-asian-restaurant","0","0","0","2","4","Nairobi","Kenya","00100",,"Kenyatta Avenue","Nairobi Serena Hotel",,,"","3.119917631149292","Restaurants",,"$$ - $$$","+254 20 2822000","RESTAURANT","6","false","Sit down","Located at Nairobi Serena Hotel, H&S Pan-Asian Restaurant is bringing a taste of Asia to the heart of Nairobi featuring popular Pan-Asian Dishes. Open every Tuesday - Sunday for lunch and dinner service from 11am to Mid-night. H&S, Good Times, Every Time","Nairobi","false",,"restaurant","17851788","nairobi@serena.co.ke","326","833","Herbs and Spices Pan-Asian Restaurant","4.5",,,,,,,,,,,,,,,,,,,,,,,,,,,,,,,,,,,,,"KES 2,224 - KES 4,151",,"Africa/Nairobi","1440","660",,,,,,,,,,,"1440","660",,,,,"1440","660",,,,,"1440","660",,,,,"1440","660",,,,,"1440","660",,,,,"Kenyatta Avenue Nairobi Serena Hotel, Nairobi 00100 Kenya","https://www.tripadvisor.com/Restaurant_Review-g294207-d17851788-Reviews-Herbs_and_Spices_Pan_Asian_Restaurant-Nairobi.html","-1.287008","36.814304","Lunch","Dinner","Drinks",,,,"Lunch","Dinner","Drinks",,,,"Takeout","Reservations","Outdoor Seating","Private Dining","Seating","Parking Available","Highchairs Available","Serves Alcohol","Full Bar","Wine and Beer","Digital Payments","Free Wifi","Accepts Credit Cards","Table Service",,,,,,,,,,,,,,,,,,,,,,,,,,,,,,,,,,,,,,,
"#324 of 1,048 places to eat in Nairobi","Cafe","Fusion","French","Vegetarian Friendly","Vegan Options",,,,,,,,,,,"https://media-cdn.tripadvisor.com/media/photo-o/0e/75/7b/97/try-one-of-nairobi-s.jpg","11",,"294207","Nairobi","Municipality",,"294206","Kenya","Country",,,,,,"Closed Now","http://web.facebook.com/BriocheCafeBistro.Kenya/","1","3","1","6","7","Nairobi","Kenya",,,"Watermark Business Park, Ndege Road, Karen",,,,"","3.120607376098633","Restaurants",,"$$ - $$$","+254 700 202717","RESTAURANT","18","false","Café","Transforming Africa by creating homely environments and surprising your taste so that you can be inspired and contribute too.","Nairobi","false",,"restaurant","11894171","eat@briochekenya.com","324","833","Brioche Cafe Bistro","4",,,,,,,,,,,,,,,,,,,,,,,,,,,,,,,,,,,,,"KES 14,824 - KES 355,766",,"Africa/Nairobi","1080","420",,,,,"1140","420",,,,,"1140","420",,,,,"1140","420",,,,,"1320","420",,,,,"1320","420",,,,,"1080","420",,,,,"Watermark Business Park, Ndege Road, Karen, Nairobi Kenya","https://www.tripadvisor.com/Restaurant_Review-g294207-d11894171-Reviews-Brioche_Cafe_Bistro-Nairobi.html","-1.304807","36.847397","Breakfast","Drinks","Lunch","Dinner","Brunch",,"Breakfast","Drinks","Lunch","Dinner","Brunch",,"Parking Available","Free off-street parking","Highchairs Available","Serves Alcohol","Full Bar","Accepts Mastercard","Accepts Visa","Digital Payments","Free Wifi","Takeout","Reservations","Outdoor Seating","Seating","Wheelchair Accessible","Table Service",,,,,,,,,,,,,,,,,,,,,,,,,,,,,,,,,,,,,,
"#319 of 1,048 places to eat in Nairobi",,,,,,,,,,,,,,,,"https://media-cdn.tripadvisor.com/media/photo-m/1280/22/d6/5a/6f/enjoy-our-drinks.jpg","26",,"294207","Nairobi","Municipality",,"294206","Kenya","Country",,,,,"https://www.prontorestaurant.co.ke/wp/our-menu/","Closed Now","http://prontorestaurant.co.ke/","2","0","2","3","6","Nairobi","Kenya","00100",,"Standard Street, Wabera Street, Kimathi Street and Aga Khan Walk",,"20484493","Nairobi Central Business District","","3.122744083404541","Restaurants",,"$","+254 714 999666","RESTAURANT","13","false","Sit down","As one of Nairobi`s acclaimed restaurant Pronto showcases ingredient led cuisines that demonstrate the highly skilled technique and relentless drive for fine dining and customer satisfaction that has become the restaurant`s trademark. The brand continues to evolve and has expanded to 4 more outlets within Nairobi. Each location strategically features a unique atmosphere with scenic views and great ambience. Pronto Restaurant is the ideal venue for breakfast, brunch, lunch and dinner with friends and family, corporate meetings, birthday parties.","Nairobi","false",,"restaurant","18195106","info@prontorestaurant.co.ke","319","833","Pronto Restaurant","4",,,,,,,,,,,,,,,,,,,,,,,,,,,,,,,,,,,,,"KES 148 - KES 1,927",,"Africa/Nairobi","1260","360",,,,,"1350","360",,,,,"1350","360",,,,,"1350","360",,,,,"1350","360",,,,,"1350","360",,,,,"1350","360",,,,,"Standard Street, Wabera Street, Kimathi Street and Aga Khan Walk, Nairobi 00100 Kenya","https://www.tripadvisor.com/Restaurant_Review-g294207-d18195106-Reviews-Pronto_Restaurant-Nairobi.html","-1.285143","36.822193","Breakfast","Lunch","Dinner","Brunch","Late Night","Drinks","Breakfast","Lunch","Dinner","Brunch","Late Night","Drinks","Delivery","Takeout","Reservations","Outdoor Seating","Private Dining","Seating","Television","Digital Payments","Free Wifi","Accepts Credit Cards","Family style",,,,,,,,,,,,,,,,,,,,,,,,,,,,,,,,,,,,,,,,,,
"#323 of 1,048 places to eat in Nairobi","Bar","Pub",,,,,,,,,,,,,,"https://media-cdn.tripadvisor.com/media/photo-w/0f/5c/c3/69/sarabi-pool-supper-club.jpg","18",,"294207","Nairobi","Municipality",,"294206","Kenya","Country",,,,,,"Open Now","https://sankara.com/dining/sarabi-rooftop-bar/","5","6","8","9","20","Nairobi","Kenya","00100",,"Sankara Hotel, 05 Woodvale Grove",,,,"","3.1206986904144287","Restaurants",,"$$ - $$$","+254 20 4208222","RESTAURANT","48","false","Sit down","Tapas and cocktail menu by the pool-side. With sweeping views over the Nairobi skyline, the Sarabi Rooftop Bae is the city's premier place to socialize. Treat yourself to a selection of cocktails, finest wines, spirits and tapas style. FOOD MENU WITH LIVE BAND PERFORMANCES EVERY FRIDAYS AND SATURDAYS.","Nairobi","false",,"restaurant","2633797","connect@sankara.com","323","833","Sarabi Pool and Rooftop Bar","3.5",,,,,,,,,,,,,,,,,,,,,,,,,,,,,,,,,,,,,,,"Africa/Nairobi","1500","420",,,,,,,,,,,"1500","420",,,,,"1500","420",,,,,"1500","420",,,,,"1500","420",,,,,"1500","420",,,,,"Sankara Hotel, 05 Woodvale Grove, Nairobi 00100 Kenya","https://www.tripadvisor.com/Restaurant_Review-g294207-d2633797-Reviews-Sarabi_Pool_and_Rooftop_Bar-Nairobi.html","-1.26303","36.80328","Lunch","Dinner","Drinks",,,,"Lunch","Dinner","Drinks",,,,"Reservations","Seating","Outdoor Seating","Serves Alcohol","Live Music",,,,,,,,,,,,,,,,,,,,,,,,,,"Tapas",,,,,,,,,,,,,,,,,,,,,,
"#333 of 1,048 places to eat in Nairobi","International",,,,,,,,,,,,,,,"https://media-cdn.tripadvisor.com/media/photo-o/06/60/2f/f0/grilled-paneer-with-carrot.jpg","23",,"294207","Nairobi","Municipality",,"294206","Kenya","Country",,,,,,"Closed Now","https://www.facebook.com/Oro-Restaurant-and-Lounge-at-Suite-Life-261548657333255/","3","4","4","11","16","Nairobi","Kenya","00200",,"Statehouse Crescent","Suite Life Apartments Rooftop",,,"","3.116292715072632","Restaurants",,"$$ - $$$","+254 786 302321","RESTAURANT","38","false","Sit down","Oro is also opening a new gastronomic season with a makeover menu - blending tradition and creativity for lunch and dinner, but also to enjoy breakfast or an aperitif with friends. A safe haven in the city for those for whom combining lifestyle with business is essential, Oro is equipped with Wi-Fi and private connection. Roof Top BBQ Lounge for those enjoying outdoor. Italian flavour and international undertones: Oro is a well groomed, elegant refuge from everyday life in the city, where you can savour a rich selection of unique dishes and drinks immersed in an atmosphere reminiscent of La Dolce Vita in its fine dining indoor restaurant. Nyamgumi Road, Off Dennis Pritt Rod at the Roof Top of Suite Life Serviced Apartments. Outdoor BBQ Lounge or Indoor Fine Dining, the choice is yours!","Nairobi","false",,"restaurant","3569423","oro@unlimiteddirections.com","333","833","Oro Restaurant and Lounge","4",,,,,,,,,,,,,,,,,,,,,,,,,,,,,,,,,,,,,,,"Africa/Nairobi","720","420",,,,,"720","420",,,,,"720","420",,,,,"720","420",,,,,"720","420",,,,,"720","420",,,,,"720","420",,,,,"Statehouse Crescent Suite Life Apartments Rooftop, Nairobi 00200 Kenya","https://www.tripadvisor.com/Restaurant_Review-g294207-d3569423-Reviews-Oro_Restaurant_and_Lounge-Nairobi.html","-1.28632","36.80901","Breakfast","Lunch","Dinner","Late Night","Drinks",,"Breakfast","Lunch","Dinner","Late Night","Drinks",,"Reservations","Seating","Serves Alcohol","Table Service",,,,,,,,,,,,,,,,,,,,,,,,,,,"Ribs",,,,,,,,,,,,,,,,,,,,,,
"#325 of 1,048 places to eat in Nairobi","Chinese","African",,,,,,,,,,,,,,"https://media-cdn.tripadvisor.com/media/photo-m/1280/19/4e/a0/cc/chicken-biriani.jpg","8",,"294207","Nairobi","Municipality",,"294206","Kenya","Country",,,,,,"Closed Now",,"0","0","0","1","4","Nairobi","Kenya",,,"50 Biashara Street",,"20484493","Nairobi Central Business District","","3.1204910278320312","Restaurants",,"$","+254 726 850427","RESTAURANT","5","false",,,"Nairobi","false",,"restaurant","17729747","info@oliveirarestaurant.com","325","833","Oliveira Restaurant","5",,,,,,,,,,,,,,,,,,,,,,,,,,,,,,,,,,,,,,,"Africa/Nairobi","1200","360",,,,,"1290","330",,,,,"1290","330",,,,,"1290","330",,,,,"1290","330",,,,,"1290","330",,,,,"1290","330",,,,,"50 Biashara Street, Nairobi Kenya","https://www.tripadvisor.com/Restaurant_Review-g294207-d17729747-Reviews-Oliveira_Restaurant-Nairobi.html","-1.282911","36.819183","Breakfast","Lunch","Dinner",,,,"Breakfast","Lunch","Dinner",,,,"Delivery","Takeout","Seating",,,,,,,,,,,,,,,,,,,,,,,,,,,,,,,,,,,,,,,,,,,,,,,,,,
"#357 of 1,048 places to eat in Nairobi","American","Indian","African","Cafe","International",,,,,,,,,,,"https://media-cdn.tripadvisor.com/media/photo-m/1280/14/d4/58/d5/overlooking-the-pool.jpg","17",,"294207","Nairobi","Municipality",,"294206","Kenya","Country",,,,,,"Closed Now","http://www.clhg.com","0","0","0","2","4","Nairobi","Kenya","00621",,"Off Limuru Road/Northern bypass, Runda","Two Rivers Shopping Mall",,,"","3.107059955596924","Restaurants",,"$$ - $$$","+254 709 264000","RESTAURANT","6","false","Sit down","Enjoy a variety of light meals, sweet temptations and beverages, served in our #cafe. In addition, we offer conference facilities with buffet lunch and also cater for cocktails and corporate functions. Enjoy a refreshing drink from our Sundowner bar while enjoying breathtaking view of nature from our pool terrace. We offer select service with a luxurious taste.","Nairobi","false",,"restaurant","15083258","cltworivers.resv@clhg.com","357","833","#Cafe -City Lodge at Two Rivers","4.5",,,,,,,,,,,,,,,,,,,,,,,,,,,,,,,,,,,,,"KES 118,589 - KES 370,590",,"Africa/Nairobi","1350","390",,,,,"1320","360",,,,,"1320","360",,,,,"1320","360",,,,,"1320","360",,,,,"1320","360",,,,,"1350","390",,,,,"Off Limuru Road/Northern bypass, Runda Two Rivers Shopping Mall, Nairobi 00621 Kenya","https://www.tripadvisor.com/Restaurant_Review-g294207-d15083258-Reviews-Cafe_City_Lodge_at_Two_Rivers-Nairobi.html","-1.213727","36.79353","Breakfast","Lunch","Dinner",,,,"Breakfast","Lunch","Dinner",,,,,,,,,,,,,,,,,,,,,,,,,,,,,,,,,,,,,,,,,,,,,,,,,,,,,,,,
"#358 of 1,048 places to eat in Nairobi","Mediterranean","Greek",,,,,,,,,,,,,,"https://media-cdn.tripadvisor.com/media/photo-o/11/60/d3/a8/pizza.jpg","33",,"294207","Nairobi","Municipality",,"294206","Kenya","Country",,,,,"http://eatg2g.com/#menu","Closed Now","http://eatg2g.com/","0","0","0","6","2","Nairobi","Kenya","00100",,"Gitanga Road","Valley Arcade Shopping Center",,,"","3.1067941188812256","Restaurants",,"$","+254 704 424424","RESTAURANT","8","false",,"Best Gyros and Napolitan style pizzas in town. We offer gluten free pizzas and gyros as well as vegan options.","Nairobi","false",,"restaurant","12858118","info@eatg2g.com","358","833","Gyros 2 Go","4.5",,,,,,,,,,,,,,,,,,,,,,,,,,,,,,,,,,,,,,,"Africa/Nairobi","1290","540",,,,,"1350","540",,,,,"1350","540",,,,,"1350","540",,,,,"1350","540",,,,,"1350","540",,,,,"1350","540",,,,,"Gitanga Road Valley Arcade Shopping Center, Nairobi 00100 Kenya","https://www.tripadvisor.com/Restaurant_Review-g294207-d12858118-Reviews-Gyros_2_Go-Nairobi.html","-1.290355","36.76978","Breakfast","Lunch","Dinner","Brunch","Late Night","Drinks","Breakfast","Lunch","Dinner","Brunch","Late Night","Drinks","Takeout","Delivery","Reservations","Outdoor Seating","Seating","Parking Available","Television","Serves Alcohol","Wine and Beer","Free Wifi","Accepts Credit Cards",,,,,,,,,,,,,,,,,,,,,,,,,,,,,,,,,,,,,,,,,,
"#350 of 1,048 places to eat in Nairobi","Indian","Bar","Pub","Vegetarian Friendly","Vegan Options",,,,,,,,,,,"https://media-cdn.tripadvisor.com/media/photo-o/10/bd/b2/77/photo8jpg.jpg","26",,"294207","Nairobi","Municipality",,"294206","Kenya","Country",,,,,,,"http://www.facebook.com/Mumbai-Grill-Eataly-Cafe-1796108130649007/","4","1","4","12","7","Nairobi","Kenya",,,"Landmark suites, Mwanzi Road",,,,"","3.1097288131713867","Restaurants",,"$$ - $$$","+254 780 757575","RESTAURANT","28","false",,,"Nairobi","false",,"restaurant","12028669",,"350","833","Mumbai Grill","3.5",,,,,,,,,,,,,,,,,,,,,,,,,,,,,,,,,,,,,,,,,,,,,,,,,,,,,,,,,,,,,,,,,,,,,,,,,,,,,,,,,,"Landmark suites, Mwanzi Road, Nairobi Kenya","https://www.tripadvisor.com/Restaurant_Review-g294207-d12028669-Reviews-Mumbai_Grill-Nairobi.html","-1.258104","36.804394","Dinner","Lunch",,,,,"Dinner","Lunch",,,,,"Reservations","Seating","Takeout","Table Service",,,,,,,,,,,,,,,,,,,,,,,,,,,,,,,,,,,,,,,,,,,,,,,,,
"#317 of 1,048 places to eat in Nairobi","African",,,,,,,,,,,,,,,"https://media-cdn.tripadvisor.com/media/photo-o/0a/1d/54/50/hot-dishes-restaurant.jpg","1",,"294207","Nairobi","Municipality",,"294206","Kenya","Country",,,,,,"Closed Now","http://www.hotdishes.co.ke","0","1","3","7","5","Nairobi","Kenya","00100",,"Bruce house, Kaunda street","Ground Floor","20484493","Nairobi Central Business District","","3.122904062271118","Restaurants",,"$","+254 782 333444","RESTAURANT","16","false","Sit down","We provide contemporary African dishes in the heart of Nairobi. Our delectable meals are decently priced. We also provide meeting facilities for groups of uptown 50 people on Kaunda street. Please call or send us an email to book for a meeting.","Nairobi","false",,"restaurant","3648640","contact@hotdishes.co.ke","317","833","Hot Dishes restaurant (BruceHouse Branch)","4",,,,,,,,,,,,,,,,,,,,,,,,,,,,,,,,,,,,,"KES 296 - KES 889",,"Africa/Nairobi",,,,,,,"1260","360",,,,,"1260","360",,,,,"1260","360",,,,,"1260","360",,,,,"1260","360",,,,,"1260","360",,,,,"Bruce house, Kaunda street Ground Floor, Nairobi 00100 Kenya","https://www.tripadvisor.com/Restaurant_Review-g294207-d3648640-Reviews-Hot_Dishes_restaurant_BruceHouse_Branch-Nairobi.html","-1.28534","36.82242","Breakfast","Lunch","Dinner",,,,"Breakfast","Lunch","Dinner",,,,"Delivery","Television","Digital Payments","Seating","Wheelchair Accessible",,,,,,,,,,,,,,,,,,,,,,,,,,,,,,,,,,,,,,,,,,,,,,,,
"#348 of 1,048 places to eat in Nairobi","Indian","African",,,,,,,,,,,,,,"https://media-cdn.tripadvisor.com/media/photo-o/11/f1/da/64/jikonis.jpg","8",,"294207","Nairobi","Municipality",,"294206","Kenya","Country",,,,,,"Open Now","http://jikonis.co.ke","0","1","0","1","5","Nairobi","Kenya","00200",,"Kiambu Road","off Kiambu Road, opposite Total Petrol Station",,,"","3.1102161407470703","Restaurants",,"$$ - $$$","+254 714 129997","RESTAURANT","7","false","Sit down","A retro cocktail menu, coastal, local, and Jikoni's infused cuisine. The best Bloody Mary's served with chasers (yup, a beer of your choice on the side!). We are about conversation and quality time with those we are surrounded by.","Nairobi","false",,"restaurant","13369422","orders@jikonis.co.ke","348","833","Jikoni's","4.5",,,,,,,,,,,,,,,,,,,,,,,,,,,,,,,,,,,,,"KES 29,647 - KES 444,708",,"Africa/Nairobi","1439","0",,,,,"1439","0",,,,,"1439","0",,,,,"1439","0",,,,,"1439","0",,,,,"1439","0",,,,,"1439","0",,,,,"Kiambu Road off Kiambu Road, opposite Total Petrol Station, Nairobi 00200 Kenya","https://www.tripadvisor.com/Restaurant_Review-g294207-d13369422-Reviews-Jikoni_s-Nairobi.html","-1.23557","36.84371","Brunch","Late Night","Drinks","Breakfast","Lunch","Dinner","Brunch","Late Night","Drinks","Breakfast","Lunch","Dinner","Takeout","Outdoor Seating","Buffet","Private Dining","Seating","Parking Available","Street Parking","Television","Highchairs Available","Wheelchair Accessible","Serves Alcohol","Full Bar","Wine and Beer","Digital Payments","Free Wifi","Accepts Credit Cards",,,,,,,,,,,,,,,,,,,,,,,,,,,,,,,,,,,,,
"#393 of 1,048 places to eat in Nairobi","Lebanese","Mediterranean",,,,,,,,,,,,,,,"0",,"294207","Nairobi","Municipality",,"294206","Kenya","Country",,,,,,,"http://www.cedarsnairobi.com/","0","0","0","0","3","Nairobi","Kenya",,,"United Nations Avenue",,,,"","3.091224431991577","Restaurants",,,,"RESTAURANT","3","false",,,"Nairobi","false",,"restaurant","23521220",,"393","833","Cedars","5",,,,,,,,,,,,,,,,,,,,,,,,,,,,,,,,,,,,,,,,,,,,,,,,,,,,,,,,,,,,,,,,,,,,,,,,,,,,,,,,,,"United Nations Avenue, Nairobi Kenya","https://www.tripadvisor.com/Restaurant_Review-g294207-d23521220-Reviews-Cedars-Nairobi.html","-1.283211","36.814068",,,,,,,,,,,,,,,,,,,,,,,,,,,,,,,,,,,,,,,,,,,,,,,,,,,,,,,,,,,,,,,,,
"#389 of 1,048 places to eat in Nairobi","Lebanese","African","Mediterranean","European","Middle Eastern","Central European","Persian",,,,,,,,,"https://media-cdn.tripadvisor.com/media/photo-m/1280/28/5b/8c/d2/tazeh-r-persian-swahili.jpg","12",,"294207","Nairobi","Municipality",,"294206","Kenya","Country",,,,,"https://www.facebook.com/pg/tazehfood/menu/?p_ref=pa","Closed Now","http://www.facebook.com/tazehfood","0","0","0","1","2","Nairobi","Kenya",,,"Two Rivers Shopping Mall",,,,"","3.092893362045288","Restaurants",,"$","+254 700 212222","RESTAURANT","3","false",,"Tazeh® is a fast-casual restaurant, serving fast, fresh, healthy grilled meats and vegetables. Our food is made daily in-house from whole, natural ingredients. Our cold-pressed juices are made daily from the best organic produce and supplements.","Nairobi","false",,"restaurant","19246897","tazehltd@gmail.com","389","833","Tazeh","4.5",,,,,,,,,,,,,,,,,,,,,,,,,,,,,,,,,,,,,,,"Africa/Nairobi","1260","540",,,,,"1260","540",,,,,"1260","540",,,,,"1260","540",,,,,"1260","540",,,,,"1260","540",,,,,"1260","540",,,,,"Two Rivers Shopping Mall, Nairobi Kenya","https://www.tripadvisor.com/Restaurant_Review-g294207-d19246897-Reviews-Tazeh-Nairobi.html","-1.210725","36.795998","Breakfast","Lunch","Dinner","Brunch",,,"Breakfast","Lunch","Dinner","Brunch",,,"Delivery","Takeout","Reservations","Outdoor Seating","Buffet","Private Dining","Seating","Parking Available","Validated Parking","Highchairs Available","Wheelchair Accessible","Free Wifi","Accepts Credit Cards","Table Service","Live Music","Waterfront","Playgrounds","Family style",,,,,,,,,,,,,,,,,,,,,,,,,,,,,,,,,,,
"#394 of 1,048 places to eat in Nairobi","Cafe","Fast Food","International","Barbecue","Grill",,,,,,,,,,,"https://media-cdn.tripadvisor.com/media/photo-o/0d/fb/3d/21/big-square-lavington.jpg","18",,"294207","Nairobi","Municipality",,"294206","Kenya","Country",,,,,,,,"4","1","4","13","5","Nairobi","Kenya",,,"James Gichuru Road","Langton Curve Mall, Nairobi",,,"","3.091096878051758","Restaurants",,"$$ - $$$",,"RESTAURANT","27","false",,,"Nairobi","false",,"restaurant","10351264",,"394","833","Big Square Lavington","3.5",,,,,,,,,,,,,,,,,,,,,,,,,,,,,,,,,,,,,,,,,,,,,,,,,,,,,,,,,,,,,,,,,,,,,,,,,,,,,,,,,,"James Gichuru Road Langton Curve Mall, Nairobi, Nairobi Kenya","https://www.tripadvisor.com/Restaurant_Review-g294207-d10351264-Reviews-Big_Square_Lavington-Nairobi.html","-1.278575","36.76979","Lunch","Dinner","Brunch",,,,"Lunch","Dinner","Brunch",,,,"Takeout","Seating",,,,,,,,,,,,,,,,,,,,,,,,,,,,,"Burger","Ribs",,,,,,,,,,,,,,,,,,,,,
"#396 of 1,048 places to eat in Nairobi","Healthy",,,,,,,,,,,,,,,"https://media-cdn.tripadvisor.com/media/photo-m/1280/18/09/5d/5a/best-turkey-sandwich.jpg","8",,"294207","Nairobi","Municipality",,"294206","Kenya","Country",,,,,,,"http://www.zucchini.co.ke","0","0","0","1","3","Nairobi","Kenya",,,"Abc Place",,"20484492","Highridge","","3.0907366275787354","Restaurants",,,"+254 726 333446","RESTAURANT","4","false",,,"Nairobi","false",,"restaurant","15701025","info@zucchini.co.ke","396","833","Zucchini Greengrocers","5",,,,,,,,,,,,,,,,,,,,,,,,,,,,,,,,,,,,,,,,,,,,,,,,,,,,,,,,,,,,,,,,,,,,,,,,,,,,,,,,,,"Abc Place, Nairobi Kenya","https://www.tripadvisor.com/Restaurant_Review-g294207-d15701025-Reviews-Zucchini_Greengrocers-Nairobi.html","-1.22862","36.80505",,,,,,,,,,,,,,,,,,,,,,,,,,,,,,,,,,,,,,,,,,,,,,,,,,,,,,,,,,,,,,,,,
"#352 of 1,048 places to eat in Nairobi","African","Cafe","Diner","Mexican","Healthy",,,,,,,,,,,"https://media-cdn.tripadvisor.com/media/photo-m/1280/1a/9d/fd/fe/photo0jpg.jpg","13",,"294207","Nairobi","Municipality",,"294206","Kenya","Country",,,,,"https://www.javahouseafrica.com/our-menu/","Closed Now","http://www.javahouseafrica.com/","0","0","0","3","3","Nairobi","Kenya","00505",,"Ngong Road","Prestige Plaza",,,"","3.1090221405029297","Restaurants",,"$","+254 721 555831","RESTAURANT","6","false","Fast food",,"Nairobi","false",,"restaurant","14005041","guest.relations@javahouseafrica.com","352","833","Java House Prestige Plaza","4.5",,,,,,,,,,,,,,,,,,,,,,,,,,,,,,,,,,,,,"KES 296 - KES 1,779",,"Africa/Nairobi","1260","390",,,,,"1260","390",,,,,"1260","390",,,,,"1260","390",,,,,"1260","390",,,,,"1260","390",,,,,"1260","390",,,,,"Ngong Road Prestige Plaza, Nairobi 00505 Kenya","https://www.tripadvisor.com/Restaurant_Review-g294207-d14005041-Reviews-Java_House_Prestige_Plaza-Nairobi.html","-1.301184","36.780365","Breakfast","Lunch","Dinner","Brunch",,,"Breakfast","Lunch","Dinner","Brunch",,,"Delivery","Takeout","Outdoor Seating","Seating","Parking Available","Highchairs Available","Free Wifi","Accepts Credit Cards",,,,,,,,,,,,,,,,,,,,,,,,,,,,,,,,,,,,,,,,,,,,,
"#395 of 1,048 places to eat in Nairobi","Bar","Pub",,,,,,,,,,,,,,"https://media-cdn.tripadvisor.com/media/photo-o/0d/c7/4e/40/photo2jpg.jpg","3",,"294207","Nairobi","Municipality",,"294206","Kenya","Country",,,,,,,,"0","0","5","7","4","Nairobi","Kenya","",,"Ojijo Street, Parklands","",,,"","3.0907952785491943","Restaurants",,"$$ - $$$","3742149 / 3751310","RESTAURANT","16","false","Fast food",,"Nairobi","false",,"restaurant","1126608",,"395","833","Pitcher & Butch","4",,,,,,,,,,,,,,,,,,,,,,,,,,,,,,,,,,,,,,,,,,,,,,,,,,,,,,,,,,,,,,,,,,,,,,,,,,,,,,,,,,"Ojijo Street, Parklands, Nairobi Kenya","https://www.tripadvisor.com/Restaurant_Review-g294207-d1126608-Reviews-Pitcher_Butch-Nairobi.html","-1.26887","36.81223","Breakfast",,,,,,"Breakfast",,,,,,"Outdoor Seating","Reservations","Buffet",,,,,,,,,,,,,,,,,,,,,,,,,,,,,,,,,,,,,,,,,,,,,,,,,,
"#392 of 1,048 places to eat in Nairobi","Bar",,,,,,,,,,,,,,,,"0",,"294207","Nairobi","Municipality",,"294206","Kenya","Country",,,,,,,,"0","1","5","4","5","Nairobi","Kenya","",,"Koinange St, city centre","","20484493","Nairobi Central Business District","","3.091714382171631","Restaurants",,," 344335 ","RESTAURANT","15","false",,,"Nairobi","false",,"restaurant","1214163",,"392","833","Kengeles Bar & Restaurant","4",,,,,,,,,,,,,,,,,,,,,,,,,,,,,,,,,,,,,,,,,,,,,,,,,,,,,,,,,,,,,,,,,,,,,,,,,,,,,,,,,,"Koinange St, city centre, Nairobi Kenya","https://www.tripadvisor.com/Restaurant_Review-g294207-d1214163-Reviews-Kengeles_Bar_Restaurant-Nairobi.html","-1.2837","36.81867","Lunch","Dinner",,,,,"Lunch","Dinner",,,,,"Reservations","Seating",,,,,,,,,,,,,,,,,,,,,,,,,,,,,,,,,,,,,,,,,,,,,,,,,,,
