"#153 of 1,048 places to eat in Nairobi","African","Bar","Pizza","Barbecue","Grill","Pub",,,,,,,,,,"https://media-cdn.tripadvisor.com/media/photo-o/2a/61/54/da/ankole-grill-cajun-grilled.jpg","226",,"294207","Nairobi","Municipality",,"294206","Kenya","Country",,,,,"https://www.ankole.co.ke/food#food-intro","Closes in 10 min","http://www.ankole.co.ke","6","9","7","5","34","Nairobi","Kenya",,,"0.6a, Ktisuru Road",,,,"","3.302849531173706","Restaurants",,,"+254 703 212121","RESTAURANT","61","false",,"Ankole Grill Kitisuru, Fusing familiar Steakhouse classics with African-inspired flavours from around the continent. Named after the iconic cattle breed of East Africa, the Ankole Watusi, we aspire to bring you a unique African steakhouse experience. Ankole Grill Kitisuru has outdoor seating, covered patio and an open fireplace. Perfect for sipping one of our signature cocktails.","Nairobi","false",,"restaurant","23556924","admin@ankole.co.ke","153","833","Ankole Grill Kitisuru","4",,,,,,,,,,,,,,,,,,,,,,,,,,,,,,,,,,,,,,,"Africa/Nairobi","1380","540",,,,,"1380","540",,,,,"1380","540",,,,,"1380","540",,,,,"1380","540",,,,,"1380","540",,,,,"1380","540",,,,,"0.6a, Ktisuru Road, Nairobi Kenya","https://www.tripadvisor.com/Restaurant_Review-g294207-d23556924-Reviews-Ankole_Grill_Kitisuru-Nairobi.html","-1.283211","36.814068","Breakfast","Lunch","Dinner",,,,"Breakfast","Lunch","Dinner",,,,,,,,,,,,,,,,,,,,,,,,,,,,,,,,,,"Burger",,,,,,,,,,,,,,,,,,,,,,
"#158 of 1,048 places to eat in Nairobi","African","Vegetarian Friendly",,,,,,,,,,,,,,"https://media-cdn.tripadvisor.com/media/photo-o/1b/46/89/b2/amaica-restaurant.jpg","73",,"294207","Nairobi","Municipality",,"294206","Kenya","Country",,,,,"https://www.amaica.co.ke/menu/","Closed Now","http://www.amaica.co.ke","13","9","8","40","36","Nairobi","Kenya","00100",,"Getathuru Garden","Off Peponi road",,,"","3.2906806468963623","Restaurants",,"$$ - $$$","+254 716 687248","RESTAURANT","106","false","Sit down","Amaica is an indigenous Kenyan five star restaurant chain that provides an engaging cultural experience for customers. We are renowned for our authentic African food, service excellence based on African hospitality standards, set in an African environment to enhance your experience. Providing healthy, balanced and unique African dishes from around the country. Amaica offers the perfect environment for dining out as well as celebrating special occasions. Amaica Peponi is located in Nairobi's Westlands area. Located in the green leafy suburbs and set against the backdrop of Karura Forest, Amaica Peponi is the ideal getaway for friends, colleagues and family. Amaica JKIA is found within the Jomo Kenyatta International Airport. Located in the international departures terminal 1A Level 2 at the food court.Overlooking the Airport parking apron, runway and hangars, Amaica JKIA guests are treated to a scenic view that has customers enthralled by planes taking off and landing as well beautiful sunrise and sunset moments.","Nairobi","false",,"restaurant","3581892","info@amaica.co.ke","158","833","Amaica The Restaurant","3.5",,,,,,,,,,,,,,,,,,,,,,,,,,,,,,,,,,,,,,,"Africa/Nairobi","1260","540",,,,,"1260","540",,,,,"1260","540",,,,,"1260","540",,,,,"1260","540",,,,,"1260","540",,,,,"1260","540",,,,,"Getathuru Garden Off Peponi road, Nairobi 00100 Kenya","https://www.tripadvisor.com/Restaurant_Review-g294207-d3581892-Reviews-Amaica_The_Restaurant-Nairobi.html","-1.248346","36.80007","Breakfast","Drinks","Lunch","Dinner","Brunch",,"Breakfast","Drinks","Lunch","Dinner","Brunch",,"Delivery","Parking Available","Highchairs Available","Serves Alcohol","Full Bar","Accepts Mastercard","Accepts Visa","Reservations","Seating","Accepts Credit Cards","Outdoor Seating","Buffet",,,,,,,,,,,,,,,,,,,"Beef","Fish",,,,,,,,,,,,,,,,,,,,,
"#157 of 1,048 places to eat in Nairobi","African","Ethiopian","Vegetarian Friendly","Halal",,,,,,,,,,,,"https://media-cdn.tripadvisor.com/media/photo-o/05/c3/7f/5a/yejoka-garden.jpg","31",,"294207","Nairobi","Municipality",,"294206","Kenya","Country",,,,,,"Open Now","http://yejokagarden.com","3","0","2","8","32","Nairobi","Kenya","00506",,"Wood Avenue","Off Argwings Kodhek Rd",,,"","3.291661024093628","Restaurants",,"$$ - $$$","+254 722 333750","RESTAURANT","45","false","Sit down","A delightful and Multi-Cuisined Restaurant with the best cozy bar, DJ and Live band in town. Free WI-Fi and Conferencing Facilities available","Nairobi","false",,"restaurant","6539389","info@yejokagarden.com","157","833","Yejoka Garden","4.5",,,,,,,,,,,,,,,,,,,,,,,,,,,,,,,,,,,,,,,"Africa/Nairobi","1800","600",,,,,"1830","600",,,,,"1830","600",,,,,"1830","600",,,,,"1830","600",,,,,"1830","600",,,,,"1800","600",,,,,"Wood Avenue Off Argwings Kodhek Rd, Nairobi 00506 Kenya","https://www.tripadvisor.com/Restaurant_Review-g294207-d6539389-Reviews-Yejoka_Garden-Nairobi.html","-1.291236","36.785442","Lunch","Dinner",,,,,"Lunch","Dinner",,,,,"Delivery","Takeout","Reservations","Outdoor Seating","Seating","Serves Alcohol",,,,,,,,,,,,,,,,,,,,,,,,,,,,,,,,,,,,,,,,,,,,,,,
"#159 of 1,048 places to eat in Nairobi",,,,,,,,,,,,,,,,"https://media-cdn.tripadvisor.com/media/photo-o/0b/23/12/77/the-balcony-bar.jpg","5",,"294207","Nairobi","Municipality",,"294206","Kenya","Country",,,,,,"Closed Now","https://www.kempinski.com/en/nairobi/hotel-villa-rosa/dining/bars/the-balcony/","0","1","0","2","18","Nairobi","Kenya","00800",,"Chiromo Road","Villa Rosa Kempinski",,,"","3.2819669246673584","Restaurants",,,"+254 20 3603000","RESTAURANT","21","false",,"Mixing informal ambience with plush surroundings and entertainment on certain evenings by selected performers.The Balcony Bar is recognized as the place to be seen. Relax in the Balcony's intimate and secure atmosphere with your drink of preference and a light bite to eat on the terrace as you enjoy the last of the evening sun.","Nairobi","false",,"restaurant","10257763","dining.villarosa@kempinski.com","159","833","The Balcony Bar","5",,,,,,,,,,,,,,,,,,,,,,,,,,,,,,,,,,,,,,,"Africa/Nairobi","780","600",,,,,"780","600",,,,,"780","600",,,,,"780","600",,,,,"780","600",,,,,"780","600",,,,,"780","600",,,,,"Chiromo Road Villa Rosa Kempinski, Nairobi 00800 Kenya","https://www.tripadvisor.com/Restaurant_Review-g294207-d10257763-Reviews-The_Balcony_Bar-Nairobi.html","-1.27176","36.8087","Lunch",,,,,,"Lunch",,,,,,"Reservations","Seating","Wheelchair Accessible","Table Service",,,,,,,,,,,,,,,,,,,,,,,,,,,,,,,,,,,,,,,,,,,,,,,,,
"#149 of 1,048 places to eat in Nairobi","African","Cafe","Barbecue","Diner","Arabic",,,,,,,,,,,"https://media-cdn.tripadvisor.com/media/photo-m/1280/29/c1/4b/ca/maa-s-signature-restaurant.jpg","1",,"294207","Nairobi","Municipality",,"294206","Kenya","Country",,,,,,"Closed Now",,"0","0","0","1","9","Nairobi","Kenya",,,"Jabavu road",,,,"","3.3103442192077637","Restaurants",,,"+254 716 942222","RESTAURANT","10","false",,,"Nairobi","false",,"restaurant","26353093",,"149","833","Fez Restaurant","5",,,,,,,,,,,,,,,,,,,,,,,,,,,,,,,,,,,,,,,"Africa/Nairobi","1320","420",,,,,"1320","420",,,,,"1320","420",,,,,"1320","420",,,,,"1320","420",,,,,"1320","420",,,,,"1320","420",,,,,"Jabavu road, Nairobi Kenya","https://www.tripadvisor.com/Restaurant_Review-g294207-d26353093-Reviews-Fez_Restaurant-Nairobi.html","-1.292025","36.795277","Breakfast","Lunch","Dinner","Drinks",,,"Breakfast","Lunch","Dinner","Drinks",,,"Delivery","Takeout","Reservations","Outdoor Seating","Buffet","Parking Available","Accepts American Express","Accepts Mastercard","Accepts Visa","Free Wifi","Accepts Discover","Accepts Credit Cards","Non-smoking restaurants",,,,,,,,,,,,,,,,,,,,,,,,,,,,,,,,,,,,,,,,
"#150 of 1,048 places to eat in Nairobi","European","Vegetarian Friendly",,,,,,,,,,,,,,"https://media-cdn.tripadvisor.com/media/photo-o/09/7a/be/86/big-five-restaurant-bar.jpg","22",,"294207","Nairobi","Municipality",,"294206","Kenya","Country",,,,,,,,"6","9","19","30","39","Nairobi","Kenya","00500",,"Ole Sereni Hotel","Mombasa Road, Opposite Zain offices, Parkside towers",,,"","3.3073606491088867","Restaurants",,"$$ - $$$","+254 20 3901000","RESTAURANT","103","false","Sit down",,"Nairobi","false",,"restaurant","1972241","info@ole-serenihotel.com","150","833","Big Five Restaurant & Bar","4",,,,,,,,,,,,,,,,,,,,,,,,,,,,,,,,,,,,,,,,,,,,,,,,,,,,,,,,,,,,,,,,,,,,,,,,,,,,,,,,,,"Ole Sereni Hotel Mombasa Road, Opposite Zain offices, Parkside towers, Nairobi 00500 Kenya","https://www.tripadvisor.com/Restaurant_Review-g294207-d1972241-Reviews-Big_Five_Restaurant_Bar-Nairobi.html","-1.321215","36.840576","Dinner","Breakfast","Lunch","Brunch",,,"Dinner","Breakfast","Lunch","Brunch",,,"Outdoor Seating","Seating","Parking Available","Serves Alcohol","Full Bar","Reservations","Validated Parking","Highchairs Available","Wheelchair Accessible","Table Service",,,,,,,,,,,,,,,,,,,,,,,,,,,,,,,,,,,,,,,,,,,
"#104 of 1,048 places to eat in Nairobi","Fusion","Vegetarian Friendly","Vegan Options",,,,,,,,,,,,,"https://media-cdn.tripadvisor.com/media/photo-m/1280/13/7b/3f/34/indoor-seating.jpg","122",,"294207","Nairobi","Municipality",,"294206","Kenya","Country",,,,,,"Closed Now","http://www.darirestaurant.com","18","17","27","66","94","Nairobi","Kenya","00502",,"165 Ngong Road","Karen Next to St Christophers School",,,"","3.474431276321411","Restaurants",,"$$ - $$$","+254 706 521573","RESTAURANT","222","false","Sit down","The restaurant has been built at the edge of a natural spring, in the middle of this indigenous forest with utmost sensitivity to environmental conservation. We did our landscaping with hand wheelbarrows to reduce vehicular footprint in the forest. Our lawns can host up to 4 functions at the same time, totaling 1200 pax. We also have an ample secure parking facility. One of Dari's best secrets lies in the gardens which are patrolled by beautiful Impalas, Dik-diks, Tree hyrax, Tree squirrels and birds like peacocks, sunbirds to name a few.","Nairobi","false",,"restaurant","5484496","info@darirestaurant.com","104","833","Dari Restaurant","4",,,,,,,,,,,,,,,,,,,,,,,,,,,,,,,,,,,,,"KES 2,372 - KES 6,374",,"Africa/Nairobi","1320","600",,,,,"1320","600",,,,,"1320","600",,,,,"1320","600",,,,,"1320","600",,,,,"1320","600",,,,,"1320","600",,,,,"165 Ngong Road Karen Next to St Christophers School, Nairobi 00502 Kenya","https://www.tripadvisor.com/Restaurant_Review-g294207-d5484496-Reviews-Dari_Restaurant-Nairobi.html","-1.318298","36.71561","Lunch","Dinner","Brunch","Drinks",,,"Lunch","Dinner","Brunch","Drinks",,,"Takeout","Outdoor Seating","Seating","Parking Available","Free off-street parking","Highchairs Available","Wheelchair Accessible","Serves Alcohol","Full Bar","Wine and Beer","Accepts American Express","Accepts Mastercard","Accepts Visa","Digital Payments","Free Wifi","Accepts Discover","Reservations","Television","Private Dining","Accepts Credit Cards","Playgrounds","Family style",,,,,,,,,"Burger","Salad","Curry","Beef","Lamb","Fish","Pork",,,,,,,,,,,,,,,,
"#155 of 1,048 places to eat in Nairobi","African","European","Fusion",,,,,,,,,,,,,"https://media-cdn.tripadvisor.com/media/photo-m/1280/16/d6/a1/ae/stuffed-chicken-wrapped.jpg","28",,"294207","Nairobi","Municipality",,"294206","Kenya","Country",,,,,,"Open Now","https://www.facebook.com/thecollectivenbo/","0","1","1","8","13","Nairobi","Kenya",,,"Utalii Street","View Park Towers Ground Floor and Street Entrance on Utalii Lane","20484493","Nairobi Central Business District","","3.298302412033081","Restaurants",,"$$ - $$$","+254 20 5147600","RESTAURANT","23","false","Sit down","The Collective is designed to delight the senses and attract people looking for more than just good food. The Collective is a dynamic space combining a restaurant, lounge, and art gallery providing a world class menu with an African twist. In addition to great food and exquisite cocktails The Collective features talented artists and musicians from across the continent.","Nairobi","false",,"restaurant","16746444","info@thecollectivelimited.com","155","832","The Collective Restaurant","4.5",,,,,,,,,,,,,,,,,,,,,,,,,,,,,,,,,,,,,"KES 88,942 - KES 444,708",,"Africa/Nairobi",,,,,,,"1410","420",,,,,"1410","420",,,,,"1410","420",,,,,"1410","420",,,,,"1410","420",,,,,"1410","420",,,,,"Utalii Street View Park Towers Ground Floor and Street Entrance on Utalii Lane, Nairobi Kenya","https://www.tripadvisor.com/Restaurant_Review-g294207-d16746444-Reviews-The_Collective_Restaurant-Nairobi.html","-1.28339","36.81629","Dinner","Breakfast","Lunch","Drinks",,,"Dinner","Breakfast","Lunch","Drinks",,,"Reservations","Seating","Private Dining","Street Parking","Television","Serves Alcohol","Free Wifi","Accepts Credit Cards",,,,,,,,,,,,,,,,,,,,,,,,,,,,,,,,,,,,,,,,,,,,,
"#154 of 1,048 places to eat in Nairobi","Italian","European","Pizza","Mediterranean","Vegetarian Friendly",,,,,,,,,,,"https://media-cdn.tripadvisor.com/media/photo-o/0b/df/3d/e8/photo2jpg.jpg","35",,"294207","Nairobi","Municipality",,"294206","Kenya","Country",,,,,"http://www.dolcevitakenya.net/our-menu/","Closed Now","http://www.dolcevitakenya.net/","11","9","9","46","37","Nairobi","Kenya",,,"Limuru Road","Muthaiga Shopping Center",,,"","3.300611972808838","Restaurants",,"$$ - $$$","+254 722 624100","RESTAURANT","112","false","Sit down","Aperfect balance of elegance, comfort and refinement. A corner of Italy in Nairobi Romantic moment, lived in the large terrace, become uforgettable moments Italian cuisine ----in the best tradition, homemade mozzarella and pasta, pizza baked in a wood oven, the desserts of our production From the best Italian wineries a selection of over 80 varieties of wines are the pride of our restaurant","Nairobi","false",,"restaurant","4040718","booking@dolcevitakenya.net","154","833","La Dolce Vita","4",,,,,,,,,,,,,,,,,,,,,,,,,,,,,,,,,,,,,,,"Africa/Nairobi","1350","720",,,,,"1350","720",,,,,"1350","720",,,,,"1350","720",,,,,"1350","720",,,,,"1350","720",,,,,"1350","720",,,,,"Limuru Road Muthaiga Shopping Center, Nairobi Kenya","https://www.tripadvisor.com/Restaurant_Review-g294207-d4040718-Reviews-La_Dolce_Vita-Nairobi.html","-1.249783","36.820423","Lunch","Dinner",,,,,"Lunch","Dinner",,,,,"Wheelchair Accessible","Takeout","Reservations","Outdoor Seating","Seating","Free off-street parking","Serves Alcohol","Wine and Beer","Accepts American Express","Accepts Mastercard","Accepts Visa","Cash Only","Accepts Credit Cards","Parking Available","Highchairs Available","Full Bar",,,,,,,,,,,,,,,"Pasta","Lasagne","Pesto",,,,,,,,,,,,,,,,,,,,
"#152 of 1,048 places to eat in Nairobi","Sushi","Vegetarian Friendly","Vegan Options",,,,,,,,,,,,,"https://media-cdn.tripadvisor.com/media/photo-o/0c/77/1c/37/20160807-210105-largejpg.jpg","82",,"294207","Nairobi","Municipality",,"294206","Kenya","Country",,,,,"http://www.asiangardens.co.ke/menu/index?utm_source=Tripadvisor&utm_medium=Link-Menu&utm_campaign=Social-Media","Closed Now","http://www.asiangardens.co.ke/?utm_source=Tripadvisor&utm_medium=Link-Profile&utm_campaign=Social-Media","3","2","9","18","28","Nairobi","Kenya",,,"UN Avenue","Warwick Center, Gigiri. Right Next to U.S. Embassy","20484492","Highridge","","3.3061537742614746","Restaurants",,"$$ - $$$","+254 712 848770","RESTAURANT","60","false",,,"Nairobi","false",,"restaurant","10674891","Info@asianbykhazanah.com","152","833","Asian Gardens","4",,,,,,,,,,,,,,,,,,,,,,,,,,,,,,,,,,,,,,,"Africa/Nairobi","1320","690",,,,,,,,,,,"1320","690",,,,,"1320","690",,,,,"1320","690",,,,,"1320","690",,,,,"1320","690",,,,,"UN Avenue Warwick Center, Gigiri. Right Next to U.S. Embassy, Nairobi Kenya","https://www.tripadvisor.com/Restaurant_Review-g294207-d10674891-Reviews-Asian_Gardens-Nairobi.html","-1.232266","36.81227","Brunch","Lunch","Dinner","Drinks",,,"Brunch","Lunch","Dinner","Drinks",,,"Reservations","Outdoor Seating","Seating","Parking Available","Street Parking","Wheelchair Accessible","Full Bar","Accepts Mastercard","Accepts Visa","Delivery","Takeout","Highchairs Available","Serves Alcohol",,,,,,,,,,,,,,,,,,,,,,,,,,,,,,,,,,,,,,,,
"#151 of 1,048 places to eat in Nairobi","Cafe","Healthy","Vegetarian Friendly","Vegan Options",,,,,,,,,,,,"https://media-cdn.tripadvisor.com/media/photo-o/06/f8/96/f2/casual-bite.jpg","30",,"294207","Nairobi","Municipality",,"294206","Kenya","Country",,,,,,"Closed Now","http://www.facebook.com/casualbiteke","0","0","0","13","19","Nairobi","Kenya",,,"Woodvale Lane","Centro House",,,"","3.306410789489746","Restaurants",,"$$ - $$$","+254 727 468681","RESTAURANT","32","false","Café",,"Nairobi","false",,"restaurant","7268389","info@casualbite.co.ke","151","833","Casual Bite","4.5",,,,,,,,,,,,,,,,,,,,,,,,,,,,,,,,,,,,,,,"Africa/Nairobi",,,,,,,"1200","420",,,,,"1200","420",,,,,"1200","420",,,,,"1320","420",,,,,"1320","420",,,,,"1320","420",,,,,"Woodvale Lane Centro House, Nairobi Kenya","https://www.tripadvisor.com/Restaurant_Review-g294207-d7268389-Reviews-Casual_Bite-Nairobi.html","-1.263411","36.802593","Breakfast","Lunch","Dinner",,,,"Breakfast","Lunch","Dinner",,,,"Reservations","Seating","Takeout","Wheelchair Accessible","Serves Alcohol",,,,,,,,,,,,,,,,,,,,,,,,,,"Burger","Salad",,,,,,,,,,,,,,,,,,,,,
"#108 of 1,048 places to eat in Nairobi","Indian","Asian","Vegetarian Friendly","Vegan Options","Gluten Free Options",,,,,,,,,,,"https://media-cdn.tripadvisor.com/media/photo-o/0e/9e/2f/28/ambiance.jpg","48",,"294207","Nairobi","Municipality",,"294206","Kenya","Country",,,,,,"Closed Now","http://intercontinental.com/nairobi","4","0","17","41","35","Nairobi","Kenya","30353",,"Intercontinental hotel","City Hall Way, 00100, City Square","20484493","Nairobi Central Business District","","3.4623003005981445","Restaurants",,"$$ - $$$","+254 713 600609","RESTAURANT","97","false",,,"Nairobi","false",,"restaurant","5930835",,"108","833","Bhandini Restaurant","4",,,,,,,,,,,,,,,,,,,,,,,,,,,,,,,,,,,,,,,"Africa/Nairobi",,,,,,,"900","720","1350","1140",,,"900","720","1350","1140",,,"900","720","1350","1140",,,"900","720","1350","1140",,,"900","720","1350","1140",,,"1350","1140",,,,,"Intercontinental hotel City Hall Way, 00100, City Square, Nairobi 30353 Kenya","https://www.tripadvisor.com/Restaurant_Review-g294207-d5930835-Reviews-Bhandini_Restaurant-Nairobi.html","-1.288186","36.818916","Lunch","Dinner",,,,,"Lunch","Dinner",,,,,"Reservations","Seating","Wheelchair Accessible","Serves Alcohol","Parking Available",,,,,,,,,,,,,,,,,,,,,,,,,,"Curry",,,,,,,,,,,,,,,,,,,,,,
"#133 of 1,048 places to eat in Nairobi","Cafe","International","Mediterranean","European","Vegetarian Friendly",,,,,,,,,,,"https://media-cdn.tripadvisor.com/media/photo-o/06/79/1d/10/artcaffe.jpg","39",,"294207","Nairobi","Municipality",,"294206","Kenya","Country",,,,,"http://www.artcaffe.co.ke/menu/",,"http://artcaffe.co.ke","1","3","13","35","22","Nairobi","Kenya",,,"Dagaoretti Corner","Junction Mall",,,"","3.3524341583251953","Restaurants",,"$$ - $$$","+254 20 3741197","RESTAURANT","74","false","Sit down",,"Nairobi","false",,"restaurant","3971422",,"133","833","Artcaffe","4",,,,,,,,,,,,,,,,,,,,,,,,,,,,,,,,,,,,,,,,,,,,,,,,,,,,,,,,,,,,,,,,,,,,,,,,,,,,,,,,,,"Dagaoretti Corner Junction Mall, Nairobi Kenya","https://www.tripadvisor.com/Restaurant_Review-g294207-d3971422-Reviews-Artcaffe-Nairobi.html","-1.258765","36.80552","Breakfast","Lunch","Dinner","Brunch","Late Night",,"Breakfast","Lunch","Dinner","Brunch","Late Night",,"Seating","Delivery","Takeout","Outdoor Seating","Highchairs Available","Wheelchair Accessible","Serves Alcohol",,,,,,,,,,,,,,,,,,,,,,,,"Salad",,,,,,,,,,,,,,,,,,,,,,
"#141 of 1,048 places to eat in Nairobi","Chinese","Vegan Options","Vegetarian Friendly",,,,,,,,,,,,,"https://media-cdn.tripadvisor.com/media/photo-o/0a/c5/bc/77/88-restaurant.jpg","11",,"294207","Nairobi","Municipality",,"294206","Kenya","Country",,,,,,"Closed Now","http://www.kempinski.com/en/nairobi/hotel-villa-rosa/dining/restaurants/88/","1","1","9","20","19","Nairobi","Kenya","00800",,"Chiromo Road","Villa Rosa Kempinski",,,"","3.325134754180908","Restaurants",,"$$$$","+254 20 3603000","RESTAURANT","50","false",,"Chef Wu is firing up our kitchen as Chef de cuisine, at 88 Lounge and Restaurant. We’re letting his gastronomic artistry tell us a story or two about being in the restaurant industry since the age of 15, and savouring the flamboyant flavours of Sichuan. We’ll let you work out the rest about the best, that is Chef Wu. We look forward to hosting you at 88 Lounge and Restaurant.","Nairobi","false",,"restaurant","8413239","dining.villarosa@kempinski.com","141","833","88","4",,,,,,,,,,,,,,,,,,,,,,,,,,,,,,,,,,,,,,,"Africa/Nairobi","1350","1050",,,,,,,,,,,"1350","1050",,,,,"1350","1050",,,,,"1350","1050",,,,,"1350","1050",,,,,"1350","1050",,,,,"Chiromo Road Villa Rosa Kempinski, Nairobi 00800 Kenya","https://www.tripadvisor.com/Restaurant_Review-g294207-d8413239-Reviews-88-Nairobi.html","-1.27176","36.8087","Dinner",,,,,,"Dinner",,,,,,"Reservations","Seating","Serves Alcohol","Takeout","Wheelchair Accessible",,,,,,,,,,,,,,,,,,,,,,,,,,"Tempura","Salad","Curry","Prawns",,,,,,,,,,,,,,,,,,,
"#140 of 1,048 places to eat in Nairobi","Bar","American",,,,,,,,,,,,,,"https://media-cdn.tripadvisor.com/media/photo-o/0f/83/79/55/caption.jpg","64",,"294207","Nairobi","Municipality",,"294206","Kenya","Country",,,,,,,"https://www.facebook.com/urbanburgers","21","5","17","56","58","Nairobi","Kenya",,,"Westage Mall","Galleria Mall. Karen, Two Rivers Mall",,,"","3.3300602436065674","Restaurants",,"$$ - $$$","+254 20 3746172","RESTAURANT","157","false","Sit down",,"Nairobi","false",,"restaurant","4093303",,"140","833","Urban Gourmet Burgers","4",,,,,,,,,,,,,,,,,,,,,,,,,,,,,,,,,,,,,,,,,,,,,,,,,,,,,,,,,,,,,,,,,,,,,,,,,,,,,,,,,,"Westage Mall Galleria Mall. Karen, Two Rivers Mall, Nairobi Kenya","https://www.tripadvisor.com/Restaurant_Review-g294207-d4093303-Reviews-Urban_Gourmet_Burgers-Nairobi.html","-1.257051","36.80298","Lunch","Dinner","Brunch",,,,"Lunch","Dinner","Brunch",,,,"Delivery","Takeout","Seating","Television","Highchairs Available","Wheelchair Accessible","Serves Alcohol","Full Bar","Free Wifi","Parking Available",,,,,,,,,,,,,,,,,,,,,"Cheeseburger","Burger","Salad","Wings","Chili","Beef","Lamb",,,,,,,,,,,,,,,,
"#143 of 1,048 places to eat in Nairobi","African",,,,,,,,,,,,,,,"https://media-cdn.tripadvisor.com/media/photo-s/03/d6/4c/1a/delicious-fish-ugali.jpg","63",,"294207","Nairobi","Municipality",,"294206","Kenya","Country",,,,,,"Open Now","http://www.facebook.com/MAMA-Oliech-Restaurant-879977065412004/","2","7","20","38","24","Nairobi","Kenya",,,"Marcus Garvey Road",,"20484494","Upper Hill Estate","","3.322847366333008","Restaurants",,"$$ - $$$","+254 723 925604","RESTAURANT","91","false","Sit down",,"Nairobi","false",,"restaurant","4148637",,"143","833","Mama Oliech's Restaurant","4",,,,,,,,,,,,,,,,,,,,,,,,,,,,,,,,,,,,,,,"Africa/Nairobi","1410","630",,,,,"1410","630",,,,,"1410","630",,,,,"1410","630",,,,,"1410","630",,,,,"1410","630",,,,,"1410","630",,,,,"Marcus Garvey Road, Nairobi Kenya","https://www.tripadvisor.com/Restaurant_Review-g294207-d4148637-Reviews-Mama_Oliech_s_Restaurant-Nairobi.html","-1.294243","36.79136","Lunch","Dinner",,,,,"Lunch","Dinner",,,,,"Takeout","Reservations","Seating","Parking Available","Serves Alcohol","Table Service","Television",,,,,,,,,,,,,,,,,,,,,,,,"Tilapia","Fish",,,,,,,,,,,,,,,,,,,,,
"#136 of 1,048 places to eat in Nairobi","European","Vegetarian Friendly",,,,,,,,,,,,,,"https://media-cdn.tripadvisor.com/media/photo-m/1280/18/68/7f/b5/photo-shoot-by-mukutan.jpg","27",,"294207","Nairobi","Municipality",,"294206","Kenya","Country",,,,,"http://qrco.de/bbXr5E?trackSharing","Closed Now","http://www.clhg.com","2","4","10","34","30","Nairobi","Kenya","",,"Bishops Road","In the Fairview Hotel","20484494","Upper Hill Estate","","3.3393211364746094","Restaurants",,"$$ - $$$","+254 722 204429","RESTAURANT","80","false","Sit down","Mukutan Garden Café serves coffees and light meals such as sandwiches, pizzas and sushi in a relaxing setting of a beautiful water feature. The restaurant inside Fairview Hotel but many people from outside the hotel eat here. It has an international cuisine for dinner.","Nairobi","false",,"restaurant","2060171","fbook@clhg.com","136","833","Mukutan Garden Cafe'","4",,,,,,,,,,,,,,,,,,,,,,,,,,,,,,,,,,,,,"KES 296,472 - KES 592,944",,"Africa/Nairobi","1140","360",,,,,"1200","360",,,,,"1200","360",,,,,"1200","360",,,,,"1200","360",,,,,"1200","360",,,,,"1140","360",,,,,"Bishops Road In the Fairview Hotel, Nairobi Kenya","https://www.tripadvisor.com/Restaurant_Review-g294207-d2060171-Reviews-Mukutan_Garden_Cafe-Nairobi.html","-1.291467","36.81025","Lunch","Dinner","Brunch",,,,"Lunch","Dinner","Brunch",,,,"Reservations","Outdoor Seating","Seating","Parking Available","Full Bar","Validated Parking","Wheelchair Accessible","Serves Alcohol","Wine and Beer","Free Wifi","Accepts Credit Cards","Table Service","Waterfront",,,,,,,,,,,,,,,,,,"Sandwiches","Burger","Salad",,,,,,,,,,,,,,,,,,,,
