"#549 of 1,048 places to eat in Nairobi","Chinese","Indian","Pizza",,,,,,,,,,,,,"https://media-cdn.tripadvisor.com/media/photo-o/2a/56/3c/7c/serving-piping-hot-spicy.jpg","3",,"294207","Nairobi","Municipality",,"294206","Kenya","Country",,,,,,"Closed Now",,"0","0","0","0","1","Nairobi","Kenya",,,"Kusi Lane Between 2nd and 3rd Parklands Ave",,,,"","3.0446252822875977","Restaurants",,"$","+254755002002","RESTAURANT","1","false","Sit down","Pure Vegetarian Restaurant serving Breakfast Lunch and dinner.  Indian, Indo-Chinese, Pizza Chat-check out our menu. Many Vegan Options available","Nairobi","false",,"restaurant","25557781",,"549","833","Shayona Vegetarian Nairobi","5",,,,,,,,,,,,,,,,,,,,,,,,,,,,,,,,,,,,,"KES 29,647 - KES 177,883",,"Africa/Nairobi","1260","540",,,,,"1260","540",,,,,"1260","540",,,,,"1260","540",,,,,"1260","540",,,,,"1260","540",,,,,"1260","540",,,,,"Kusi Lane Between 2nd and 3rd Parklands Ave, Nairobi Kenya","https://www.tripadvisor.com/Restaurant_Review-g294207-d25557781-Reviews-Shayona_Vegetarian_Nairobi-Nairobi.html","-1.2599","36.81791","Breakfast","Lunch","Dinner",,,,"Breakfast","Lunch","Dinner",,,,"Delivery","Takeout","Reservations","Outdoor Seating","Seating","Parking Available","Television","Highchairs Available","Accepts Mastercard","Accepts Visa","Digital Payments","Free Wifi","Accepts Credit Cards","Non-smoking restaurants",,,,,,,,,,,,,,,,,,,,,,,,,,,,,,,,,,,,,,,
"#2 of 10 places to eat in Kiambu","African","Bar","Barbecue","Pub","Wine Bar","Soups",,,,,,,,,,,"0",,"1026022","Kiambu","City",,"2697614","Central Province","Province",,"294206","Kenya","Country",,"Open Now","http://www.todas-hotel.co.ke","0","0","0","0","0","Kiambu","Kenya",,,"Kiambu Kirigiti Road",,,,"","3.0445055961608887","Restaurants",,"$","+254 711 892097","RESTAURANT","0","false","Sit down","A modern restaurant located in Kirigiti, Kiambu, Kenya offering a safe space and serene environment for exceptionalservice to our customers. Open daily from 6:00am to 11:00pm. Enjoy our various services including dine-ins, take-aways, bar lounge, group platters and carwash services. Karibu sana!","Kiambu, Central Province","false",,"restaurant","23162507","info@todas-hotel.co.ke","2","7","Restaurant Todas Hotel",,,,,,,,,,,,,,,,,,,,,,,,,,,,,,,,,,,,,,"KES 44,471 - KES 296,472",,"Africa/Nairobi","1440","360",,,,,"1425","360",,,,,"1425","360",,,,,"1425","360",,,,,"1425","360",,,,,"1425","360",,,,,"1440","360",,,,,"Kiambu Kirigiti Road, Kiambu Kenya","https://www.tripadvisor.com/Restaurant_Review-g1026022-d23162507-Reviews-Restaurant_Todas_Hotel-Kiambu_Central_Province.html","-1.17203","36.841763","Breakfast","Lunch","Dinner",,,,"Breakfast","Lunch","Dinner",,,,,,,,,,,,,,,,,,,,,,,,,,,,,,,,,,,,,,,,,,,,,,,,,,,,,,,,
"#556 of 1,048 places to eat in Nairobi","African",,,,,,,,,,,,,,,"https://media-cdn.tripadvisor.com/media/photo-m/1280/29/d6/32/97/caption.jpg","3",,"294207","Nairobi","Municipality",,"294206","Kenya","Country",,,,,,"Open Now",,"0","0","0","0","1","Nairobi","Kenya",,,"Bishan Plaza",,,,"","3.0443708896636963","Bars & Pubs","Restaurants",,"+254 739 905415","RESTAURANT","1","false",,"Gentlemens Club","Nairobi","false",,"restaurant","26319337",,"556","833","Dollarz Lounge","5",,,,,,,,,,,,,,,,,,,,,,,,,,,,,,,,,,,,,,,"Africa/Nairobi","1800","1080",,,,,"1800","1080",,,,,"1800","1080",,,,,"1800","1080",,,,,"1800","1080",,,,,"1800","1080",,,,,"1800","1080",,,,,"Bishan Plaza, Nairobi Kenya","https://www.tripadvisor.com/Restaurant_Review-g294207-d26319337-Reviews-Dollarz_Lounge-Nairobi.html","-1.264464","36.805557","Dinner","Late Night","Drinks",,,,"Dinner","Late Night","Drinks",,,,"Seating","Parking Available","Highchairs Available","Full Bar","Accepts Mastercard","Accepts Visa","Digital Payments","Accepts Credit Cards",,,,,,,,,,,,,,,,,,,,,,,,,,,,,,,,,,,,,,,,,,,,,
"#546 of 1,048 places to eat in Nairobi",,,,,,,,,,,,,,,,"https://media-cdn.tripadvisor.com/media/photo-m/1280/17/7d/6d/6b/zeytoon-restaurant.jpg","13",,"294207","Nairobi","Municipality",,"294206","Kenya","Country",,,,,"http://www.zeytoonrestaurant.co.ke/menu/index?utm_source=Tripadvisor&utm_medium=Link-Menu&utm_campaign=Social-Media","Closed Now","http://www.zeytoonrestaurant.co.ke/?utm_source=Tripadvisor&utm_medium=Link-Profile&utm_campaign=Social-Media","0","1","0","2","2","Nairobi","Kenya","00601",,"123 Las Azucenas",,"20484492","Highridge","","3.044755220413208","Restaurants",,"$","(+254) 0757130041","RESTAURANT","5","false","Sit down","Fresh Food & Drinks There are many diets that lead to successful weight loss, if you follow strictly all the rules. However, diets that cause weight loss can not be considered equal to healthy eating. Diet is a strict limitation, due to which you have to change your style of eating or eating habits. Instead of wasting time choosing one of such diets, think about your health and style of life. First of all let’s figure out what foods and products are useful for our health.","Nairobi","false",,"restaurant","17413053",,"546","833","Barge Zeytoon - Lebanese Restaurant","4",,,,,,,,,,,,,,,,,,,,,,,,,,,,,,,,,,,,,"KES 14,824 - KES 281,648",,"Africa/Nairobi","1260","690",,,,,"1260","690",,,,,"1260","690",,,,,"1260","690",,,,,"1260","690",,,,,"1260","690",,,,,"1260","690",,,,,"123 Las Azucenas, Nairobi 00601 Kenya","https://www.tripadvisor.com/Restaurant_Review-g294207-d17413053-Reviews-Barge_Zeytoon_Lebanese_Restaurant-Nairobi.html","-1.229404","36.804802","Lunch","Dinner","Brunch","Drinks",,,"Lunch","Dinner","Brunch","Drinks",,,"Delivery","Takeout","Seating","Street Parking","Free off-street parking","Digital Payments","Free Wifi","Accepts Credit Cards",,,,,,,,,,,,,,,,,,,,,,,,,,,,,,,,,,,,,,,,,,,,,
"#5 of 12 places to eat in Narok","African","Bar","Grill","Pub","Diner","Beer restaurants",,,,,,,,,,"https://media-cdn.tripadvisor.com/media/photo-m/1280/29/5d/cb/14/caption.jpg","16",,"1026010","Narok","City",,"2697619","Rift Valley Province","Province",,"294206","Kenya","Country",,"Open Now",,"0","0","0","0","1","Narok","Kenya","20500",,"Along Narok-Nairobi highway",,,,"","3.0436160564422607","Restaurants",,,"+254 722 954017","RESTAURANT","1","false",,,"Narok, Rift Valley Province","false",,"restaurant","25756400",,"5","8","Maestro Bistro&Grill","5",,,,,,,,,,,,,,,,,,,,,,,,,,,,,,,,,,,,,,,"Africa/Nairobi","1620","420",,,,,"1620","420",,,,,"1620","420",,,,,"1620","420",,,,,"1620","420",,,,,"1620","420",,,,,"1620","420",,,,,"Along Narok-Nairobi highway, Narok 20500 Kenya","https://www.tripadvisor.com/Restaurant_Review-g1026010-d25756400-Reviews-Maestro_Bistro_Grill-Narok_Rift_Valley_Province.html","-1.292066","36.821945","Breakfast","Lunch","Dinner","Brunch","Late Night","Drinks","Breakfast","Lunch","Dinner","Brunch","Late Night","Drinks","Reservations","Parking Available","Highchairs Available","Wheelchair Accessible","Serves Alcohol","Wine and Beer","Accepts Mastercard","Accepts Visa","Digital Payments","Cash Only","Free Wifi","Accepts Credit Cards","Sports bars",,,,,,,,,,,,,,,,,,,,,,,,,,,,,,,,,,,,,,,,
"#6 of 8 places to eat in Lavington","Steakhouse","Brazilian","South American",,,,,,,,,,,,,"https://media-cdn.tripadvisor.com/media/photo-m/1280/29/ab/a4/c2/caption.jpg","17",,"15517142","Lavington","City",,"294207","Nairobi","Municipality",,"294206","Kenya","Country",,"Closes in 7 min","http://www.brazilianrodizio.co.ke","0","0","0","2","0","Lavington","Kenya",,,"Off Mbaazi Road",,,,"","3.0453145503997803","Restaurants",,,"+254 727 785302","RESTAURANT","2","false",,"Authentic Brazilian Rodizio all-you-can-eat steakhouse.","Lavington, Nairobi","false",,"restaurant","25113583","brazilianrodiziosocial@gmail.com","6","6","Brazilian Rodizio","4",,,,,,,,,,,,,,,,,,,,,,,,,,,,,,,,,,,,,,,"Africa/Nairobi","1380","540",,,,,"1380","540",,,,,"1380","540",,,,,"1380","540",,,,,"1380","540",,,,,"1380","540",,,,,"1380","540",,,,,"Off Mbaazi Road, Lavington, Nairobi Kenya","https://www.tripadvisor.com/Restaurant_Review-g15517142-d25113583-Reviews-Brazilian_Rodizio-Lavington_Nairobi.html","-1.278937","36.777798","Breakfast","Lunch","Dinner",,,,"Breakfast","Lunch","Dinner",,,,,,,,,,,,,,,,,,,,,,,,,,,,,,,,,,,,,,,,,,,,,,,,,,,,,,,,
"#545 of 1,048 places to eat in Nairobi","Barbecue","Pizza","Grill","Contemporary","Diner",,,,,,,,,,,"https://media-cdn.tripadvisor.com/media/photo-o/29/5f/00/9a/memories-are-made-of.jpg","16",,"294207","Nairobi","Municipality",,"294206","Kenya","Country",,,,,"https://www.adventurefarm.co.ke/restaurant","Closed Now","https://www.facebook.com/adventurefarmkaren/","0","0","0","0","1","Nairobi","Kenya",,,"Rhino Park North Road","Adventure Farm Karen",,,"","3.0448358058929443","Restaurants",,"$$ - $$$","+254 710 288004","RESTAURANT","1","false","Sit down","Farm to Table restaurant, serving amazingly delicious food made from organic ingredients grown or foraged from our Farm. We are committed not only to providing fresh ingredients and provide an authentic experience, serving you with wooden platters sourced from trees we have pruned on the farm. Prior to dining, you can learn what goes into cultivating the mouthwatering ingredients that make Adventure farm’s food. An experience all of its own with a tour through the farm grounds before or after your meals (tours should be booked in advance). Come enjoy our delicious meal, prepared by our professional, delightful crew in the most peaceful, relaxing atmosphere in Karen surrounded by nature.","Nairobi","false",,"restaurant","24856584","info@adventurefarm.co.ke","545","833","Adventure Cove","5",,,,,,,,,,,,,,,,,,,,,,,,,,,,,,,,,,,,,"KES 148,236 - KES 370,590",,"Africa/Nairobi","1140","540",,,,,"1080","540",,,,,"1080","540",,,,,"1080","540",,,,,"1080","540",,,,,"1140","540",,,,,"1140","540",,,,,"Rhino Park North Road Adventure Farm Karen, Nairobi Kenya","https://www.tripadvisor.com/Restaurant_Review-g294207-d24856584-Reviews-Adventure_Cove-Nairobi.html","-1.298813","36.687492","Breakfast","Lunch","Brunch","Drinks",,,"Breakfast","Lunch","Brunch","Drinks",,,"Delivery","Takeout","Reservations","Outdoor Seating","Private Dining","Seating","Parking Available","Highchairs Available","Wheelchair Accessible","Serves Alcohol","Wine and Beer","Free Wifi","Accepts Credit Cards","Table Service","Playgrounds","Family style","Non-smoking restaurants","Gift Cards Available",,,,,,,,,,,,,,,,,,,,,,,,,,,,,,,,,,,
"#543 of 1,048 places to eat in Nairobi","Asian","Thai",,,,,,,,,,,,,,"https://media-cdn.tripadvisor.com/media/photo-s/07/43/62/f7/crispy-chicken-springrolls.jpg","8",,"294207","Nairobi","Municipality",,"294206","Kenya","Country",,,,,"http://www.thaivillage.co.ke/menu/index?utm_source=Tripadvisor&utm_medium=Link-Menu&utm_campaign=Social-Media","Closed Now","http://www.thaivillage.co.ke/?utm_source=Tripadvisor&utm_medium=Link-Profile&utm_campaign=Social-Media","4","0","2","9","4","Nairobi","Kenya",,,"Limuru Road",,"20484492","Highridge","","3.0450503826141357","Restaurants",,"$","+254 727 329937","RESTAURANT","19","false","Sit down",,"Nairobi","false",,"restaurant","7198164",,"543","833","Thai Village","3.5",,,,,,,,,,,,,,,,,,,,,,,,,,,,,,,,,,,,,,,"Africa/Nairobi","1260","690",,,,,"1260","690",,,,,"1260","690",,,,,"1260","690",,,,,"1260","690",,,,,"1260","690",,,,,"1260","690",,,,,"Limuru Road, Nairobi Kenya","https://www.tripadvisor.com/Restaurant_Review-g294207-d7198164-Reviews-Thai_Village-Nairobi.html","-1.23139","36.80361","Lunch","Dinner",,,,,"Lunch","Dinner",,,,,"Takeout","Delivery","Seating","Wheelchair Accessible",,,,,,,,,,,,,,,,,,,,,,,,,,,,,,,,,,,,,,,,,,,,,,,,,
,"American","African","Cafe",,,,,,,,,,,,,"https://media-cdn.tripadvisor.com/media/photo-m/1280/28/bd/b2/e7/whether-you-re-a-resident.jpg","14",,"294207","Nairobi","Municipality",,"294206","Kenya","Country",,,,,"https://glv.co.ke/wp-content/uploads/2023/05/GLV-Food-Menu-Combined-2023.pdf","Closed Now","https://glv.co.ke/5th-avenue/","0","0","0","0","1","Nairobi","Kenya",,,"QR86+JMQ 238, United Nations Ave, Nairobi, Kenya",,,,"",,"Restaurants",,,"+254 100 200200","RESTAURANT","1","false",,"Nestled in the heart of Gigiri, 5th Avenue Restaurant is a culinary gem that should be on everyone's list of must-visit destinations. The restaurant is located in Gigiri Lion Villas 2, which is a part of a luxurious residential complex that is known for its stunning architecture, lavish interiors, and exceptional service. The restaurant itself is a unique and exclusive establishment that stands out for its high-quality ingredients, healthy and delectable cuisine, and an ambiance that is elegant and inviting. One of the standout features of 5th Avenue Restaurant is its talented and highly skilled chef, who has created a menu that showcases his culinary artistry and passion for food. Using only the finest ingredients, the chef has crafted a menu that is a true celebration of taste, texture, and flavor. From appetizers to desserts, each dish is a masterpiece that is sure to tantalize your taste buds and leave you craving for more. The menu at 5th Avenue Restaurant is not only delicious but also healthy. The restaurant prides itself on using fresh, local, and organic ingredients wherever possible, and the chef takes great care to ensure that each dish is prepared with the utmost attention to detail. The restaurant also offers a range of vegetarian, vegan, and gluten-free options, making it an ideal dining destination for those with specific dietary requirements. Apart from the food, the ambiance at 5th Avenue Restaurant is another standout feature. The restaurant is tastefully decorated with elegant furniture, subtle lighting, and warm colors that create a cozy and inviting atmosphere. Whether you're looking for a romantic dinner for two or a night out with friends, the restaurant provides the perfect setting for a memorable dining experience. To top it all off, 5th Avenue Restaurant has earned accolades from food critics and enthusiasts alike. The restaurant has been listed in Business Daily as one of the best restaurants in the world, and it's not hard to see why. With its exceptional service, delicious and healthy cuisine, and elegant ambiance, 5th Avenue Restaurant is a must-visit destination for anyone looking for a luxurious and unforgettable dining experience. Gigiri Lion Villas 1 and 2 are conveniently located in the heart of Gigiri. Gigiri Lion Villas 1 is situated on 74 UN Crescent, opposite the Swedish Embassy, while Gigiri Lion Villas 2 is located on 238 Gigiri Drive, just past the US Embassy. With its central location, 5th Avenue Restaurant is easily accessible and the perfect destination for anyone looking for a high-end dining experience. Don't miss the chance to indulge in the mouth-watering cuisine at 5th Avenue Restaurant.","Nairobi","false",,"restaurant","25387244","frontdesk@glv.co.ke",,,"5th Avenue Restaurant",,,,,,,,,,,,,,,,,,,,,,,,,,,,,,,,,,,,,,,,"Africa/Nairobi","1290","420",,,,,"1290","420",,,,,"1290","420",,,,,"1290","420",,,,,"1290","420",,,,,"1290","420",,,,,"1290","420",,,,,"QR86+JMQ 238, United Nations Ave, Nairobi, Kenya, Nairobi Kenya","https://www.tripadvisor.com/Restaurant_Review-g294207-d25387244-Reviews-5th_Avenue_Restaurant-Nairobi.html","-1.229718","36.813477","Breakfast","Lunch","Dinner","Brunch","Drinks",,"Breakfast","Lunch","Dinner","Brunch","Drinks",,"Delivery","Takeout","Reservations","Outdoor Seating","Buffet","Private Dining","Seating","Parking Available","Wheelchair Accessible","Accepts American Express","Accepts Mastercard","Accepts Visa","Digital Payments","Free Wifi","Accepts Discover","Accepts Credit Cards","BYOB","Non-smoking restaurants",,,,,,,,,,,,,,,,,,,,,,,,,,,,,,,,,,,
"#538 of 1,048 places to eat in Nairobi",,,,,,,,,,,,,,,,"https://media-cdn.tripadvisor.com/media/photo-o/0b/6f/f6/8d/photo1jpg.jpg","6",,"294207","Nairobi","Municipality",,"294206","Kenya","Country",,,,,,,,"0","0","0","3","1","Nairobi","Kenya",,,"El-Molo Drive","At The Nairobi Jaffery Sports Club",,,"","3.046043634414673","Restaurants",,"$$ - $$$",,"RESTAURANT","4","false",,,"Nairobi","false",,"restaurant","10074414","info@periperigrillltd.com","538","833","Peri Peri","4.5",,,,,,,,,,,,,,,,,,,,,,,,,,,,,,,,,,,,,,,,,,,,,,,,,,,,,,,,,,,,,,,,,,,,,,,,,,,,,,,,,,"El-Molo Drive At The Nairobi Jaffery Sports Club, Nairobi Kenya","https://www.tripadvisor.com/Restaurant_Review-g294207-d10074414-Reviews-Peri_Peri-Nairobi.html","-1.27759","36.76896",,,,,,,,,,,,,,,,,,,,,,,,,,,,,,,,,,,,,,,,,,,,,,,,,,,,,,,,,,,,,,,,,
"#539 of 1,048 places to eat in Nairobi",,,,,,,,,,,,,,,,"https://media-cdn.tripadvisor.com/media/photo-o/0f/a3/e0/a6/g-cafe.jpg","10",,"294207","Nairobi","Municipality",,"294206","Kenya","Country",,,,,,"Closed Now","http://www.masaicoffee.com","1","0","1","0","6","Nairobi","Kenya","00623",,"Thika Road","Mountain Mall",,,"","3.0459401607513428","Restaurants",,,"+254 738 781082","RESTAURANT","8","false","Café","Masai Coffee is Goldrock's own blend of Kenya's finest home grown coffee, aiming at trade for both green beans and roasted coffee. Goldrock international has highly qualified liqueurs and coffee analyst who make sure your packet of coffee has nothing but the best quality of coffee. Masai coffee is a licensed broker with the Kenya planters co- operative union ( KPCU ) to purchase high quality green beans to meets it's client high standard all over the world.","Nairobi","false",,"restaurant","10372308","marketing@goldrockkenya.com","539","833","G-cafe Masai Coffee","4.5",,,,,,,,,,,,,,,,,,,,,,,,,,,,,,,,,,,,,,,"Africa/Nairobi","1260","480",,,,,"1260","480",,,,,"1260","480",,,,,"1260","480",,,,,"1260","480",,,,,"1260","480",,,,,"1260","480",,,,,"Thika Road Mountain Mall, Nairobi 00623 Kenya","https://www.tripadvisor.com/Restaurant_Review-g294207-d10372308-Reviews-G_cafe_Masai_Coffee-Nairobi.html","-1.232947","36.873886","Breakfast","Lunch","Dinner","Brunch","Drinks",,"Breakfast","Lunch","Dinner","Brunch","Drinks",,"Takeout","Parking Available","Validated Parking","Accepts American Express","Accepts Mastercard","Accepts Visa","Free Wifi",,,,,,,,,,,,,,,,,,,,,,,,,,,,,,,,,,,,,,,,,,,,,,
"#574 of 1,048 places to eat in Nairobi",,,,,,,,,,,,,,,,,"0",,"294207","Nairobi","Municipality",,"294206","Kenya","Country",,,,,,,,"0","1","0","1","2","Nairobi","Kenya",,,"Village Market, Lumuri Road",,"20484492","Highridge","","3.0419669151306152","Restaurants",,,"+254 702 993254","RESTAURANT","4","false",,,"Nairobi","false",,"restaurant","13134894",,"574","833","Terimisu Bakery","4",,,,,,,,,,,,,,,,,,,,,,,,,,,,,,,,,,,,,,,,,,,,,,,,,,,,,,,,,,,,,,,,,,,,,,,,,,,,,,,,,,"Village Market, Lumuri Road, Nairobi Kenya","https://www.tripadvisor.com/Restaurant_Review-g294207-d13134894-Reviews-Terimisu_Bakery-Nairobi.html","-1.22919","36.80465",,,,,,,,,,,,,,,,,,,,,,,,,,,,,,,,,,,,,,,,,,,,,,,,,,,,,,,,,,,,,,,,,
"#572 of 1,048 places to eat in Nairobi",,,,,,,,,,,,,,,,,"0",,"294207","Nairobi","Municipality",,"294206","Kenya","Country",,,,,,"Closed Now","https://www.facebook.com/Savanna-Restaurant-Kenya-2103987446298257/","0","0","0","0","1","Nairobi","Kenya",,,"Ralph Bunche Rd","next to General Accidents House","20484494","Upper Hill Estate","","3.0420279502868652","Restaurants",,,"+254 729 800800","RESTAURANT","1","false",,"The brand is a representation of a modern twist tied to nodes of tradition culinary. From the onset, the restaurant was set-up to allow its customers to experience African authenticity yet incorporating contemporary feel. This can be witnessed in the ambiance of all our restaurants and far more in our menu.","Nairobi","false",,"restaurant","17671615","info@savannarestaurant.co.ke","572","833","Savanna Restaurant","5",,,,,,,,,,,,,,,,,,,,,,,,,,,,,,,,,,,,,,,"Africa/Nairobi","1080","540",,,,,"1260","390",,,,,"1260","390",,,,,"1260","390",,,,,"1260","390",,,,,"1260","390",,,,,"1260","390",,,,,"Ralph Bunche Rd next to General Accidents House, Nairobi Kenya","https://www.tripadvisor.com/Restaurant_Review-g294207-d17671615-Reviews-Savanna_Restaurant-Nairobi.html","-1.29575","36.807125","Breakfast","Lunch","Dinner",,,,"Breakfast","Lunch","Dinner",,,,,,,,,,,,,,,,,,,,,,,,,,,,,,,,,,,,,,,,,,,,,,,,,,,,,,,,
"#544 of 1,048 places to eat in Nairobi","Cafe",,,,,,,,,,,,,,,"https://media-cdn.tripadvisor.com/media/photo-m/1280/27/dd/a3/7c/the-living-room.jpg","13",,"294207","Nairobi","Municipality",,"294206","Kenya","Country",,,,,"https://tsh.menu/location?id=the-living-room-social-house-nairobi","Open Now","http://www.thesocialhouse.ke","0","0","0","0","1","Nairobi","Kenya","00100",,"154 James Gichuru Road","Lavington Nairobi",,,"","3.044865846633911","Restaurants",,"$","+254 709 216000","RESTAURANT","1","false","Café","24-hour Café-bar and Coffee Roastery Informal hang-out at the heart of the House Casual dining and take-outs Emphasis on healthy / light cuisine","Nairobi","false",,"restaurant","21138177","mourine@thesocialhouse.ke","544","833","The Living Room","5",,,,,,,,,,,,,,,,,,,,,,,,,,,,,,,,,,,,,"KES 29,647 - KES 296,472",,"Africa/Nairobi","1439","0",,,,,"1439","0",,,,,"1439","0",,,,,"1439","0",,,,,"1439","0",,,,,"1439","0",,,,,"1439","0",,,,,"154 James Gichuru Road Lavington Nairobi, Nairobi 00100 Kenya","https://www.tripadvisor.com/Restaurant_Review-g294207-d21138177-Reviews-The_Living_Room-Nairobi.html","-1.283567","36.764297","Breakfast","Lunch","Dinner",,,,"Breakfast","Lunch","Dinner",,,,,,,,,,,,,,,,,,,,,,,,,,,,,,,,,,,,,,,,,,,,,,,,,,,,,,,,
"#587 of 1,048 places to eat in Nairobi","American","Cafe","Fast Food","Diner","Soups",,,,,,,,,,,"https://media-cdn.tripadvisor.com/media/photo-o/07/fc/43/e5/jumuia-coffee-house.jpg","2",,"294207","Nairobi","Municipality",,"294206","Kenya","Country",,,,,"http://www.jumuiacoffee.com/menu.html",,"http://www.jumuiacoffee.com/","0","1","5","4","2","Nairobi","Kenya",,,"Kenyatta Avenue","Located Within All Saints Cathedral Church","20484493","Nairobi Central Business District","","3.039879083633423","Restaurants",,"$$ - $$$","+254 704 413750","RESTAURANT","12","false","Café",,"Nairobi","false",,"restaurant","8122590","info@jumuiacoffee.com","587","833","Jumuia Coffee House","3.5",,,,,,,,,,,,,,,,,,,,,,,,,,,,,,,,,,,,,,,,,,,,,,,,,,,,,,,,,,,,,,,,,,,,,,,,,,,,,,,,,,"Kenyatta Avenue Located Within All Saints Cathedral Church, Nairobi Kenya","https://www.tripadvisor.com/Restaurant_Review-g294207-d8122590-Reviews-Jumuia_Coffee_House-Nairobi.html","-1.28476","36.82093",,,,,,,,,,,,,"Wheelchair Accessible",,,,,,,,,,,,,,,,,,,,,,,,,,,,,,,,,,,,,,,,,,,,,,,,,,,,
"#747 of 1,048 places to eat in Nairobi","Cafe",,,,,,,,,,,,,,,,"0",,"294207","Nairobi","Municipality",,"294206","Kenya","Country",,,,,,,"https://www.facebook.com/vidaecaffeke/","0","0","2","0","0","Nairobi","Kenya",,,"James Gichuru Road",,,,"","3","Restaurants",,,"+254 711 653717","RESTAURANT","2","false","Café",,"Nairobi","false",,"restaurant","15049827","customercare@innscorkenya.co.ke","747","833","Vida e Caffe","3",,,,,,,,,,,,,,,,,,,,,,,,,,,,,,,,,,,,,,,,,,,,,,,,,,,,,,,,,,,,,,,,,,,,,,,,,,,,,,,,,,"James Gichuru Road, Nairobi Kenya","https://www.tripadvisor.com/Restaurant_Review-g294207-d15049827-Reviews-Vida_e_Caffe-Nairobi.html","-1.2819","36.76729",,,,,,,,,,,,,,,,,,,,,,,,,,,,,,,,,,,,,,,,,,,,,,,,,,,,,,,,,,,,,,,,,
"#803 of 1,048 places to eat in Nairobi","African",,,,,,,,,,,,,,,"https://media-cdn.tripadvisor.com/media/photo-o/13/c8/01/b6/20180720-201513-largejpg.jpg","3",,"294207","Nairobi","Municipality",,"294206","Kenya","Country",,,,,,,,"2","0","2","1","0","Nairobi","Kenya",,,"Muthithi Road","Vision Towers",,,"","2.7772088050842285","Restaurants",,"$$ - $$$","+254 724 495600","RESTAURANT","5","false",,,"Nairobi","false",,"restaurant","12456394",,"803","833","Ismailia Restaurant","2.5",,,,,,,,,,,,,,,,,,,,,,,,,,,,,,,,,,,,,,,,,,,,,,,,,,,,,,,,,,,,,,,,,,,,,,,,,,,,,,,,,,"Muthithi Road Vision Towers, Nairobi Kenya","https://www.tripadvisor.com/Restaurant_Review-g294207-d12456394-Reviews-Ismailia_Restaurant-Nairobi.html","-1.26551","36.80667",,,,,,,,,,,,,,,,,,,,,,,,,,,,,,,,,,,,,,,,,,,,,,,,,,,,,,,,,,,,,,,,,
"#597 of 1,048 places to eat in Nairobi","African",,,,,,,,,,,,,,,"https://media-cdn.tripadvisor.com/media/photo-m/1280/22/7c/18/be/the-hood.jpg","1",,"294207","Nairobi","Municipality",,"294206","Kenya","Country",,,,,,,,"0","0","0","0","1","Nairobi","Kenya",,,"Kasuku Road",,,,"","3.0375289916992188","Restaurants",,,"+254 720 794824","RESTAURANT","1","false",,,"Nairobi","false",,"restaurant","17349726",,"597","832","The Hood","5",,,,,,,,,,,,,,,,,,,,,,,,,,,,,,,,,,,,,,,,,,,,,,,,,,,,,,,,,,,,,,,,,,,,,,,,,,,,,,,,,,"Kasuku Road, Nairobi Kenya","https://www.tripadvisor.com/Restaurant_Review-g294207-d17349726-Reviews-The_Hood-Nairobi.html","-1.26031","36.82367",,,,,,,,,,,,,,,,,,,,,,,,,,,,,,,,,,,,,,,,,,,,,,,,,,,,,,,,,,,,,,,,,
"#302 of 1,048 places to eat in Nairobi","Cafe","Diner","Mexican","African","Healthy",,,,,,,,,,,"https://media-cdn.tripadvisor.com/media/photo-m/1280/18/d8/8a/ad/20190805-125236-largejpg.jpg","2",,"294207","Nairobi","Municipality",,"294206","Kenya","Country",,,,,"https://www.javahouseafrica.com/our-menu/","Closed Now","http://www.javahouseafrica.com/our-locations/","0","1","4","9","2","Nairobi","Kenya",,,"Monrovia St","Corner of Monrovia street and Koinange street","20484493","Nairobi Central Business District","","3.1321568489074707","Restaurants",,"$","+254 746 622200","RESTAURANT","16","false","Café",,"Nairobi","false",,"restaurant","14006370","guest.relations@javahouseafrica.com","302","833","Java House","4",,,,,,,,,,,,,,,,,,,,,,,,,,,,,,,,,,,,,"KES 22,235 - KES 177,883",,"Africa/Nairobi","1200","480",,,,,"1320","390",,,,,"1320","390",,,,,"1320","390",,,,,"1320","390",,,,,"1320","390",,,,,"1260","420",,,,,"Monrovia St Corner of Monrovia street and Koinange street, Nairobi Kenya","https://www.tripadvisor.com/Restaurant_Review-g294207-d14006370-Reviews-Java_House-Nairobi.html","-1.281921","36.816406","Breakfast","Lunch","Dinner","Brunch",,,"Breakfast","Lunch","Dinner","Brunch",,,"Seating","Delivery","Takeout","Outdoor Seating","Parking Available","Highchairs Available","Free Wifi","Accepts Credit Cards",,,,,,,,,,,,,,,,,,,,,,,,,,,,,,,,,,,,,,,,,,,,,
